id,type,ref_to,timestamp,author_name,author_nickname,author_id,author_avatar_url,content
1280678791131299860,Default,,2024-09-04T00:00:17.667+00:00,bevburke,Beverly💕,1274516658597138493,assets\8569adcbd36c70a7578c017bf5604ea5-E0A3E.png,Need link to sign up to complete this training.
1280682132875907104,Default,,2024-09-04T00:13:34.401+00:00,kahlossolking,Vernon J. [AL] MOD,505706962101469204,assets\471b09011786f17f468f22e3a205db86-1986C.png,"Hello Beverly.  Please find the following links for Vote Team Training:

Shadow Shift: https://events.democrats.org/event/665877/

VOTE Team Chat Captain Training: https://events.democrats.org/event/654850/

VOTE Team Data Captain Training: https://events.democrats.org/event/654890/

VOTE Team Facilitator Training: REACH Edition: https://events.democrats.org/event/655170/

VOTE Team Facilitator Training: Phone Bank Edition: https://events.democrats.org/event/654762/"
