id,type,ref_to,timestamp,author_name,author_nickname,author_id,author_avatar_url,content
1268717303030349855,Default,,2024-08-01T23:49:36.67+00:00,gailwaldby,Gail Waldby,1256282021962055682,assets\d4fcd3e6b11457a95896ffae23db27f8-690EF.png,The Montana Megaphone project has graphics that support Democratic policies and Senator Jon Tester https://mt.ourmegaphone.org/
1271893005690998836,Default,,2024-08-10T18:08:43.186+00:00,ktmg,KTMG  • Community Mod,447570500030562314,assets\4ab56c60f334133787a2e11eccf36d79-7F4A0.png,"This is just a reminder that you can sign up to phone bank, canvass, get trainings  or take other actions at https://events.democrats.org/ in your state or in one of our battleground states (NC, PA, GA, NH, WI, PA, MI, AZ, NV). Volunteers like you make all the difference! We look forward to seeing you at an event soon."
1276263102752751758,Default,,2024-08-22T19:33:55.518+00:00,carb.on,Carolyn • Lead Mod,568257600228032512,assets\28a90c77b5793d80eb62484a43c66748-D8837.png,## [Montana Voter Information](https://www.vote.org/state/montana/)
1276263124441501746,ChannelPinnedMessage,1276263102752751758,2024-08-22T19:34:00.689+00:00,carb.on,Carolyn • Lead Mod,568257600228032512,assets\28a90c77b5793d80eb62484a43c66748-D8837.png,Pinned a message.
1277454011288784937,Default,,2024-08-26T02:26:10.239+00:00,revka_ordo,Revka-Ordo,308031439755149315,assets\b988f852d38cfea10a5a86c94c5c4488-BDDEC.png,"Western MT peeps: the mail sort facility for letters was moved to Spokane from Missoula with no public announcement, and it’s adding 2-3 days to mail times. Plan ahead if you mail in your ballot."
1279244491018211349,Reply,1277454011288784937,2024-08-31T01:00:53.872+00:00,gentle.storm,MAC,696402442270801953,assets\627a8a664156cb1dbc63c1d763551084-1E936.png,Does it have to be recieved by election day? I thought it has to be postmarked by election day. I'm planning to vote in person but most people I know are voting by mail so I want to make sure I give them good info if I encourage people to vote early.
1279271753058746439,Reply,1279244491018211349,2024-08-31T02:49:13.649+00:00,revka_ordo,Revka-Ordo,308031439755149315,assets\b988f852d38cfea10a5a86c94c5c4488-BDDEC.png,"They need to be RECEIVED by 8PM the day of the election. If you change your status to absentee ballot 30 days or less before the election, you must pick up the ballot at the election office.

https://sosmt.gov/elections/absentee/"
1279272231100223489,Default,,2024-08-31T02:51:07.623+00:00,revka_ordo,Revka-Ordo,308031439755149315,assets\b988f852d38cfea10a5a86c94c5c4488-BDDEC.png,"Also, Montanans need to start voting in every election. Skip one and you are marked “inactive” and your signature no longer counts for ballot initiatives. More Republican gamesmanship."
1279272615462305946,Default,,2024-08-31T02:52:39.262+00:00,revka_ordo,Revka-Ordo,308031439755149315,assets\b988f852d38cfea10a5a86c94c5c4488-BDDEC.png,#votejessemullen
1279299157005172788,Reply,1279272231100223489,2024-08-31T04:38:07.259+00:00,gentle.storm,MAC,696402442270801953,assets\627a8a664156cb1dbc63c1d763551084-1E936.png,"Does that include primaries? I've been living in Minneapolis for 10 yrs. I thought I'd kept up with MT politics but guess I have some reading to do...I knew the signatures were a big deal but haven't heard about the ""inactive"" status."
1279306868434538546,Reply,1279299157005172788,2024-08-31T05:08:45.807+00:00,revka_ordo,Revka-Ordo,308031439755149315,assets\b988f852d38cfea10a5a86c94c5c4488-BDDEC.png,"I don’t think it’s primaries or the local county elections, just any federal election. A bunch of people skipped midterms and got screwed. (“Every” was not specific enough, my mistake.)"
1279307115714052097,Default,,2024-08-31T05:09:44.763+00:00,revka_ordo,Revka-Ordo,308031439755149315,assets\b988f852d38cfea10a5a86c94c5c4488-BDDEC.png,"The statute *says* Federal, but the statute ALSO *says* they are supposed be warn you by mail first before moving your status."
1279307784575258634,Default,,2024-08-31T05:12:24.232+00:00,gentle.storm,MAC,696402442270801953,assets\627a8a664156cb1dbc63c1d763551084-1E936.png,Thanks for the clarification! Super helpful.
1280372838225805352,Default,,2024-09-03T03:44:32.81+00:00,jean9_28218_79932,Jeannine • Lead Mod,1266879741785538682,assets\54ff5e8dfab835d878a961f9f7b7d161-6C0EE.png,"<a:star_wave:1269735420359606369> Hey, Team! We know you want to help make a difference! Did you know though that hosting a debate watch party is an amazing way to get involved and bring people together? <a:rainbow_heart_scribble:1269029739432120465> It’s all about good vibes, great conversations, and getting folks fired up for the election. Your watch party could be the spark that motivates someone to vote! <a:PinkFlames:1252802562659193004>  [Register your watch party](https://events.democrats.org/c/host-a-debate-watch-party/event/create/) to get access to all sorts of resources for throwing a successful debate watch party, including a [Host Information Session](https://events.democrats.org/event/677337/). <a:ThanksRainbow:1278765693579431967>"
1280813698142965862,Default,,2024-09-04T08:56:22.005+00:00,trumansleeps,Michael Pelaez | FL,389839010576465936,assets\3a91c3446fca9803ffb1d856364145a2-A8603.png,https://www.mobilize.us/voteriders/event/564817/?referring_vol=6684605&rname=Michael&share_context=event_details&share_medium=copy_link
1283845754942783540,Default,,2024-09-12T17:44:40.679+00:00,trumansleeps,Michael Pelaez | FL,389839010576465936,assets\3a91c3446fca9803ffb1d856364145a2-A8603.png,Let's get a volunteer wave going! Repond on a thread with how many events you signed up to! Let's make the goal 5+  https://www.mobilize.us/events/montana-volunteer-opportunities/
1285809252912467998,Default,,2024-09-18T03:46:55.075+00:00,starkittynmom,Jennifer • [Lead Mod],1276944250491113656,assets\a_2aba4b7f19fcab5fe5391fcdb73d735d-D670A.gif,"<:bluewave3:1270555729836900453> <:bluewave3:1270555729836900453> <:bluewave3:1270555729836900453> <:bluewave3:1270555729836900453> <:bluewave3:1270555729836900453> <:bluewave3:1270555729836900453> <:bluewave3:1270555729836900453> <:bluewave3:1270555729836900453> <:bluewave3:1270555729836900453> <:bluewave3:1270555729836900453> <:bluewave3:1270555729836900453> <:bluewave3:1270555729836900453> 
**COOL STUFF ALERT**

Hey everyone : 
The moderators of www.reddit.com/r/VoteDem and r/Bluemidterm2018 (the FORMER moderators of r/Voteblue) made this amazing spreadsheet:

https://docs.google.com/spreadsheets/d/1jxO8g7q9VO3ZMAABcrvR7PMyX4Yl6dgIYhD3eRTKk1M/edit?usp=sharing
This Google Sheet has links to the sign up pages for HUNDREDS of opportunities to engage from home for campaigns across the country. Check it out and sign up! Let's keep going to build this BLUE WAVE!
<:bluewave3:1270555729836900453> <:bluewave3:1270555729836900453> <:bluewave3:1270555729836900453> <:bluewave3:1270555729836900453> <:bluewave3:1270555729836900453> <:bluewave3:1270555729836900453> <:bluewave3:1270555729836900453> <:bluewave3:1270555729836900453> <:bluewave3:1270555729836900453> <:bluewave3:1270555729836900453> <:bluewave3:1270555729836900453> <:bluewave3:1270555729836900453>"
1287924135657472043,Reply,1279244491018211349,2024-09-23T23:50:42.414+00:00,alzakex,Karsten Bondy[MT/CA] (Call Mod),784274313074966548,assets\fea0bde2a8fcc6f76c3da6e4f95ba409-8DC67.png,"Late-but-not-too-late suggestion: If they are worried obout their ballot getting there in time,  and you are going to  vote in person, you are legally  allowed to drop off absentee ballots of anyone to whom you are a ""caregiver, a family member, a household member, or an aquaintance,""  The new law says you can only bring in 6 ballots per election, but enforcement of that law is currently enjoined. So it's like speeding used to be."
1287936181195112542,Default,,2024-09-24T00:38:34.294+00:00,genericusername8797,S [MT/NM],465305140786888705,assets\a187dcd150192cbe1a6b1b9cb0ffe55c-6C116.png,I’m trying to find reputable sources to what’s happening with absentee ballots? Does anyone have a good source or better sense of what’s happening?
1287943416394682480,Default,,2024-09-24T01:07:19.3+00:00,alzakex,Karsten Bondy[MT/CA] (Call Mod),784274313074966548,assets\fea0bde2a8fcc6f76c3da6e4f95ba409-8DC67.png,"Right now it is working perfectly, as long as you don't want to vote for Kamala.:https://www.bozemandailychronicle.com/news/politics/elections/ballot-glitch-omits-kamala-harris-temporarily-halts-montana-online-absentee-voting-system/article_db25d492-08fc-57d5-98d1-89da75ab9207.html"
1288067467180249108,Default,,2024-09-24T09:20:15.312+00:00,apfee2024_81383,howdyfriends (KY),1274293080794595339,assets\eb95501477beed1d0f8fde71864b6435-9F719.png,<:clap:1252804035489169459>  https://www.reddit.com/r/Bumperstickers/comments/1fnx09o/rural_montana/
1288209182054551605,Reply,1287943416394682480,2024-09-24T18:43:22.771+00:00,genericusername8797,S [MT/NM],465305140786888705,assets\a187dcd150192cbe1a6b1b9cb0ffe55c-6C116.png,"Yeah that’s what I thought I read, but had slight hope that *surely* we couldn’t be *that* blatant. Sigh…"
1288240481418874961,Default,,2024-09-24T20:47:45.121+00:00,zunny74,Zunny A. (AK),1199911282623664181,assets\b4ef549817e2b5f7cbfce7d56ccac071-EE8C8.png,https://discord.com/channels/1242249109298221066/1268354336677822594/1288239689182089267
1288403363112816661,Reply,1288067467180249108,2024-09-25T07:34:59.143+00:00,alzakex,Karsten Bondy[MT/CA] (Call Mod),784274313074966548,assets\fea0bde2a8fcc6f76c3da6e4f95ba409-8DC67.png,I wish they had left the first number of the licence plate unblocked so I could tell if the truck is from Missoula or Bozeman. I'm guessing Bozeman. That's a serious trailer hitch.
1290288009157283882,Default,,2024-09-30T12:23:53.775+00:00,apfee2024_81383,howdyfriends (KY),1274293080794595339,assets\eb95501477beed1d0f8fde71864b6435-9F719.png,Tester/Sheehy debate today: https://dailymontanan.com/2024/09/25/tester-sheehy-to-participate-in-montana-pbs-debate-on-sept-30/
1290322768834986055,Default,,2024-09-30T14:42:01.128+00:00,domitiaenobaria2709,Kripa Patwardhan [VA],771560612186161172,assets\2-ADBB4.png,There’s a ballot referendum for abortion rights. Is it being connected with re-electing Tester?
1290349987695431784,Default,,2024-09-30T16:30:10.61+00:00,megk8199,Megan Morris NY,1266394779676184707,assets\ef0881069adff0161f4bd602f9c62624-E5156.png,"Hi! I may have missed it, but are there any text banking opportunities for Tester?"
1290746689698664518,Reply,1290288009157283882,2024-10-01T18:46:31.738+00:00,i_am_anxious02,Jake Henderson (NJ-2) [MOD],648018187342053395,assets\ee6fcc15dae8462931d1ad1c70c5d780-D008C.png,"To anyone that watched, how did this go"
1291492272248193075,Default,,2024-10-03T20:09:12.47+00:00,meanderingstone6495,Autumn S [AR]🤘• Lead Mod/OE Mod,936622618293968958,assets\af45a372ba919e7bac10686b43e799f1-BDEE3.png,Want to join me for this event? https://mobilize.us/s/ncZVaj
1291846824256081980,Default,,2024-10-04T19:38:04.256+00:00,meanderingstone6495,Autumn S [AR]🤘• Lead Mod/OE Mod,936622618293968958,assets\af45a372ba919e7bac10686b43e799f1-BDEE3.png,Want to join me for this event? https://mobilize.us/s/NPgfUm
1291937359486652557,Default,,2024-10-05T01:37:49.537+00:00,jack.246012,Jack (KC),1276396030375624789,assets\1b105b23ea580bad6169b556d3b7ebc4-4403D.png,"On this day 4 years ago, a record 3.3 million Americans cast their ballot early.  And as expected, only 1.7 million early votes have been cast (a 45% decrease).  Please use the link below or call the Democratic Voter Assistance Hotline 9am-9pm (EST) (1-833-336-8683) to request an absentee ballot, or make a plan to vote early or on election day.  https://iwillvote.com/"
1292095534571585580,Default,,2024-10-05T12:06:21.416+00:00,apfee2024_81383,howdyfriends (KY),1274293080794595339,assets\eb95501477beed1d0f8fde71864b6435-9F719.png,"<:mega2:1269006580976976076> A reminder that we have a dedicated ⁠<#1288163431911788586> channel where we coordinate our efforts to post campaign content, leave comments, and upvote <:kamala1:1269028302203523114> <:WalzSmile:1270424129853456445> -related posts. Right now even supportive subreddits like r/politics are bombarded with Trump info, and we're trying to change that. Let's help people find information about our candidates and the brighter future they offer! Head on over to our channel and we'll plug you in with opportunities to contribute. Even if you have just one minute to help, you can make a difference."
1292132356710207599,Default,,2024-10-05T14:32:40.498+00:00,chuck.laird,Chuck4Democracy,1222328177993715933,assets\bab353131d078cca0d835c1a415c425b-91A38.png,How might I do this? I don’t appear to have access to this channel. Just want to help where I can.
1292133155289174156,Default,,2024-10-05T14:35:50.894+00:00,trumansleeps,Michael Pelaez | FL,389839010576465936,assets\3a91c3446fca9803ffb1d856364145a2-A8603.png,
1292223194568196158,Default,,2024-10-05T20:33:37.931+00:00,gabriellelynn_4444,Gabrielle Lynn [HFP Staff],1280619651029798924,assets\240de4e960e8591f3136c93fbf92c244-59538.png,"🗳️ 🗳️ 🗳️ 
<@&1245910596403335290> Don’t wait! Make sure you are registered to vote in Montana! Can you take a second today to make sure you and your network are all set to vote?
Here’s what you can do:

1. Reach out to everyone in your network with this message, that can also be found in Reach: 

Don’t wait! Make sure you are registered to vote in Montana! I’m reaching out to everyone I know to make sure their registration is up to date. This election is too important to miss. Will you check your registration status? Here’s the link: https://IWillVote.com/

2. Share this image on your social media! It can also be found in Reach! ✨ Make sure you’ve joined Reach for campaign updates here: https://app.reach.vote/join/7DRDMN
3. Check your own registration, at IWillVote.com. 
React with ✅when you’ve done it!
🗳️ 🗳️ 🗳️"
1292227773154332789,ThreadCreated,,2024-10-05T20:51:49.551+00:00,penfold2012,Judy0708,734718412017762345,assets\5-E9BDB.png,Started a thread.
1292472018284974131,Default,,2024-10-06T13:02:22.128+00:00,meanderingstone6495,Autumn S [AR]🤘• Lead Mod/OE Mod,936622618293968958,assets\af45a372ba919e7bac10686b43e799f1-BDEE3.png,Want to join me for this event? https://mobilize.us/s/PNzBX2
1292503850602856521,Default,,2024-10-06T15:08:51.544+00:00,alzakex,Karsten Bondy[MT/CA] (Call Mod),784274313074966548,assets\fea0bde2a8fcc6f76c3da6e4f95ba409-8DC67.png,"Hello @MT, it is Sunday morning October 6th, and I am here with a  short, friendly reminder that IF YOU DID NOT VOTE IN THE 2022 MID-TERM ELECTIONS IN MONTANA, YOU ARE MOST LIKELY NO LONGER REGISTERED TO VOTE IN MONTANA. 

You can check your registration status at https://iwillvote.com/, and get the form to register by mail, but YOUR APPLICATION TO REGISTER MUST BE POSTMARKED NO LATER THAN MONDAY, OCTOBER 7TH TO COUNT. Bring it to a post office. Ask (politely) to watch them postmark it if you try to mail it Monday. 

You can also check your registration status and download the forms you need to register at Montana Secretary of State  Christi Jacobsen's official page, https://votemt.gov/ Same due date applies. 

 IF YOU MISS THE MONDAY DEADLINE, YOU CAN STILL OFFICIALLY REGISTER AT ANY OF THE STATE'S 56 COUNTY ELECTION OFFICES UNTIL NOON THE DAY BEFORE ELECTION DAY (you can also register on election day, but maybe don't push your luck)
Here is a link to the addresses of all 56 Election Offices from Ms. Jacobsen's office: https://sosmt.gov/wp-admin/admin-ajax.php?juwpfisadmin=false&action=wpfd&task=file.download&wpfd_category_id=23&wpfd_file_id=65879

Oh  wait, no it is not. These are the addresses to mail your applications in to. Most of them are PO boxes. It looks like most bigger towns have addresses for actual offices where you can pick up and drop off your registration in person - Helena has one, Missoula, Butte, even my birthplace Shelby is showing off their big Toole energy with a real office, not just a PO box. But if you're somewhere off in the boonies like Scobey or Billings or Great Falls, you might want to fill out an application TODAY and  hit the post office first thing in the morning tomorrow."
1292504953784635535,Default,,2024-10-06T15:13:14.563+00:00,alzakex,Karsten Bondy[MT/CA] (Call Mod),784274313074966548,assets\fea0bde2a8fcc6f76c3da6e4f95ba409-8DC67.png,"BTW, can anyone explain to me what 'vagtarap' means/stands for?"
1292585446685278231,Default,,2024-10-06T20:33:05.566+00:00,carb.on,Carolyn • Lead Mod,568257600228032512,assets\28a90c77b5793d80eb62484a43c66748-D8837.png,"<:mega2:1269006580976976076> A reminder that we have a dedicated ⁠https://discord.com/channels/1242249109298221066/1288163431911788586 Reddit channel where we coordinate our efforts to post campaign content, leave comments, and upvote <:kamala1:1269028302203523114> <:WalzSmile:1270424129853456445> -related posts. Right now even supportive subreddits like r/politics are bombarded with Trump info, and we're trying to change that. Let's help people find information about our candidates and the brighter future they offer! Head on over to our channel and we'll plug you in with opportunities to contribute. Even if you have just one minute to help, you can make a difference.
Get the role to see the Reddit channel, go to https://discord.com/channels/1242249109298221066/1260651617867399188 and pick the 👾"
1292924322104610922,Default,,2024-10-07T18:59:39.762+00:00,gabriellelynn_4444,Gabrielle Lynn [HFP Staff],1280619651029798924,assets\240de4e960e8591f3136c93fbf92c244-59538.png,Sharing this link https://iwillvote.com/votinginfo/MT with all the voter information for Montana!! Also pinning in this channel for easy reference <:happysun1:1270566006590541896>
1292924338126848080,ChannelPinnedMessage,1292924322104610922,2024-10-07T18:59:43.582+00:00,gabriellelynn_4444,Gabrielle Lynn [HFP Staff],1280619651029798924,assets\240de4e960e8591f3136c93fbf92c244-59538.png,Pinned a message.
1293288745877114880,Default,,2024-10-08T19:07:45.16+00:00,meanderingstone6495,Autumn S [AR]🤘• Lead Mod/OE Mod,936622618293968958,assets\af45a372ba919e7bac10686b43e799f1-BDEE3.png,Want to join me for this event? https://mobilize.us/s/6Cs1xV
1294870831272431669,Default,,2024-10-13T03:54:23.712+00:00,meanderingstone6495,Autumn S [AR]🤘• Lead Mod/OE Mod,936622618293968958,assets\af45a372ba919e7bac10686b43e799f1-BDEE3.png,Want to join me for this High Hopes for Harris event? https://mobilize.us/s/1nez72
1295015127036198972,Default,,2024-10-13T13:27:46.503+00:00,stevetx1,SteveTX1,977406049915134002,assets\19bf1bc141198794cb83e0290acb77af-B6629.png,"Finished some phone banking, doing what I can to try and help get Tester across the finish line!"
1295287750152552449,Default,,2024-10-14T07:31:04.919+00:00,genericusername8797,S [MT/NM],465305140786888705,assets\a187dcd150192cbe1a6b1b9cb0ffe55c-6C116.png,"I have an idea for a phonebanking event for Jon Tester, and wanted your input. We Montanans are passionate about our college football teams, and sometimes if a home has both Griz & Cat fans in it, it's ""A House Divided."" So it might be fun to bring Griz & Cats fans together for ""A House Divided, United for Tester"" virtual phonebank. Thoughts?"
1295771449251987559,Reply,1295287750152552449,2024-10-15T15:33:07.771+00:00,stevetx1,SteveTX1,977406049915134002,assets\19bf1bc141198794cb83e0290acb77af-B6629.png,I personally think that’s a great idea
1295826059446718564,Reply,1295771449251987559,2024-10-15T19:10:07.856+00:00,genericusername8797,S [MT/NM],465305140786888705,assets\a187dcd150192cbe1a6b1b9cb0ffe55c-6C116.png,Any ideas on how to get it set up and gain traction?
1296198374738890883,Default,,2024-10-16T19:49:34.739+00:00,meanderingstone6495,Autumn S [AR]🤘• Lead Mod/OE Mod,936622618293968958,assets\af45a372ba919e7bac10686b43e799f1-BDEE3.png,Want to join me for this event? https://mobilize.us/s/yCrvow
1296915211139416084,Default,,2024-10-18T19:18:01.855+00:00,meanderingstone6495,Autumn S [AR]🤘• Lead Mod/OE Mod,936622618293968958,assets\af45a372ba919e7bac10686b43e799f1-BDEE3.png,"<:eyes:1252803301137842251>  Looking for more ways to get involved and get out the vote? **Join us Monday through Saturday for our GOTV Power Hours**, where you'll learn everything you need to know to reach out to your friends, family, and online communities and make sure they get out the vote! 🗳️ Sign up HERE: https://txt.democrats.org/GOTVHour 

<:retweet:1278893511780864010> Check out our priority content from Reach to share HERE: https://share.kamalaharris.com/toolkit/Discord-2f08"
1297568915777392703,Default,,2024-10-20T14:35:37.186+00:00,marisa._74585,Marisa [Mod]/KC TextMod,1268363112956952637,assets\20f3039f2fdd15bcbfa1e601c4cd2ace-ED69E.png,We've got a phonebanking block  starting in about 30 minutes to celebrate Kamala's Birthday!  We're trying to reach over 3 million voters today! Can you help?  Knock out some calls while you are drinking your morning coffee and still be out in time to hit up a pumpkin patch! Join the [5M Dial-a-thon](https://events.democrats.org/event/730026/) and help make history! Will you join us?!
1297571794793791569,Default,,2024-10-20T14:47:03.597+00:00,marisa._74585,Marisa [Mod]/KC TextMod,1268363112956952637,assets\20f3039f2fdd15bcbfa1e601c4cd2ace-ED69E.png,
1297698562762739764,Default,,2024-10-20T23:10:47.436+00:00,dramacrone,Maggie M [MD] • Community Mod,291311960417370112,assets\3526c602178143a48a9785cd02cc3110-F2E2E.png,"**Courage is mastery of fear, not absence of fear.** Which [**Phone Bank with Team Harris-Walz**](https://events.democrats.org/event/725393/?utm_source=Discord&utm_medium=Posts&utm_campaign=Daily%20Engagement) are you signing up for right now?"
1297736914043928587,Default,,2024-10-21T01:43:11.094+00:00,franceshaydock_20619,Frances Haydock (HFP HQ!),1257469301435400238,assets\8286d5b1308e7b3d80a3523e4ec50548-C029D.png,"<@&1245910596403335290> FOLKS, WE LOVE YA, AND YOUR DEDICATION TO THIS CAMPAIGN! WHAT IS OF IMMEDIATE HELP RIGHT NOW IS TO  HOP ON THE DIALER **RIGHT NOW** AND HELP US GET TO 5 MILLION CALLS!!! 

WE ARE LESS THAN 600K AWAY FROM IT, AND WE CAN DO THIS, BUT WE NEED ***ALL OF YOU TO HELP US GET THERE!***

HOP ON THE DIALER RIGHT NOW AND CALL SOME AWESOME WISCONSIN VOTERS: https://democrats.call.scaletowin.com/?t=f80c83d9-aa81-404c-9137-bbd269d6b1c7&ref=discord"
1297741223724978238,Default,,2024-10-21T02:00:18.602+00:00,kyaizen,Jared • Lead Mod,112080668296564736,assets\a_de0e3d4a3f9b486ad3ad6df0d72323da-D0252.gif,NOW CALLING NV!! JOIN US! https://democrats.call.scaletowin.com/?t=09bd534e-841d-495f-b590-68e74150764e&ef=discord
1297936587455201281,Default,,2024-10-21T14:56:36.945+00:00,marisa._74585,Marisa [Mod]/KC TextMod,1268363112956952637,assets\20f3039f2fdd15bcbfa1e601c4cd2ace-ED69E.png,"Happy Monday!

 We made almost 5 million calls this weekend to celebrate Kamala's birthday! 

How did get involved?: 

<:phone:1252803032346001479> Phone Bank Powerhouse
<:text_heart1:1270612783796584541> Text Bank Warrior
🚪 Steps-in Canvasser
<:9364_blobpumpkin:1285344377065046047> Something different
<:100:1252803350026653726> Didn't get on this weekend but will today! 


We still need you all on the phones!!! We are on them too!! Join us!  [Phonebank with Team Harris-Walz ](https://events.democrats.org/event/725393/?utm_source=Discord&utm_medium=Posts&utm_campaign=Daily%20Engagement)today!! Will you join us?!  <:100:1252803350026653726>"
1297985321241411615,Default,,2024-10-21T18:10:15.985+00:00,jack.246012,Jack (KC),1276396030375624789,assets\1b105b23ea580bad6169b556d3b7ebc4-4403D.png,"Hey friends, four years ago, we sent President Biden to the White House with one of the largest popular vote margins in history, thanks to support from all 50 states, blue and red alike. A bigger margin makes it harder for Trump and MAGA Republicans to challenge the election. The work we do in these last two weeks is crucial.

Visit: https://iwillvote.com/
Call: Democratic Voter Assistance Hotline (833-336-8683)

Let's ensure Kamala Harris is elected!"
1298379670877769738,Default,,2024-10-22T20:17:16.265+00:00,amirina9811,Kassie Byers - Mod (KY),243492115739312128,assets\a28ffed52ccc318441eb259552b68f66-B9E24.png,"<@&1242265273055314051> Happy Tuesday! We need volunteers on our dialers NOW! Come give us 30 minutes or more of your time! 

 We made almost 5 million calls this weekend to celebrate Kamala's birthday! 

We still need you all on the phones!!! We are on them too!! Join us! [**Phone Banks with Team Harris-Walz for Warriors Who are Not Quitting**](https://events.democrats.org/event/725393/?utm_source=Discord&utm_medium=Posts&utm_campaign=Daily%20Engagement)"
1298727584271695925,Default,,2024-10-23T19:19:45.282+00:00,meanderingstone6495,Autumn S [AR]🤘• Lead Mod/OE Mod,936622618293968958,assets\af45a372ba919e7bac10686b43e799f1-BDEE3.png,"Got some free time on your hands? 

MAKE SOME CALLS🙌 https://go.kamalaharris.com/calls/"
1299087320540254301,Default,,2024-10-24T19:09:13.092+00:00,meanderingstone6495,Autumn S [AR]🤘• Lead Mod/OE Mod,936622618293968958,assets\af45a372ba919e7bac10686b43e799f1-BDEE3.png,"📞  You CAN sit with us -- check out our Twitch livestream and join us as we call voters across the country! <:happysun1:1270566006590541896> 

<:twitch:1297444838249074729> Join the livestream here: https://www.twitch.tv/kamalaharris
<:phone:1252803032346001479> Start making calls here: https://go.kamalaharris.com/calls/"
