id,type,ref_to,timestamp,author_name,author_nickname,author_id,author_avatar_url,content
1290441581932843179,Default,,2024-09-30T22:34:08.378+00:00,maw_2k5374,Mark Williams,371398908695281669,assets\5-E9BDB.png,"Hi, I spoke with a MI voter this afternoon who already voted. I politely asked who they were voting for, but they did not disclose and hung up. What canvass result should I use?"
1290443632314417224,Default,,2024-09-30T22:42:17.227+00:00,lovelightphoto_86652,Alan Z (CA) [Call Mod],1156958211065270323,assets\8ef62717b6ae0c24ebb16d1b0ea4b07e-DDC39.png,"If it was the correct person, I would suggest... 

First click the ""correct person"" button.  On the next screen click ""undecided/other/not voting"""
1290443747217248287,Reply,1290441581932843179,2024-09-30T22:42:44.622+00:00,lovelightphoto_86652,Alan Z (CA) [Call Mod],1156958211065270323,assets\8ef62717b6ae0c24ebb16d1b0ea4b07e-DDC39.png,let me know if that works for you
1290444331378933782,Default,,2024-09-30T22:45:03.897+00:00,maw_2k5374,Mark Williams,371398908695281669,assets\5-E9BDB.png,Thanks! That is what I selected.
