id,type,ref_to,timestamp,author_name,author_nickname,author_id,author_avatar_url,content
1252735379044438027,21,1252734624581423188,2024-06-18T21:23:09.062+00:00,cpbricke_24848,Cheryl Brickey Mod Admin  (CA),1247292780032561152,assets\de09eeaf19be82e36df33c8429a4d1a3-30FA9.png,
1252735382231978207,Default,,2024-06-18T21:23:09.822+00:00,cpbricke_24848,Cheryl Brickey Mod Admin  (CA),1247292780032561152,assets\de09eeaf19be82e36df33c8429a4d1a3-30FA9.png,YES!   Thanks   Will test this later tonight
1252735499089743942,Default,,2024-06-18T21:23:37.683+00:00,demtortilla_60949,demtortilla,1242248892804763712,assets\a_c1a2d0423471e6287ce2d2c69bf8abe5-C5FA2.gif,This would definitely require some training
1252735548418687119,Default,,2024-06-18T21:23:49.444+00:00,demtortilla_60949,demtortilla,1242248892804763712,assets\a_c1a2d0423471e6287ce2d2c69bf8abe5-C5FA2.gif,but I don't imagine more than a handful of people being able to access it
1252735874269974529,Default,,2024-06-18T21:25:07.133+00:00,cpbricke_24848,Cheryl Brickey Mod Admin  (CA),1247292780032561152,assets\de09eeaf19be82e36df33c8429a4d1a3-30FA9.png,Agree   Different topic   Did you see my email on the west coast zoom phone banks   First one is thurday and seems there may be a few things to update in the Mobilize - outlined in the email   Happy to help
1252740623534915734,Default,,2024-06-18T21:43:59.446+00:00,demtortilla_60949,demtortilla,1242248892804763712,assets\a_c1a2d0423471e6287ce2d2c69bf8abe5-C5FA2.gif,ah yes! I have a call with Tamara soon and will be able to answer the email
