id,type,ref_to,timestamp,author_name,author_nickname,author_id,author_avatar_url,content
1286744890050609237,21,1286731902660775947,2024-09-20T17:44:48.352+00:00,trumansleeps,Michael Pelaez | FL,389839010576465936,assets\3a91c3446fca9803ffb1d856364145a2-A8603.png,
1286744892546089071,Default,,2024-09-20T17:44:48.947+00:00,trumansleeps,Michael Pelaez | FL,389839010576465936,assets\3a91c3446fca9803ffb1d856364145a2-A8603.png,This is chaos
1286745139578142772,Default,,2024-09-20T17:45:47.844+00:00,jackferreira.246012,Jack Ferreira (KC),1276396030375624789,assets\cd48a61b3416a1c6fe47335cfcfc484e-EE993.png,thats part of their plan
1286746629587599494,Default,,2024-09-20T17:51:43.09+00:00,aw823,Aden Wang (TX),1145541274988982434,assets\26fdb8c305a53f75785bfe8afee4f214-9FF89.png,Hopefully we can win the 2026 gubernatorial race in GA and replace some of those loons
1286752034330120303,Default,,2024-09-20T18:13:11.681+00:00,jackferreira.246012,Jack Ferreira (KC),1276396030375624789,assets\cd48a61b3416a1c6fe47335cfcfc484e-EE993.png,And hopefully you can flip your home state!
1286752386253328476,Default,,2024-09-20T18:14:35.586+00:00,aw823,Aden Wang (TX),1145541274988982434,assets\26fdb8c305a53f75785bfe8afee4f214-9FF89.png,It’ll be harder but if Harris can manage a high single digit lead in national polls it could happen. I’m a bit more hopeful for the senate race now especially since Allred was finally up in a poll earlier this week
