id,type,ref_to,timestamp,author_name,author_nickname,author_id,author_avatar_url,content
1284254938322567178,Default,,2024-09-13T20:50:37.599+00:00,sue004451,Sue Meismer (IL),1277413673438023752,assets\79ee349b6511e2000af8a32fb8a6974e-B3B83.png,"I just completed texting training last night. When and where will I get notified that I am approved?
Also why is the New Mod Recruitment channel Read-only for me? I see others are responding. I was a texting Mod here during Joe Biden’s run."
1284255601739698288,Default,,2024-09-13T20:53:15.77+00:00,carb.on,Carolyn B [CA] • Lead Mod,568257600228032512,assets\28a90c77b5793d80eb62484a43c66748-D8837.png,"HI <@1277413673438023752> thank you so much for completing texting training! We really appreciate your volunteer efforts. It takes the team a little while to onboard everyone from the training sessions, and you will get a DM when they are ready for you. If you are still waiting on Monday you can send a reminder here https://discord.com/channels/1242249109298221066/1266829704204386334"
1284256013976866917,Default,,2024-09-13T20:54:54.055+00:00,carb.on,Carolyn B [CA] • Lead Mod,568257600228032512,assets\28a90c77b5793d80eb62484a43c66748-D8837.png,"<@1277413673438023752> the New Mod Recruitment channel is closed right now because staff is training volunteers who applied earlier. When we need more mods, the channel will re-open"
1284257491403673640,Default,,2024-09-13T21:00:46.301+00:00,sue004451,Sue Meismer (IL),1277413673438023752,assets\79ee349b6511e2000af8a32fb8a6974e-B3B83.png,Thank you so much Carolyn!!
1284258618488913951,Default,,2024-09-13T21:05:15.019+00:00,sue004451,Sue Meismer (IL),1277413673438023752,assets\79ee349b6511e2000af8a32fb8a6974e-B3B83.png,Is it ok that I got one quiz question wrong? It was the first question I think. I sort of lost control of my finger and it twitched on the wrong answer (it does that when I’m tired!!)
1284259857309896815,Reply,1284258618488913951,2024-09-13T21:10:10.377+00:00,carb.on,Carolyn B [CA] • Lead Mod,568257600228032512,assets\28a90c77b5793d80eb62484a43c66748-D8837.png,You should ask about that in https://discord.com/channels/1242249109298221066/1266829704204386334
