id,type,ref_to,timestamp,author_name,author_nickname,author_id,author_avatar_url,content
1288075791460077641,Default,,2024-09-24T09:53:19.975+00:00,apfee2024_81383,howdyfriends (KY),1274293080794595339,assets\eb95501477beed1d0f8fde71864b6435-9F719.png,"Hi all: saw this just now and am wondering if there's anyone here in Columbus who feels like leaving a comment. Someone already suggested they get involved in the campaign and pointed them to the events link, but maybe hearing from an actual local would seal the deal. https://www.reddit.com/r/democrats/comments/1fo38d7/im_a_former_trumptard_turned_democrat_because_of/"
1289269218730049670,Reply,1286115320456806525,2024-09-27T16:55:35.209+00:00,deb_b1,Deb,369866739913326592,assets\9195bf63588dd237a4a3426dbf1e572d-1BDF3.png,YES! Vote yes to end gerrymandering in Ohio once and for all!
1289270580171899053,Reply,1288075791460077641,2024-09-27T17:00:59.802+00:00,deb_b1,Deb,369866739913326592,assets\9195bf63588dd237a4a3426dbf1e572d-1BDF3.png,"Not on Reddit, but we are doing a ton of face to face voter registration in Columbus. Someone could suggest Indivisible. Or he could sign up for one of the events on Mobilize."
1290293151461937195,Default,,2024-09-30T12:44:19.796+00:00,apfee2024_81383,howdyfriends (KY),1274293080794595339,assets\eb95501477beed1d0f8fde71864b6435-9F719.png,🙌  https://www.reddit.com/r/democrats/comments/1fsl2yw/seeing_lots_of_signs_in_rural_ohio/
1290304500502106142,Reply,1289270580171899053,2024-09-30T13:29:25.618+00:00,shadarogue13,Aerika,588350446012334089,assets\0699d2b871caf2205df771527fd0374b-A71C9.png,Is it possible you could point me toward some of the face to face voter registration events? I've looked thru the Mobilize site but I've likely skipped right past them on accident.
1290456179876560948,Default,,2024-09-30T23:32:08.799+00:00,jack.246012,Jack (KC),1276396030375624789,assets\1b105b23ea580bad6169b556d3b7ebc4-4403D.png,"One week left to register to vote!!  You can check your registration and register in less than 5 minutes!!  Don't delay, make a plan to elect democrats today! https://www.vote411.org/"
1290866482003312661,Default,,2024-10-02T02:42:32.449+00:00,emilyko8486,emilyko,699818032356261928,assets\76a2934c69037cff09cdd61921c8c119-CF7C5.png,Hi pals! Has anyone had issues with not seeing an approved absentee ballot even 3+ weeks after sending it off to the election office? I called the franklin county office a week ago and they said they had received my absentee ballot application but that they did not have any clue when it would be approved. Just wondering since I know ballots are starting to be mailed out october 8th
1291052433438539816,Default,,2024-10-02T15:01:26.726+00:00,jack.246012,Jack (KC),1276396030375624789,assets\1b105b23ea580bad6169b556d3b7ebc4-4403D.png,Id say check back the day before they start sending it out
1291492645180543061,Default,,2024-10-03T20:10:41.384+00:00,meanderingstone6495,Autumn S [AR]🤘• Lead Mod/OE Mod,936622618293968958,assets\af45a372ba919e7bac10686b43e799f1-BDEE3.png,Want to join me for this event? https://mobilize.us/s/ncZVaj
1291846973980282941,Default,,2024-10-04T19:38:39.953+00:00,meanderingstone6495,Autumn S [AR]🤘• Lead Mod/OE Mod,936622618293968958,assets\af45a372ba919e7bac10686b43e799f1-BDEE3.png,Want to join me for this event? https://mobilize.us/s/NPgfUm
1291937521059500043,Default,,2024-10-05T01:38:28.059+00:00,jack.246012,Jack (KC),1276396030375624789,assets\1b105b23ea580bad6169b556d3b7ebc4-4403D.png,"On this day 4 years ago, a record 3.3 million Americans cast their ballot early.  And as expected, only 1.7 million early votes have been cast (a 45% decrease).  Please use the link below or call the Democratic Voter Assistance Hotline 9am-9pm (EST) (1-833-336-8683) to request an absentee ballot, or make a plan to vote early or on election day.  https://iwillvote.com/"
1291957732353769513,Default,,2024-10-05T02:58:46.807+00:00,alansgoldberg,Alan Goldberg DC  (OH-14),1159292935439908945,assets\9c367a083b7831a1814ff2d68e375acc-AE643.png,Mail ballots go out 29 days before the election. We should get ballots Monday or Tuesday
1291981351993475164,Default,,2024-10-05T04:32:38.168+00:00,jack.246012,Jack (KC),1276396030375624789,assets\1b105b23ea580bad6169b556d3b7ebc4-4403D.png,"If you can, please deliver the ballot yourself.  Cant take chances with Trumps post master general"
1292095441369960538,Default,,2024-10-05T12:05:59.195+00:00,apfee2024_81383,howdyfriends (KY),1274293080794595339,assets\eb95501477beed1d0f8fde71864b6435-9F719.png,"<:mega2:1269006580976976076> A reminder that we have a dedicated ⁠<#1288163431911788586> channel where we coordinate our efforts to post campaign content, leave comments, and upvote <:kamala1:1269028302203523114> <:WalzSmile:1270424129853456445> -related posts. Right now even supportive subreddits like r/politics are bombarded with Trump info, and we're trying to change that. Let's help people find information about our candidates and the brighter future they offer! Head on over to our channel and we'll plug you in with opportunities to contribute. Even if you have just one minute to help, you can make a difference."
1292133345135820881,Default,,2024-10-05T14:36:36.157+00:00,trumansleeps,Michael Pelaez | FL,389839010576465936,assets\3a91c3446fca9803ffb1d856364145a2-A8603.png,
1292223386440700084,Default,,2024-10-05T20:34:23.677+00:00,gabriellelynn_4444,Gabrielle Lynn [HFP Staff],1280619651029798924,assets\240de4e960e8591f3136c93fbf92c244-59538.png,"🗳️ 🗳️ 🗳️ 
<@&1245910794831663255>  October 7 is the last day to register to vote online, in-person and by mail in Ohio! Can you take a second today to make sure you and your network are all set to vote?
Here’s what you can do:

1. Reach out to everyone in your network with this message, that can also be found in Reach: 

October 7 is the last day to register to vote online, in-person and by mail in Ohio!  I’m reaching out to everyone I know to make sure their registration is up to date. This election is too important to miss. Will you check your registration status? Here’s the link: https://IWillVote.com/

2. Share this image on your social media! It can also be found in Reach! ✨ Make sure you’ve joined Reach for campaign updates here: https://app.reach.vote/join/7DRDMN
3. Check your own registration, at IWillVote.com. 
React with ✅when you’ve done it!
🗳️ 🗳️ 🗳️"
1292472175516844084,Default,,2024-10-06T13:02:59.615+00:00,meanderingstone6495,Autumn S [AR]🤘• Lead Mod/OE Mod,936622618293968958,assets\af45a372ba919e7bac10686b43e799f1-BDEE3.png,Want to join me for this event? https://mobilize.us/s/PNzBX2
1292585529686233180,Default,,2024-10-06T20:33:25.355+00:00,carb.on,Carolyn • Lead Mod,568257600228032512,assets\28a90c77b5793d80eb62484a43c66748-D8837.png,"<:mega2:1269006580976976076> A reminder that we have a dedicated ⁠https://discord.com/channels/1242249109298221066/1288163431911788586 Reddit channel where we coordinate our efforts to post campaign content, leave comments, and upvote <:kamala1:1269028302203523114> <:WalzSmile:1270424129853456445> -related posts. Right now even supportive subreddits like r/politics are bombarded with Trump info, and we're trying to change that. Let's help people find information about our candidates and the brighter future they offer! Head on over to our channel and we'll plug you in with opportunities to contribute. Even if you have just one minute to help, you can make a difference.
Get the role to see the Reddit channel, go to https://discord.com/channels/1242249109298221066/1260651617867399188 and pick the 👾"
1292617813311225896,Default,,2024-10-06T22:41:42.371+00:00,alansgoldberg,Alan Goldberg DC  (OH-14),1159292935439908945,assets\9c367a083b7831a1814ff2d68e375acc-AE643.png,sergio
1292907787638018149,Default,,2024-10-07T17:53:57.638+00:00,ann0314,Ann (OH),352957356042092546,assets\1ae0d8f99d33a3ca6e94411ac49b6e7f-B8A0A.png,We decided to vote in person this year
1292907960279765032,Default,,2024-10-07T17:54:38.799+00:00,ann0314,Ann (OH),352957356042092546,assets\1ae0d8f99d33a3ca6e94411ac49b6e7f-B8A0A.png,Despite my husband being disabled.
1292924606298062868,Default,,2024-10-07T19:00:47.519+00:00,gabriellelynn_4444,Gabrielle Lynn [HFP Staff],1280619651029798924,assets\240de4e960e8591f3136c93fbf92c244-59538.png,Sharing this link https://iwillvote.com/votinginfo/OH with all the voter information for Ohio!! Also pinning in this channel for easy reference <:happysun1:1270566006590541896>
1292924623318679624,ChannelPinnedMessage,1292924606298062868,2024-10-07T19:00:51.577+00:00,gabriellelynn_4444,Gabrielle Lynn [HFP Staff],1280619651029798924,assets\240de4e960e8591f3136c93fbf92c244-59538.png,Pinned a message.
1293289746763612221,Default,,2024-10-08T19:11:43.79+00:00,meanderingstone6495,Autumn S [AR]🤘• Lead Mod/OE Mod,936622618293968958,assets\af45a372ba919e7bac10686b43e799f1-BDEE3.png,Want to join me for this event? https://mobilize.us/s/6Cs1xV
1293295740382347369,Default,,2024-10-08T19:35:32.78+00:00,spivey378,Nick R (OH),962012221225959454,assets\cafc4f7f610a97a8cb153044a5759966-CEB64.png,I voted today! 😊
1293572499983827019,Default,,2024-10-09T13:55:17.411+00:00,apfee2024_81383,howdyfriends (KY),1274293080794595339,assets\eb95501477beed1d0f8fde71864b6435-9F719.png,This was nice to see https://www.reddit.com/r/democrats/comments/1fz5b7j/my_republican_neighbor_asked_where_i_got_my/
1293627570306158675,Reply,1292907960279765032,2024-10-09T17:34:07.199+00:00,arulane,Katil (Ohio),365932607126634506,assets\a248a4fdbb8d1ea4c469e4e2291a290b-FD6C3.png,Took my folding chair since I don’t have a wheelchair.
1293643741323726879,Reply,1293627570306158675,2024-10-09T18:38:22.67+00:00,starkittynmom,Jennifer • [Lead Mod],1276944250491113656,assets\a_2aba4b7f19fcab5fe5391fcdb73d735d-D670A.gif,<@365932607126634506>  I love this so much! Will you also post it in the <#1292581735942459413> channel? It is too cool and should be shared!
1293712766225612892,Default,,2024-10-09T23:12:39.489+00:00,gabriellelynn_4444,Gabrielle Lynn [HFP Staff],1280619651029798924,assets\240de4e960e8591f3136c93fbf92c244-59538.png,"🗳️ 🗳️ 🗳️ 
<@&1245910794831663255> In-person absentee voting in Ohio is available through November 3. Can you take a second today to make sure you and your network have what they need to vote? 
Here’s what you can do:

1. Reach out to everyone in your network with this message, that can also be found in Reach: 

In-person absentee voting in Ohio  is available through November 3, so I’m reaching out to everyone I know to make sure they have their plan to vote. This race is really close. We need everyone to turn out to vote. Don’t wait: Visit IWillVote.com/OH and make your plan to vote early.

2. Share this image and message on your social media! 
3. Make YOUR plan to vote! Head to https://iwillvote.com/OH to find information about voting early near you.
React with ✅when you’ve done it, and let us know here - when are you going to cast your vote for Kamala Harris and Tim Walz?
🗳️ 🗳️ 🗳️"
1293909263651045470,Default,,2024-10-10T12:13:28.126+00:00,alansgoldberg,Alan Goldberg DC  (OH-14),1159292935439908945,assets\9c367a083b7831a1814ff2d68e375acc-AE643.png,Received my absentee ballots in todays mail!
1293958108732854373,Default,,2024-10-10T15:27:33.701+00:00,jack.246012,Jack (KC),1276396030375624789,assets\1b105b23ea580bad6169b556d3b7ebc4-4403D.png,Please deliver it yourself!
1294419847647592509,Default,,2024-10-11T22:02:20.837+00:00,audrey083255,Audrey,1294394366965710961,assets\3-FB033.png,I voted already!!
1294847176039731262,Default,,2024-10-13T02:20:23.865+00:00,alansgoldberg,Alan Goldberg DC  (OH-14),1159292935439908945,assets\9c367a083b7831a1814ff2d68e375acc-AE643.png,Delivering it on Monday!
1294870975644438539,Default,,2024-10-13T03:54:58.133+00:00,meanderingstone6495,Autumn S [AR]🤘• Lead Mod/OE Mod,936622618293968958,assets\af45a372ba919e7bac10686b43e799f1-BDEE3.png,Want to join me for this High Hopes for Harris event? https://mobilize.us/s/1nez72
1295368357561897003,Default,,2024-10-14T12:51:23.223+00:00,arulane,Katil (Ohio),365932607126634506,assets\a248a4fdbb8d1ea4c469e4e2291a290b-FD6C3.png,Voted first day.
1296198506486169601,Default,,2024-10-16T19:50:06.15+00:00,meanderingstone6495,Autumn S [AR]🤘• Lead Mod/OE Mod,936622618293968958,assets\af45a372ba919e7bac10686b43e799f1-BDEE3.png,Want to join me for this event? https://mobilize.us/s/yCrvow
1296232659080450220,Default,,2024-10-16T22:05:48.763+00:00,ann0314,Ann (OH),352957356042092546,assets\1ae0d8f99d33a3ca6e94411ac49b6e7f-B8A0A.png,"Just a heads up for any Franklin County Ohio Voters: 

https://www.yahoo.com/news/franklin-county-voters-face-confusion-213000255.html"
1296232969102430218,Default,,2024-10-16T22:07:02.678+00:00,ann0314,Ann (OH),352957356042092546,assets\1ae0d8f99d33a3ca6e94411ac49b6e7f-B8A0A.png,(Also I guess this means its a good idea to verify the postage or put extra just in general if you are voting by Mail-in ballot) Maybe pass it on or share on your socials (especially if you are in Franklin County)
1296447334766346250,Default,,2024-10-17T12:18:51.435+00:00,deku1001,Deku1,783808673562492929,assets\03e198047b2a39d1eeb25d779ae56e0f-0E803.png,"Hi there, new here. Curious if there’s a way I can help by driving voters to polls on election day."
1296487435949183027,Default,,2024-10-17T14:58:12.302+00:00,jack.246012,Jack (KC),1276396030375624789,assets\1b105b23ea580bad6169b556d3b7ebc4-4403D.png,Theres a site caled Rideshare2vote
1296487477728514059,Default,,2024-10-17T14:58:22.263+00:00,jack.246012,Jack (KC),1276396030375624789,assets\1b105b23ea580bad6169b556d3b7ebc4-4403D.png,I cant post the link due to campaign finance laws
1296598247212847135,Default,,2024-10-17T22:18:31.766+00:00,apfee2024_81383,howdyfriends (KY),1274293080794595339,assets\eb95501477beed1d0f8fde71864b6435-9F719.png,Nice https://www.reddit.com/r/KamalaHarris/comments/1g5s42a/spotted_in_rural_ohio/
1296599577754992732,Default,,2024-10-17T22:23:48.992+00:00,ann0314,Ann (OH),352957356042092546,assets\1ae0d8f99d33a3ca6e94411ac49b6e7f-B8A0A.png,"Its a lot different atm where I am too. Granted, our county usually breaks Dem but but county went for Trump in 2020 and there were DJT signs everywhere. This year, I see TONS of Harris signs and then scattered singular yards with like 10 DJT signs in that one yard."
1296599803224002694,Default,,2024-10-17T22:24:42.748+00:00,ann0314,Ann (OH),352957356042092546,assets\1ae0d8f99d33a3ca6e94411ac49b6e7f-B8A0A.png,"Polling for Ohio still shows him with a huge lead though so I just don't know. I ""feel"" like the polls are wrong. (But elections aren't won on what I feel LOL)"
1296831600398700646,Default,,2024-10-18T13:45:47.501+00:00,sandra_19254,Sandra,1296819779927019602,assets\3-FB033.png,Ohio should not be counted out. Is there a Harris/Walz office in Ohio?
1296832932857778196,Default,,2024-10-18T13:51:05.184+00:00,sandra_19254,Sandra,1296819779927019602,assets\3-FB033.png,I am turning in my vote TODAY
1296915434318200932,Default,,2024-10-18T19:18:55.065+00:00,meanderingstone6495,Autumn S [AR]🤘• Lead Mod/OE Mod,936622618293968958,assets\af45a372ba919e7bac10686b43e799f1-BDEE3.png,"<:eyes:1252803301137842251>  Looking for more ways to get involved and get out the vote? **Join us Monday through Saturday for our GOTV Power Hours**, where you'll learn everything you need to know to reach out to your friends, family, and online communities and make sure they get out the vote! 🗳️ Sign up HERE: https://txt.democrats.org/GOTVHour 

<:retweet:1278893511780864010> Check out our priority content from Reach to share HERE: https://share.kamalaharris.com/toolkit/Discord-2f08"
1297549906550198352,Default,,2024-10-20T13:20:05.033+00:00,marisa._74585,Marisa [Mod]/KC TextMod,1268363112956952637,assets\20f3039f2fdd15bcbfa1e601c4cd2ace-ED69E.png,In celebration of Kamala's birthday lets trade candles for calls and gifts for gumption! We're trying to reach over 3 million voters today! Can you help?  Knock out some calls while you are drinking your morning coffee and still be out in time to hit up a pumpkin patch! Join the [5M Dial-a-thon](https://events.democrats.org/event/730026/) and help make history!
1297572022510944307,Default,,2024-10-20T14:47:57.889+00:00,marisa._74585,Marisa [Mod]/KC TextMod,1268363112956952637,assets\20f3039f2fdd15bcbfa1e601c4cd2ace-ED69E.png,
1297699051185111103,Default,,2024-10-20T23:12:43.885+00:00,dramacrone,Maggie M [MD] • Community Mod,291311960417370112,assets\3526c602178143a48a9785cd02cc3110-F2E2E.png,"**Courage is mastery of fear, not absence of fear.** Which [**Phone Bank with Team Harris-Walz**](https://events.democrats.org/event/725393/?utm_source=Discord&utm_medium=Posts&utm_campaign=Daily%20Engagement) are you signing up for right now?"
1297736189952131174,Default,,2024-10-21T01:40:18.457+00:00,kyaizen,Jared • Lead Mod,112080668296564736,assets\a_de0e3d4a3f9b486ad3ad6df0d72323da-D0252.gif,"<@&1245910794831663255> FOLKS, WE LOVE YA, AND YOUR DEDICATION TO THIS CAMPAIGN! WHAT IS OF IMMEDIATE HELP RIGHT NOW IS TO  HOP ON THE DIALER RIGHT NOW AND HELP US GET TO 5 MILLION CALLS!!! 

WE ARE LESS THAN 600K AWAY FROM IT, AND WE CAN DO THIS, BUT WE NEED ALL OF YOU TO HELP US GET THERE!

HOP ON THE DIALER RIGHT NOW AND CALL SOME AWESOME WISCONSIN VOTERS: https://democrats.call.scaletowin.com/?t=f80c83d9-aa81-404c-9137-bbd269d6b1c7&ref=discord"
1297738793687978087,Default,,2024-10-21T01:50:39.236+00:00,aw823,Aden W (TX),1145541274988982434,assets\26fdb8c305a53f75785bfe8afee4f214-9FF89.png,"via  - https://www.nbcnews.com/politics/2024-election/live-blog/trump-harris-election-live-updates-rcna175667/rcrd60669?canonicalCard=true

Republican former governor Bob Taft has endorsed Sherrod Brown!"
1297739027188944956,Default,,2024-10-21T01:51:34.907+00:00,aw823,Aden W (TX),1145541274988982434,assets\26fdb8c305a53f75785bfe8afee4f214-9FF89.png,"“""Bob Taft is the only guy to beat me in an election,"" Brown said in a post to X alongside a link to Taft's editorial. ""Despite our political differences, I’m grateful to have his support in this race.""”"
1297741322773336148,Default,,2024-10-21T02:00:42.217+00:00,kyaizen,Jared • Lead Mod,112080668296564736,assets\a_de0e3d4a3f9b486ad3ad6df0d72323da-D0252.gif,NOW CALLING NV!! JOIN US! https://democrats.call.scaletowin.com/?t=09bd534e-841d-495f-b590-68e74150764e&ef=discord
1297759923970506884,Default,,2024-10-21T03:14:37.088+00:00,madison7026,Madison • [Mod],285222833640964099,assets\b7edd4987cd7bc68ef619693665ed31d-33146.png,## We're back! We're getting SO close to our goal of 5 million goals and have one more hour to call west coast voters - [please come join us](https://democrats.call.scaletowin.com/?t=09bd534e-841d-495f-b590-68e74150764e&ef=discord) to call NV voters! Even a few calls helps us reach our goal. 🤩
1297936683550900306,Default,,2024-10-21T14:56:59.856+00:00,marisa._74585,Marisa [Mod]/KC TextMod,1268363112956952637,assets\20f3039f2fdd15bcbfa1e601c4cd2ace-ED69E.png,"Happy Monday!

 We made almost 5 million calls this weekend to celebrate Kamala's birthday! 

How did get involved?: 

<:phone:1252803032346001479> Phone Bank Powerhouse
<:text_heart1:1270612783796584541> Text Bank Warrior
🚪 Steps-in Canvasser
<:9364_blobpumpkin:1285344377065046047> Something different
<:100:1252803350026653726> Didn't get on this weekend but will today! 


We still need you all on the phones!!! We are on them too!! Join us!  [Phonebank with Team Harris-Walz ](https://events.democrats.org/event/725393/?utm_source=Discord&utm_medium=Posts&utm_campaign=Daily%20Engagement)today!! Will you join us?!  <:100:1252803350026653726>"
1297985124377432125,Default,,2024-10-21T18:09:29.049+00:00,jack.246012,Jack (KC),1276396030375624789,assets\1b105b23ea580bad6169b556d3b7ebc4-4403D.png,"Hey friends, four years ago, we sent President Biden to the White House with one of the largest popular vote margins in history, thanks to support from all 50 states, blue and red alike. A bigger margin makes it harder for Trump and MAGA Republicans to challenge the election. The work we do in these last two weeks is crucial.

Visit: https://iwillvote.com/
Call: Democratic Voter Assistance Hotline (833-336-8683)

Let's ensure Kamala Harris is elected!"
1298379455462375465,Default,,2024-10-22T20:16:24.906+00:00,amirina9811,Kassie Byers - Mod (KY),243492115739312128,assets\a28ffed52ccc318441eb259552b68f66-B9E24.png,"<@&1242265273055314051> Happy Tuesday! We need volunteers on our dialers NOW! Come give us 30 minutes or more of your time! 

 We made almost 5 million calls this weekend to celebrate Kamala's birthday! 

We still need you all on the phones!!! We are on them too!! Join us! [**Phone Banks with Team Harris-Walz for Warriors Who are Not Quitting**](https://events.democrats.org/event/725393/?utm_source=Discord&utm_medium=Posts&utm_campaign=Daily%20Engagement)"
1298727746247331954,Default,,2024-10-23T19:20:23.9+00:00,meanderingstone6495,Autumn S [AR]🤘• Lead Mod/OE Mod,936622618293968958,assets\af45a372ba919e7bac10686b43e799f1-BDEE3.png,"Got some free time on your hands? 

MAKE SOME CALLS🙌 https://go.kamalaharris.com/calls/"
1299087576199729183,Default,,2024-10-24T19:10:14.046+00:00,meanderingstone6495,Autumn S [AR]🤘• Lead Mod/OE Mod,936622618293968958,assets\af45a372ba919e7bac10686b43e799f1-BDEE3.png,"📞  You CAN sit with us -- check out our Twitch livestream and join us as we call voters across the country! <:happysun1:1270566006590541896> 

<:twitch:1297444838249074729> Join the livestream here: https://www.twitch.tv/kamalaharris
<:phone:1252803032346001479> Start making calls here: https://go.kamalaharris.com/calls/"
1299941411180777483,Default,,2024-10-27T03:43:04.169+00:00,.thervr,Rvr,998733840401051678,assets\86dc5cb0ff1bcf4469884b1a4cc77ac5-981D6.png,Are there any rallies in nearby states we know of upcoming? My sisters-in-arms and I are chomping at the bit to see the woman who will make herstory
1300066816231735328,Default,,2024-10-27T12:01:23.063+00:00,meanderingstone6495,Autumn S [AR]🤘• Lead Mod/OE Mod,936622618293968958,assets\af45a372ba919e7bac10686b43e799f1-BDEE3.png,"HEY <@&1245910794831663255> 👋

Hope you all are having a great weekend! 🙌

If you didn't join us yesterday... there is still time to call and boost voter turnout in your state💙

Help us make history (herstory🙏)

https://events.democrats.org/event/734916/?utm_source=Discord&utm_medium=Posts&utm_campaign=Daily%20Engagement"
1300068614048845904,Reply,1299941411180777483,2024-10-27T12:08:31.696+00:00,meanderingstone6495,Autumn S [AR]🤘• Lead Mod/OE Mod,936622618293968958,assets\af45a372ba919e7bac10686b43e799f1-BDEE3.png,"Hey <@998733840401051678> ! Have you checked out

https://events.democrats.org/?q=Ohio

All the latest and greatest is kept there. Wish I could also attend something 🙌"
1300271152870068295,Default,,2024-10-28T01:33:20.714+00:00,marisa._74585,Marisa [Mod]/KC TextMod,1268363112956952637,assets\20f3039f2fdd15bcbfa1e601c4cd2ace-ED69E.png,Sunday Scaries got you down?! We have less than 2million calls left to make to hit our goal of [10 Million to Victory!  ](https://events.democrats.org/event/734916/?[utm_source=Discord&utm_medium=Posts&utm_campaign=Daily%20Engagement)Can you hop onto the Dialer and help us out?!
1300319369665970297,Reply,1300068614048845904,2024-10-28T04:44:56.494+00:00,.thervr,Rvr,998733840401051678,assets\86dc5cb0ff1bcf4469884b1a4cc77ac5-981D6.png,"Yeah, sadly, the Jefferson Co. Dems block us from being able to do anything locally because we called them out on things."
1300588172723486740,Default,,2024-10-28T22:33:04.137+00:00,susanclancyct_81390,Athena is Susan • Lead Mod,1261701914454659092,assets\7b7c5a311a1fd801c610d560ffe8074b-ADDDF.png,"# <:80s:1300476405079080980>  80,000 calls for 80's Week!  <:80s:1300476405079080980> 

## 🌟  Let's do this, Discorders! [Jump on the dialer anytime it's open and get those dials IN!](https://go.kamalaharris.com/dial/national?ref=natl_dis_host_discordveveryoneelse) Help us hit our goal and elect Kamala Harris! 🌟 

All week, also be on the lookout for:
- special live events on The Stage  🎤 
- fun messages, videos, and memes <:eyes:1252803301137842251> 
- updates on our goal! 📈 

## <:celebrate:1252803817095958548>  Let's get those dials in so we can [party like it's 1999](https://youtu.be/rblt2EtFfC4?si=TAExS7rBb9SZs9A7) [!](https://cdn.discordapp.com/attachments/1265762143559618624/1300548748488867850/Screenshot_2024-10-28_at_1.05.08_PM.png?ex=67213de8&is=671fec68&hm=3757f1b42488f5d6bf35f5400ea9b3be6bc9fedc024c7ca8e4b6b1e79a90c617&) <:celebrate:1252803817095958548>"
