id,type,ref_to,timestamp,author_name,author_nickname,author_id,author_avatar_url,content
1269439664704585819,Default,,2024-08-03T23:40:01.114+00:00,reachkaty,Katy (WI),1269438067861753876,assets\d059a773f140fe94a846e6a2e387c239-1DF7D.png,Anyone else from WI here?
1269991698943967346,Default,,2024-08-05T12:13:36.333+00:00,koko4857,Kelly Hewitt (WI),162720466467815424,assets\17a8aff93ff9a4a03f0ab690834ea4a7-D9DFF.png,Me!
1270035851535188090,Default,,2024-08-05T15:09:03.131+00:00,reachkaty,Katy (WI),1269438067861753876,assets\d059a773f140fe94a846e6a2e387c239-1DF7D.png,Hey Kelly!!!
1270035939477164133,Default,,2024-08-05T15:09:24.098+00:00,reachkaty,Katy (WI),1269438067861753876,assets\d059a773f140fe94a846e6a2e387c239-1DF7D.png,"Where are you in WI?  I'm in Manitowoc, right by Lake Michigan."
1270123332364275773,Default,,2024-08-05T20:56:40.186+00:00,koko4857,Kelly Hewitt (WI),162720466467815424,assets\17a8aff93ff9a4a03f0ab690834ea4a7-D9DFF.png,I’m on the opposite side 😂
1270123354703007955,Default,,2024-08-05T20:56:45.512+00:00,koko4857,Kelly Hewitt (WI),162720466467815424,assets\17a8aff93ff9a4a03f0ab690834ea4a7-D9DFF.png,La Crosse!
1270123399330533499,Default,,2024-08-05T20:56:56.152+00:00,koko4857,Kelly Hewitt (WI),162720466467815424,assets\17a8aff93ff9a4a03f0ab690834ea4a7-D9DFF.png,Did you see Kamala is coming to Eau Claire
1270148658507157705,Default,,2024-08-05T22:37:18.409+00:00,reachkaty,Katy (WI),1269438067861753876,assets\d059a773f140fe94a846e6a2e387c239-1DF7D.png,"I did see that!  My sister and I put in our requests to get tickets, so we're waiting with hope to see if we get to join!"
1270148770579091538,Default,,2024-08-05T22:37:45.129+00:00,reachkaty,Katy (WI),1269438067861753876,assets\d059a773f140fe94a846e6a2e387c239-1DF7D.png,Are you going to try to go?
1270168787467112448,Default,,2024-08-05T23:57:17.527+00:00,koko4857,Kelly Hewitt (WI),162720466467815424,assets\17a8aff93ff9a4a03f0ab690834ea4a7-D9DFF.png,Yes! It is my day off so I was lucky with timing.
1270395166905204879,Default,,2024-08-06T14:56:50.591+00:00,hayley_82280,Hayley Hanke [WI],1266879735946809389,assets\752e63f9bebf598c39cc6d4d3bf25e31-24F96.png,Hi all! 👋 I'm in Wausau!
1270419452692795606,Default,,2024-08-06T16:33:20.774+00:00,koko4857,Kelly Hewitt (WI),162720466467815424,assets\17a8aff93ff9a4a03f0ab690834ea4a7-D9DFF.png,Hello!
1270419535949856950,Default,,2024-08-06T16:33:40.624+00:00,koko4857,Kelly Hewitt (WI),162720466467815424,assets\17a8aff93ff9a4a03f0ab690834ea4a7-D9DFF.png,<@1269438067861753876> have you heard back about rsvp and time?
1270419701062697021,Default,,2024-08-06T16:34:19.99+00:00,reachkaty,Katy (WI),1269438067861753876,assets\d059a773f140fe94a846e6a2e387c239-1DF7D.png,"No, not yet 🥺  I'm worried I didn't get a ticket."
1270419777843626088,Reply,1270395166905204879,2024-08-06T16:34:38.296+00:00,reachkaty,Katy (WI),1269438067861753876,assets\d059a773f140fe94a846e6a2e387c239-1DF7D.png,Hi  Hayley!!!
1270419827214778479,Default,,2024-08-06T16:34:50.067+00:00,koko4857,Kelly Hewitt (WI),162720466467815424,assets\17a8aff93ff9a4a03f0ab690834ea4a7-D9DFF.png,I did not know Vance will be in the same town
1270419877676711989,Default,,2024-08-06T16:35:02.098+00:00,reachkaty,Katy (WI),1269438067861753876,assets\d059a773f140fe94a846e6a2e387c239-1DF7D.png,Really? Ewe
1270419891144360020,Default,,2024-08-06T16:35:05.309+00:00,reachkaty,Katy (WI),1269438067861753876,assets\d059a773f140fe94a846e6a2e387c239-1DF7D.png,Ewwww haha
1270420867880587356,Default,,2024-08-06T16:38:58.181+00:00,reachkaty,Katy (WI),1269438067861753876,assets\d059a773f140fe94a846e6a2e387c239-1DF7D.png,But I did just see that someone JUST got confirmation for the PA event and that's today!  So it might be very last minute.
1270421542173671574,Default,,2024-08-06T16:41:38.945+00:00,koko4857,Kelly Hewitt (WI),162720466467815424,assets\17a8aff93ff9a4a03f0ab690834ea4a7-D9DFF.png,I felt like I responded the first day the invitation came and then got lots of reminders
1270421624885219439,Reply,1270420867880587356,2024-08-06T16:41:58.665+00:00,koko4857,Kelly Hewitt (WI),162720466467815424,assets\17a8aff93ff9a4a03f0ab690834ea4a7-D9DFF.png,But I need more than 3 hours notice 😅
1270421662805790721,Default,,2024-08-06T16:42:07.706+00:00,koko4857,Kelly Hewitt (WI),162720466467815424,assets\17a8aff93ff9a4a03f0ab690834ea4a7-D9DFF.png,It’ll take me 2 hours to drive there
1270421701884379248,Default,,2024-08-06T16:42:17.023+00:00,reachkaty,Katy (WI),1269438067861753876,assets\d059a773f140fe94a846e6a2e387c239-1DF7D.png,"Yeah, I received a bunch of texts right after"
1270421729897873439,Default,,2024-08-06T16:42:23.702+00:00,reachkaty,Katy (WI),1269438067861753876,assets\d059a773f140fe94a846e6a2e387c239-1DF7D.png,But nothing simce
1270421745312075827,Default,,2024-08-06T16:42:27.377+00:00,reachkaty,Katy (WI),1269438067861753876,assets\d059a773f140fe94a846e6a2e387c239-1DF7D.png,Since
1270421805995393108,Default,,2024-08-06T16:42:41.845+00:00,reachkaty,Katy (WI),1269438067861753876,assets\d059a773f140fe94a846e6a2e387c239-1DF7D.png,"Yeah, it's a 3.5 hr drive for me"
1270421813012332564,Reply,1270419877676711989,2024-08-06T16:42:43.518+00:00,koko4857,Kelly Hewitt (WI),162720466467815424,assets\17a8aff93ff9a4a03f0ab690834ea4a7-D9DFF.png,Yeah my mom is nervous about going with the crazies out and about
1270421919111319562,Default,,2024-08-06T16:43:08.814+00:00,reachkaty,Katy (WI),1269438067861753876,assets\d059a773f140fe94a846e6a2e387c239-1DF7D.png,I kinda want to just drive over in the hopes that I'll get it
1270421937515921418,Default,,2024-08-06T16:43:13.202+00:00,koko4857,Kelly Hewitt (WI),162720466467815424,assets\17a8aff93ff9a4a03f0ab690834ea4a7-D9DFF.png,I didn’t get any texts
1270421976745382070,Default,,2024-08-06T16:43:22.555+00:00,reachkaty,Katy (WI),1269438067861753876,assets\d059a773f140fe94a846e6a2e387c239-1DF7D.png,"If not, spend the day in Eau Claire haha"
1270422120903606282,Reply,1270420867880587356,2024-08-06T16:43:56.925+00:00,koko4857,Kelly Hewitt (WI),162720466467815424,assets\17a8aff93ff9a4a03f0ab690834ea4a7-D9DFF.png,I wonder how much notice they got
1270422127773876275,Reply,1270421937515921418,2024-08-06T16:43:58.563+00:00,reachkaty,Katy (WI),1269438067861753876,assets\d059a773f140fe94a846e6a2e387c239-1DF7D.png,Hmmm... who knows why
1270422248087355442,Default,,2024-08-06T16:44:27.248+00:00,reachkaty,Katy (WI),1269438067861753876,assets\d059a773f140fe94a846e6a2e387c239-1DF7D.png,I'm gonna ask.  They're chatting in the general convo spot here.
1270423228740931594,Default,,2024-08-06T16:48:21.054+00:00,reachkaty,Katy (WI),1269438067861753876,assets\d059a773f140fe94a846e6a2e387c239-1DF7D.png,She might have had to get going.  No answer.
1270423287574429707,Default,,2024-08-06T16:48:35.081+00:00,reachkaty,Katy (WI),1269438067861753876,assets\d059a773f140fe94a846e6a2e387c239-1DF7D.png,This is the only email I got.
1270423426930049138,Default,,2024-08-06T16:49:08.306+00:00,reachkaty,Katy (WI),1269438067861753876,assets\d059a773f140fe94a846e6a2e387c239-1DF7D.png,Oh we can't attach images here?
1270427078331863212,Default,,2024-08-06T17:03:38.868+00:00,reachkaty,Katy (WI),1269438067861753876,assets\d059a773f140fe94a846e6a2e387c239-1DF7D.png,My sister and I just decided we're gonna drive over regardless.  Hopefully we'll get tickets but if not we'll have the memory of trying.  😁
1270428685555597353,Default,,2024-08-06T17:10:02.06+00:00,koko4857,Kelly Hewitt (WI),162720466467815424,assets\17a8aff93ff9a4a03f0ab690834ea4a7-D9DFF.png,What time are you trying to go?
1270428723425968189,Default,,2024-08-06T17:10:11.089+00:00,koko4857,Kelly Hewitt (WI),162720466467815424,assets\17a8aff93ff9a4a03f0ab690834ea4a7-D9DFF.png,I have an appt in the morning in La crosse
1270428842145878089,Reply,1270422248087355442,2024-08-06T17:10:39.394+00:00,koko4857,Kelly Hewitt (WI),162720466467815424,assets\17a8aff93ff9a4a03f0ab690834ea4a7-D9DFF.png,I tried to ask too
1270429103845146624,Default,,2024-08-06T17:11:41.788+00:00,reachkaty,Katy (WI),1269438067861753876,assets\d059a773f140fe94a846e6a2e387c239-1DF7D.png,"The email confirmation said the event is between 8 and 2, so we're gonna try to be there by 8.   I have no idea when it is supposed to actually take place."
1270476954268860519,Default,,2024-08-06T20:21:50.218+00:00,koko4857,Kelly Hewitt (WI),162720466467815424,assets\17a8aff93ff9a4a03f0ab690834ea4a7-D9DFF.png,Ope well maybe I won’t make it
1270477091321679913,Reply,1270429103845146624,2024-08-06T20:22:22.894+00:00,koko4857,Kelly Hewitt (WI),162720466467815424,assets\17a8aff93ff9a4a03f0ab690834ea4a7-D9DFF.png,Did you recently get a confirmation email?
1270483434703163525,Default,,2024-08-06T20:47:35.274+00:00,reachkaty,Katy (WI),1269438067861753876,assets\d059a773f140fe94a846e6a2e387c239-1DF7D.png,It came within minutes after I registered
1270494272197623830,Default,,2024-08-06T21:30:39.134+00:00,koko4857,Kelly Hewitt (WI),162720466467815424,assets\17a8aff93ff9a4a03f0ab690834ea4a7-D9DFF.png,"Weird, maybe they kept up with it initially but then got overwhelmed?"
1270494327411314799,Default,,2024-08-06T21:30:52.298+00:00,koko4857,Kelly Hewitt (WI),162720466467815424,assets\17a8aff93ff9a4a03f0ab690834ea4a7-D9DFF.png,But why keep sending out emails to rsvp 🤷🏻‍♀️
1270494460366815315,Default,,2024-08-06T21:31:23.997+00:00,reachkaty,Katy (WI),1269438067861753876,assets\d059a773f140fe94a846e6a2e387c239-1DF7D.png,No idea
1270533339094319207,Default,,2024-08-07T00:05:53.408+00:00,reachkaty,Katy (WI),1269438067861753876,assets\d059a773f140fe94a846e6a2e387c239-1DF7D.png,Did you get it?!!!!  I just did
1270533393536389180,Default,,2024-08-07T00:06:06.388+00:00,reachkaty,Katy (WI),1269438067861753876,assets\d059a773f140fe94a846e6a2e387c239-1DF7D.png,<@162720466467815424>
1270539073253146805,Default,,2024-08-07T00:28:40.538+00:00,zunny74,Zunny A. (AK),1199911282623664181,assets\52660799150def15051b3d33ab1cf95f-068BE.png,"Hi, have a few friends and distant relatives that were from WI. I just wanted to see where I could lend a hand."
1270553518213959682,Reply,1270533393536389180,2024-08-07T01:26:04.485+00:00,koko4857,Kelly Hewitt (WI),162720466467815424,assets\17a8aff93ff9a4a03f0ab690834ea4a7-D9DFF.png,Yeah I got it at 7:39! Table B
1270556415551078470,Default,,2024-08-07T01:37:35.264+00:00,koko4857,Kelly Hewitt (WI),162720466467815424,assets\17a8aff93ff9a4a03f0ab690834ea4a7-D9DFF.png,What time will you plan to arrive?
1270689023727243266,Default,,2024-08-07T10:24:31.517+00:00,reachkaty,Katy (WI),1269438067861753876,assets\d059a773f140fe94a846e6a2e387c239-1DF7D.png,We're gonna be there by 8. Looks like they start letting us in at 9.
1270689320260472872,Default,,2024-08-07T10:25:42.216+00:00,reachkaty,Katy (WI),1269438067861753876,assets\d059a773f140fe94a846e6a2e387c239-1DF7D.png,"Mine says General Admission, Table 1"
1270719475209080884,Default,,2024-08-07T12:25:31.716+00:00,koko4857,Kelly Hewitt (WI),162720466467815424,assets\17a8aff93ff9a4a03f0ab690834ea4a7-D9DFF.png,Argh
1270719548215136328,Default,,2024-08-07T12:25:49.122+00:00,koko4857,Kelly Hewitt (WI),162720466467815424,assets\17a8aff93ff9a4a03f0ab690834ea4a7-D9DFF.png,Im second guessing myself. Maybe I should leave earlier I have a class at 8
1270729663781535881,Reply,1270689023727243266,2024-08-07T13:06:00.861+00:00,koko4857,Kelly Hewitt (WI),162720466467815424,assets\17a8aff93ff9a4a03f0ab690834ea4a7-D9DFF.png,"I just looked at the venue, this looks like it might be outside?"
1270745580007854112,Default,,2024-08-07T14:09:15.585+00:00,reachkaty,Katy (WI),1269438067861753876,assets\d059a773f140fe94a846e6a2e387c239-1DF7D.png,Not sure but you might be right.  My sis and I are in the very long line now!
1270763523382706269,Reply,1270745580007854112,2024-08-07T15:20:33.619+00:00,koko4857,Kelly Hewitt (WI),162720466467815424,assets\17a8aff93ff9a4a03f0ab690834ea4a7-D9DFF.png,Still in line?
1270765755734036662,Default,,2024-08-07T15:29:25.853+00:00,koko4857,Kelly Hewitt (WI),162720466467815424,assets\17a8aff93ff9a4a03f0ab690834ea4a7-D9DFF.png,I’m about 3 miles away and there’s a lot of traffic
1270768233976168449,Default,,2024-08-07T15:39:16.712+00:00,reachkaty,Katy (WI),1269438067861753876,assets\d059a773f140fe94a846e6a2e387c239-1DF7D.png,We're in now. Right in front of the stage!
1270773802594336788,Default,,2024-08-07T16:01:24.374+00:00,koko4857,Kelly Hewitt (WI),162720466467815424,assets\17a8aff93ff9a4a03f0ab690834ea4a7-D9DFF.png,I’m honestly worried I won’t get in
1270882796222545981,Default,,2024-08-07T23:14:30.48+00:00,koko4857,Kelly Hewitt (WI),162720466467815424,assets\17a8aff93ff9a4a03f0ab690834ea4a7-D9DFF.png,I got in
1270882855781666888,Reply,1270768233976168449,2024-08-07T23:14:44.68+00:00,koko4857,Kelly Hewitt (WI),162720466467815424,assets\17a8aff93ff9a4a03f0ab690834ea4a7-D9DFF.png,How long did it take you to leave the venue?
1270921287908462725,Default,,2024-08-08T01:47:27.613+00:00,reachkaty,Katy (WI),1269438067861753876,assets\d059a773f140fe94a846e6a2e387c239-1DF7D.png,"Gosh, we sat waiting to exit for a full 90 minutes."
1270922818246283295,Default,,2024-08-08T01:53:32.474+00:00,koko4857,Kelly Hewitt (WI),162720466467815424,assets\17a8aff93ff9a4a03f0ab690834ea4a7-D9DFF.png,Yeah I can imagine. I ended up parking on a side street and just walking the 1.7 miles to the venue
1270922940472496188,Default,,2024-08-08T01:54:01.615+00:00,koko4857,Kelly Hewitt (WI),162720466467815424,assets\17a8aff93ff9a4a03f0ab690834ea4a7-D9DFF.png,It actually worked out well because I left a few minutes early and walked to my car for 30 min and was able to just leave 😅
1270923210015117323,Default,,2024-08-08T01:55:05.879+00:00,reachkaty,Katy (WI),1269438067861753876,assets\d059a773f140fe94a846e6a2e387c239-1DF7D.png,Oh that's nice!  It was a great event.  Glad you made it in!
1270923244555472937,Default,,2024-08-08T01:55:14.114+00:00,koko4857,Kelly Hewitt (WI),162720466467815424,assets\17a8aff93ff9a4a03f0ab690834ea4a7-D9DFF.png,Me too!
1270923307897585705,Default,,2024-08-08T01:55:29.216+00:00,koko4857,Kelly Hewitt (WI),162720466467815424,assets\17a8aff93ff9a4a03f0ab690834ea4a7-D9DFF.png,Bummer I did t get into the risers like my admission ticket said I should’ve
1270923441721180180,Default,,2024-08-08T01:56:01.122+00:00,reachkaty,Katy (WI),1269438067861753876,assets\d059a773f140fe94a846e6a2e387c239-1DF7D.png,Oh that's too bad.  It was SO hot being out there since 8:30.  I'm exhausted.
1270923473023406204,Default,,2024-08-08T01:56:08.585+00:00,koko4857,Kelly Hewitt (WI),162720466467815424,assets\17a8aff93ff9a4a03f0ab690834ea4a7-D9DFF.png,You win some you lose some I guess
1270923491360772107,Default,,2024-08-08T01:56:12.957+00:00,reachkaty,Katy (WI),1269438067861753876,assets\d059a773f140fe94a846e6a2e387c239-1DF7D.png,Yeah
1270923508549025884,Default,,2024-08-08T01:56:17.055+00:00,koko4857,Kelly Hewitt (WI),162720466467815424,assets\17a8aff93ff9a4a03f0ab690834ea4a7-D9DFF.png,My neck is also thoroughly crisped
1270923638861861057,Default,,2024-08-08T01:56:48.124+00:00,reachkaty,Katy (WI),1269438067861753876,assets\d059a773f140fe94a846e6a2e387c239-1DF7D.png,"I feel a bit burned too, but I did have sunscreen and a visor which helped."
1272883758479052821,Default,,2024-08-13T11:45:37.058+00:00,reachkaty,Katy (WI),1269438067861753876,assets\d059a773f140fe94a846e6a2e387c239-1DF7D.png,Don't forget to vote today in Wisconsin and flip the ballot for the 2 referendum questions... NO to those!
1273338794619310172,Default,,2024-08-14T17:53:46.128+00:00,koko4857,Kelly Hewitt (WI),162720466467815424,assets\17a8aff93ff9a4a03f0ab690834ea4a7-D9DFF.png,We did it!!!
1273364663270379550,Default,,2024-08-14T19:36:33.695+00:00,reachkaty,Katy (WI),1269438067861753876,assets\d059a773f140fe94a846e6a2e387c239-1DF7D.png,Yes!!!!  Woohoo!  I hope this translates to what we see from Wisconsin in November!
1273365064048574525,Reply,1270539073253146805,2024-08-14T19:38:09.248+00:00,reachkaty,Katy (WI),1269438067861753876,assets\d059a773f140fe94a846e6a2e387c239-1DF7D.png,"Did we reply to you?  Sorry, if not!  I'd say just encourage them to get engaged in the campaign, if they are in support of Harris.  The more the better."
1273365247587254303,Default,,2024-08-14T19:38:53.007+00:00,reachkaty,Katy (WI),1269438067861753876,assets\d059a773f140fe94a846e6a2e387c239-1DF7D.png,<@1266879735946809389> how are things in the Wausau area?
1273689183806033960,Default,,2024-08-15T17:06:05.42+00:00,koko4857,Kelly Hewitt (WI),162720466467815424,assets\17a8aff93ff9a4a03f0ab690834ea4a7-D9DFF.png,Just got the notice that Harris will be in MKE next Tuesday!
1273739523485995141,Default,,2024-08-15T20:26:07.335+00:00,reachkaty,Katy (WI),1269438067861753876,assets\d059a773f140fe94a846e6a2e387c239-1DF7D.png,Oooh really?  Is it a rally or something more low key?
1273831785184231516,Default,,2024-08-16T02:32:44.238+00:00,carb.on,Carolyn B [CA] • Lead Mod,568257600228032512,assets\28a90c77b5793d80eb62484a43c66748-D8837.png,<@1269438067861753876> and  <@162720466467815424> at the Fiserv Forum.
1275255625118388286,Default,,2024-08-20T00:50:34.132+00:00,nico98109,Nico98109,1273913215411294208,assets\084623bd66114f59aff75b1b8ded6e6e-C8948.png,Hey friends! Anyone working/volunteering for the campaign in WI?  I can spend a month volunteering. Who should I talk with?
1275272573252276307,Reply,1275255625118388286,2024-08-20T01:57:54.882+00:00,koko4857,Kelly Hewitt (WI),162720466467815424,assets\17a8aff93ff9a4a03f0ab690834ea4a7-D9DFF.png,Maybe get into contact with WisDems?
1275272608857718804,Default,,2024-08-20T01:58:03.371+00:00,koko4857,Kelly Hewitt (WI),162720466467815424,assets\17a8aff93ff9a4a03f0ab690834ea4a7-D9DFF.png,Is there any specific place you want to be in WI?
1275273315547873410,Default,,2024-08-20T02:00:51.859+00:00,nico98109,Nico98109,1273913215411294208,assets\084623bd66114f59aff75b1b8ded6e6e-C8948.png,"I've tried reaching out them. I was given an email address for a Ms. Myer but no response. 
I could be anywhere --I live out of state and have family in Dane. But I can rent a spot nearly anywhere. I just need to get in touch w people who could use me."
1275420808528789504,Reply,1275273315547873410,2024-08-20T11:46:56.926+00:00,koko4857,Kelly Hewitt (WI),162720466467815424,assets\17a8aff93ff9a4a03f0ab690834ea4a7-D9DFF.png,How long did you say you’ll be here?
1275477576738934785,Default,,2024-08-20T15:32:31.522+00:00,reachkaty,Katy (WI),1269438067861753876,assets\d059a773f140fe94a846e6a2e387c239-1DF7D.png,"I think you'll just need to get a hold of local offices of Democrats in whatever city you're choosing.  Or are you choosing a city based on where there's a need?  That's tricky, because not all cities have an office."
1275477633320222811,Default,,2024-08-20T15:32:45.012+00:00,reachkaty,Katy (WI),1269438067861753876,assets\d059a773f140fe94a846e6a2e387c239-1DF7D.png,"Perhaps decide based on this

https://archive.jsonline.com/blogs/news/284675921.html"
1275493185694732379,Default,,2024-08-20T16:34:32.987+00:00,koko4857,Kelly Hewitt (WI),162720466467815424,assets\17a8aff93ff9a4a03f0ab690834ea4a7-D9DFF.png,Yeah I would say contact local offices
1275686637178720266,Reply,1275420808528789504,2024-08-21T05:23:15.415+00:00,nico98109,Nico98109,1273913215411294208,assets\084623bd66114f59aff75b1b8ded6e6e-C8948.png,A month or so?
1275820144589017173,Reply,1275686637178720266,2024-08-21T14:13:46.062+00:00,priven.,Rich Holcombe (WI),740977201436164177,assets\63e48c9523aa87666c7f4d2b6d23a691-271FE.png,You'll be in Dane county?
1275965138301751328,Default,,2024-08-21T23:49:55.257+00:00,nico98109,Nico98109,1273913215411294208,assets\084623bd66114f59aff75b1b8ded6e6e-C8948.png,I can be. I can also go elsewhere if needed. I just need wifi to work during some days 🙂
1276172757360578625,Reply,1275965138301751328,2024-08-22T13:34:55.498+00:00,priven.,Rich Holcombe (WI),740977201436164177,assets\63e48c9523aa87666c7f4d2b6d23a691-271FE.png,info@danedems.org can likely help
1276266448708436069,Default,,2024-08-22T19:47:13.256+00:00,carb.on,Carolyn B [CA] • Lead Mod,568257600228032512,assets\28a90c77b5793d80eb62484a43c66748-D8837.png,## [Wisconsin Voter Information](https://www.vote.org/state/wisconsin/)
1276266472716501223,ChannelPinnedMessage,1276266448708436069,2024-08-22T19:47:18.98+00:00,carb.on,Carolyn B [CA] • Lead Mod,568257600228032512,assets\28a90c77b5793d80eb62484a43c66748-D8837.png,Pinned a message.
1276393083990315048,Default,,2024-08-23T04:10:25.46+00:00,rootsmusic,rootsmusic,791857656897732648,assets\a30e650576a6d42a3c9ee24648f67c90-2AE37.png,[Kamala for Wisconsin's Watch Party](https://x.com/KamalaForWI/status/1826809082067722329)
1276697935567917178,Default,,2024-08-24T00:21:47.74+00:00,koko4857,Kelly Hewitt (WI),162720466467815424,assets\17a8aff93ff9a4a03f0ab690834ea4a7-D9DFF.png,Ooo I like to signs too
1277653543477575735,Default,,2024-08-26T15:39:02.42+00:00,reachkaty,Katy (WI),1269438067861753876,assets\d059a773f140fe94a846e6a2e387c239-1DF7D.png,Hey folks -- I've asked if they an add the ability to include attachments in our WI channel.  I want to be able to share WI-related photos and ideas.
1277776415512596502,Default,,2024-08-26T23:47:17.396+00:00,hufflepuffmama.,Hufflepuff Mama,1277023232817365052,assets\0d82aa8e6fbe1c78d39f08fefd484f73-EFEA6.png,"@Host Admin we have a good friend in Milwaukee, WI, and thinking of driving up and trying to canvas with her. How do I connect with the local office to see if there’s something we can participate in?"
1277786286845067264,Reply,1277776415512596502,2024-08-27T00:26:30.905+00:00,everyonepoops9590,Josh,707943285561360385,assets\4-4551A.png,Mobilize is a good starting point.  You can get more specific with the neighborhoods as needed. https://www.mobilize.us/wisdems/?address=Milwaukee%2C%20WI%2C%20USA&lat=43.0389025&lon=-87.9064736
1278153164264308868,Default,,2024-08-28T00:44:21.298+00:00,koko4857,Kelly Hewitt (WI),162720466467815424,assets\17a8aff93ff9a4a03f0ab690834ea4a7-D9DFF.png,Ewwwh 🍊 is going to be in town Thursday
1278319654699536425,Default,,2024-08-28T11:45:55.711+00:00,reachkaty,Katy (WI),1269438067861753876,assets\d059a773f140fe94a846e6a2e387c239-1DF7D.png,Hope it's poorly attended
1278331150472974451,Default,,2024-08-28T12:31:36.517+00:00,tradinginnwa_29759,Russell Rappel Schmid (AR),1242847879182286910,assets\3fa57d10517651b0bab754574f7936b9-9A6C2.png,Born and raised in MKE. Family still in Central and Southeastern WI. I live in Northwest AR currently but wanted to connect with my home state and keep up with what you all are chatting about.
1278337073211899927,Reply,1278331150472974451,2024-08-28T12:55:08.608+00:00,reachkaty,Katy (WI),1269438067861753876,assets\d059a773f140fe94a846e6a2e387c239-1DF7D.png,"Hi there!  What's your name?  We haven't been chatting that much, but it's nice to meet you."
1278345227983130695,Default,,2024-08-28T13:27:32.857+00:00,tradinginnwa_29759,Russell Rappel Schmid (AR),1242847879182286910,assets\3fa57d10517651b0bab754574f7936b9-9A6C2.png,"Hi Katy, I'm Russ."
1278365865305440316,Default,,2024-08-28T14:49:33.178+00:00,priven.,Rich Holcombe (WI),740977201436164177,assets\63e48c9523aa87666c7f4d2b6d23a691-271FE.png,"Hi Russ, 👋🏻 through here or wisdems you can make calls into the state if you'd like."
1278623868319432744,Default,,2024-08-29T07:54:45.89+00:00,tradinginnwa_29759,Russell Rappel Schmid (AR),1242847879182286910,assets\3fa57d10517651b0bab754574f7936b9-9A6C2.png,Hi Rich! 👋
1278695339339157617,Default,,2024-08-29T12:38:45.909+00:00,priven.,Rich Holcombe (WI),740977201436164177,assets\63e48c9523aa87666c7f4d2b6d23a691-271FE.png,"Found this yesterday
https://www.mobilize.us/dpw/event/675012/"
1278790559070294147,Default,,2024-08-29T18:57:08.062+00:00,koko4857,Kelly Hewitt (WI),162720466467815424,assets\17a8aff93ff9a4a03f0ab690834ea4a7-D9DFF.png,
1278790630918590590,Default,,2024-08-29T18:57:25.192+00:00,koko4857,Kelly Hewitt (WI),162720466467815424,assets\17a8aff93ff9a4a03f0ab690834ea4a7-D9DFF.png,People waiting outside the rally—don’t worry this is from news outlet and I’m not personally near the rally.
1278790682873696308,Default,,2024-08-29T18:57:37.579+00:00,koko4857,Kelly Hewitt (WI),162720466467815424,assets\17a8aff93ff9a4a03f0ab690834ea4a7-D9DFF.png,But this shirt makes me so uncomfortable
1279078613098168320,Reply,1278790682873696308,2024-08-30T14:01:45.494+00:00,tradinginnwa_29759,Russell Rappel Schmid (AR),1242847879182286910,assets\3fa57d10517651b0bab754574f7936b9-9A6C2.png,"It's like from The Grinch Who Stole Christmas. They stole a ""thing"" but they can never steal the feeling behind the thing."
1279126835191349369,Default,,2024-08-30T17:13:22.537+00:00,martarichenburg_59797,Marta Richenburg,1260983976483356767,assets\a57efb34b9ef35ed7f644aca5ab803aa-F2CBD.png,<@&1245911026025889853> IMPORTANT: There is new WI specific content in your Reach Gallery! Make sure to check it out for content like this!
1279144301812514886,Default,,2024-08-30T18:22:46.904+00:00,rebelbot,rebelbot,561040480553533470,assets\f25b78d54fdf332968e897b99a4762f3-23763.png,I also found I couldn’t find things until I was added to wisdems on Reach.
1279145444219424788,Reply,1279144301812514886,2024-08-30T18:27:19.275+00:00,rootsmusic,rootsmusic,791857656897732648,assets\a30e650576a6d42a3c9ee24648f67c90-2AE37.png,The state campaign's content are different from the national campaign's content.  For example: the national campaign has a [Wisconsin gallery](https://app.reach.vote/library/gallery/6580e1f3-0149-44c6-8b68-233ca9be2176?campaign=democrats).
1279215087152009257,ChannelPinnedMessage,1279126835191349369,2024-08-30T23:04:03.444+00:00,carb.on,Carolyn B [CA] • Lead Mod,568257600228032512,assets\28a90c77b5793d80eb62484a43c66748-D8837.png,Pinned a message.
