id,type,ref_to,timestamp,author_name,author_nickname,author_id,author_avatar_url,content
1276571708236759070,Default,,2024-08-23T16:00:12.799+00:00,caedwyn1995,Kathleen Boggan Zierhut,533730331111587850,assets\1-B2132.png,I'm all set up to text. But during training I was told a laptop is preferred to a tablet. Tablet is more convenient for me. Is there a big difference?
1276595529392062597,Default,,2024-08-23T17:34:52.205+00:00,kcmpolitical,Kris Morrell (CA) - KC TextAdmin,1254144571089354868,assets\f7ebcd4727f2b8e05b4382b1b1eb6d74-1D9FE.png,"Started to write a long message about difference between Discord app on iPad and laptop, but really the issue is Spoke. One of the BIG problems is that people on the mobile app (so, I believe this is probably true for the tablet, haven't checked) cannot see tags as easily. We are finding A LOT of people who neglect to tag conversations correctly. It may also be more difficult to see all the survey responses and canned replies. 

So basically, texters are making mistakes in their conversations due in part to using a mobile device rather than a desktop/laptop. This creates a lot of work for us mods on the back end of things...also will create a lot of feedback to texters."
1276601634792804363,Default,,2024-08-23T17:59:07.846+00:00,caedwyn1995,Kathleen Boggan Zierhut,533730331111587850,assets\1-B2132.png,"Thank you for the great explanation! I will see what things look like on my tablet, and if I can't find the tags I'll switch to desktop. I  used my tablet in 2020 without problems, but maybe things are different now."
1276605584443052203,Default,,2024-08-23T18:14:49.516+00:00,kcmpolitical,Kris Morrell (CA) - KC TextAdmin,1254144571089354868,assets\f7ebcd4727f2b8e05b4382b1b1eb6d74-1D9FE.png,"Let me know how it goes, I’m sure this question will come up again. In 2020 we used ThruText, so the interface was completely different."
