id,type,ref_to,timestamp,author_name,author_nickname,author_id,author_avatar_url,content
1276687226507362394,Default,,2024-08-23T23:39:14.501+00:00,renown8908,Thomas W E,160094709543469056,assets\564b1b06163ea6ffd4f6b556ca413fb0-21B7F.png,"Essentially the headline.

Called several people today, had some good talks some hang ups... but recently a lot of my calls have gone 'unheard'. Even had someone say ""I'm on a national do not call list"" but I couldn't even be heard!"
1276710038529900649,Default,,2024-08-24T01:09:53.311+00:00,sdgc_76906,Erica Ramos [CA] [Call Mod],1206655433905930251,assets\d89cc8ea1b8dc7f778a48cfb80348315-7B1A6.png,Hi Thomas! Are you using one or two devices? Sometimes using two can be a little more consistent with audio
1276716492293017651,Default,,2024-08-24T01:35:32.008+00:00,renown8908,Thomas W E,160094709543469056,assets\564b1b06163ea6ffd4f6b556ca413fb0-21B7F.png,Was using one device. How would you recommend using two? I was using my phone to call and stay connected.
1276716668780937298,Default,,2024-08-24T01:36:14.086+00:00,sdgc_76906,Erica Ramos [CA] [Call Mod],1206655433905930251,assets\d89cc8ea1b8dc7f778a48cfb80348315-7B1A6.png,Do you have a laptop or tablet in addition to your phone? You can connect to the dialer on the larger device and then use your phone for audio.
1276717047287644190,Default,,2024-08-24T01:37:44.329+00:00,sdgc_76906,Erica Ramos [CA] [Call Mod],1206655433905930251,assets\d89cc8ea1b8dc7f778a48cfb80348315-7B1A6.png,"When you first join the dialer, it will ask if you want to ""Call with this device"" or ""Call with this device + phone for audio"". If you pick the second, it will walk you through connecting your phone to the dialer 🙂"
1276737331961008190,Default,,2024-08-24T02:58:20.572+00:00,renown8908,Thomas W E,160094709543469056,assets\564b1b06163ea6ffd4f6b556ca413fb0-21B7F.png,"Unfortunately, not all on the same network. I have a desktop that is wired, and my phone is on the network."
1276737496805412914,Default,,2024-08-24T02:58:59.874+00:00,renown8908,Thomas W E,160094709543469056,assets\564b1b06163ea6ffd4f6b556ca413fb0-21B7F.png,my gf has a laptop... we were planning on phone banking together tomorrow.
1276741104657764393,Default,,2024-08-24T03:13:20.053+00:00,sdgc_76906,Erica Ramos [CA] [Call Mod],1206655433905930251,assets\d89cc8ea1b8dc7f778a48cfb80348315-7B1A6.png,I don't think it has to be on the same network - I think it calls your phone and uses that for audio but not your phone number. But check in tomorrow - there are lots of Mods with more expertiese than me on this one 🙂
1276933664936169673,Default,,2024-08-24T15:58:30.001+00:00,pisa.lisa,Lisa Valdez CA,1245459437200740413,assets\562ebff150e8449fd2b4a2cb13576652-2286D.png,"Thomas, I always use two devices and I can assure you don't need to share the network. You could call from a land line, it wouldn't matter so long as your using scale to win on the computer. Sometimes I also have issues where they can't hear me. Sometimes they are faking it and the reason I know that is because I learned some tricks. If it happens more than 3x in a row, just disconnect your phone (hang up) and restart the session."
