id,type,ref_to,timestamp,author_name,author_nickname,author_id,author_avatar_url,content
1282931260037267457,21,1282931151035568189,2024-09-10T05:10:48.103+00:00,jayrio76,Jay E  (TX)  OE Mod,782870341445353522,assets\41ef520387924aa4413513eda28784df-34D82.png,
1282931261282717738,Default,,2024-09-10T05:10:48.4+00:00,jayrio76,Jay E  (TX)  OE Mod,782870341445353522,assets\41ef520387924aa4413513eda28784df-34D82.png,Polling Discussion
1282931372658262078,Default,,2024-09-10T05:11:14.954+00:00,jayrio76,Jay E  (TX)  OE Mod,782870341445353522,assets\41ef520387924aa4413513eda28784df-34D82.png,"Yes, mostly older folks <@944346473691226153>"
1282932126508912711,Default,,2024-09-10T05:14:14.686+00:00,carb.on,Carolyn B [CA] • Lead Mod,568257600228032512,assets\28a90c77b5793d80eb62484a43c66748-D8837.png,"Polsters need to figure out how to get there questions to pop up in our social media feeds, to reach a broader demographic."
1282932196335812648,Default,,2024-09-10T05:14:31.334+00:00,katevotes,Kate Z [PA → CA],1264709290195685416,assets\57433312dd39630d8fec96a3149006e0-CB7BF.png,"All older folks, or just certain demographics?

If the population is dominated by older white men (and maybe white women), I could see the bias being reversed from 2016"
1282932539727675402,Default,,2024-09-10T05:15:53.205+00:00,katevotes,Kate Z [PA → CA],1264709290195685416,assets\57433312dd39630d8fec96a3149006e0-CB7BF.png,"Honestly the best thing to do is a variety of approaches, all with their own biases, and try to look for the consistent trends across those approaches"
