id,type,ref_to,timestamp,author_name,author_nickname,author_id,author_avatar_url,content
1279870969455841401,Default,,2024-09-01T18:30:17.971+00:00,agutmann3110,Anna Gutmann (OH),1275940050772951051,assets\6c5996770c985bcd6e5b68131ff2ba04-4DF7B.png,"There is nooooo way I could afford a trip like that lol. But who  knows, maybe our old house will sell before then and someone will pay more than we need for it"
1279871853975965706,Default,,2024-09-01T18:33:48.857+00:00,kimmai,Kimmai • Mod,381286854059884545,assets\2b7bae57ddbd0d84b7da8969f39cb4e7-1F88B.png,"If Kamala wins, I plan to go to DC by train because there’s no way I’m driving in that traffic lol"
1279871982057426946,Reply,1279871853975965706,2024-09-01T18:34:19.394+00:00,gabbywpa85,Gabrielle Weiss (PA),1268364888670208133,assets\9aba90e71ef985acd9142b3316cfaab0-2D0BF.png,Yep ditto
1279872216204578929,Default,,2024-09-01T18:35:15.219+00:00,gabbywpa85,Gabrielle Weiss (PA),1268364888670208133,assets\9aba90e71ef985acd9142b3316cfaab0-2D0BF.png,But I bet they’ll be crowded! I’d plan now but am afraid of what happens if…I can’t even say it 😭😭
1279872675250049137,Default,,2024-09-01T18:37:04.664+00:00,joy0517,Joy,1270181057966116996,assets\34941b26d3e818f841bee19d4dc268bf-81089.png,"Question about getting the youth vote out, please….   
I am in VA and volunteered to canvass in PA- my sister is there and I spent was early teen through college years there.    
I saw advertisements around visiting college campuses to distribute literature and register voters, etc.   
I would love to do that. I currently work for JMU- a VA University. 
There is a Community College close to my sister’s. 
How might I find out about doing this, please??
Many thanks!! 💙💙💙💙"
1279876604239155296,Reply,1279872675250049137,2024-09-01T18:52:41.408+00:00,kimmai,Kimmai • Mod,381286854059884545,assets\2b7bae57ddbd0d84b7da8969f39cb4e7-1F88B.png,"Hi Joy! If you visit mobilize.us, you can often find in-person events in your area & surrounding areas that involve engaging younger voters at college campuses, registering them to vote, etc. 

Along with mobilize.us, you can also volunteer to phone bank and text bank with us to engage with voters of all demographics as well. Thanks for joining in on the fight with us! 💙"
1279884710176358500,Reply,1279876604239155296,2024-09-01T19:24:54.014+00:00,joy0517,Joy,1270181057966116996,assets\34941b26d3e818f841bee19d4dc268bf-81089.png,"I check my schedule regularly on Mobilize for updates to my phone banking dates and canvassing as well. My schedule is fairly full. 
Thank you for recommending it to search for this in person possibility in PA. 
Happy Labor Day weekend!! ♥️🤍💙"
1279891133438230589,Reply,1279884710176358500,2024-09-01T19:50:25.439+00:00,kimmai,Kimmai • Mod,381286854059884545,assets\2b7bae57ddbd0d84b7da8969f39cb4e7-1F88B.png,No problem at all. Happy Labor Day Weekend to you as well! ❤️🤍💙
1279920658540789842,Default,,2024-09-01T21:47:44.772+00:00,agutmann3110,Anna Gutmann (OH),1275940050772951051,assets\6c5996770c985bcd6e5b68131ff2ba04-4DF7B.png,You guys my husband just sent me a photo of an article from cspan saying their rally stream starts at 4:45pm!
1279920985600168048,Default,,2024-09-01T21:49:02.749+00:00,agutmann3110,Anna Gutmann (OH),1275940050772951051,assets\6c5996770c985bcd6e5b68131ff2ba04-4DF7B.png,"That gives me a timeline, and if I can find a single person who’s going to the Labor Day parade in Pittsburgh, whose willing to hold two tickets for us (I would send money by Venmo or whatever to pay obviously), I could still make it"
1279921491000954912,Default,,2024-09-01T21:51:03.246+00:00,agutmann3110,Anna Gutmann (OH),1275940050772951051,assets\6c5996770c985bcd6e5b68131ff2ba04-4DF7B.png,"Because we have this info which is all we could find that might identify where dems will be gathering: Downtown streets close at 10 AM
11 am-1 pm Parade passes by Reviewing Stand & City Dem Gathering
Stanwix Street and Blvd of the Allies

BE THERE! Joe Biden and Kamala Harris will be in Pittsburgh on Labor Day! The Pgh Dems (City Dem Committee) invites committee members and friends from across the city to gather at the corner of Stanwix and Blvd of the Allies across from the reviewing stand to cheer on Dem Office holders and candidates and our labor union friends. And we might even see Joe and Kamala in the viewing stands."
1279941796880842752,Default,,2024-09-01T23:11:44.545+00:00,gabbywpa85,Gabrielle Weiss (PA),1268364888670208133,assets\9aba90e71ef985acd9142b3316cfaab0-2D0BF.png,Wait Joe is there too??? Omg. I’d go in a second if it were closer. Also hope they both stay safe!
1279941903722479757,Default,,2024-09-01T23:12:10.018+00:00,gabbywpa85,Gabrielle Weiss (PA),1268364888670208133,assets\9aba90e71ef985acd9142b3316cfaab0-2D0BF.png,"(I’m sorry, I just worry too much)"
1279942325451362395,Default,,2024-09-01T23:13:50.566+00:00,kimmai,Kimmai • Mod,381286854059884545,assets\2b7bae57ddbd0d84b7da8969f39cb4e7-1F88B.png,"I feel like ever since that assassination attempt on Trump, security for rallies has really beefed up. (Which is a good thing, considering how tense the political climate is right now)."
1279943928233328691,Reply,1279942325451362395,2024-09-01T23:20:12.699+00:00,gabbywpa85,Gabrielle Weiss (PA),1268364888670208133,assets\9aba90e71ef985acd9142b3316cfaab0-2D0BF.png,Yeah true. Also I don’t think I realized you were a Mod. Good for you
1279946317661212765,Reply,1279943928233328691,2024-09-01T23:29:42.383+00:00,kimmai,Kimmai • Mod,381286854059884545,assets\2b7bae57ddbd0d84b7da8969f39cb4e7-1F88B.png,Thank you! Just became official today 😊. It feels great being able to make a difference and help encourage our volunteers.
1279946583903047783,Reply,1279946317661212765,2024-09-01T23:30:45.86+00:00,gabbywpa85,Gabrielle Weiss (PA),1268364888670208133,assets\9aba90e71ef985acd9142b3316cfaab0-2D0BF.png,Wow! What kind of Mod are you?
1279946981371940876,Default,,2024-09-01T23:32:20.624+00:00,kimmai,Kimmai • Mod,381286854059884545,assets\2b7bae57ddbd0d84b7da8969f39cb4e7-1F88B.png,I’m one of the regular mods that are just a step below the Community Mod rank
1279957270712680561,Default,,2024-09-02T00:13:13.794+00:00,gabbywpa85,Gabrielle Weiss (PA),1268364888670208133,assets\9aba90e71ef985acd9142b3316cfaab0-2D0BF.png,How do you do that?
1279980547556249692,Default,,2024-09-02T01:45:43.426+00:00,kimmai,Kimmai • Mod,381286854059884545,assets\2b7bae57ddbd0d84b7da8969f39cb4e7-1F88B.png,"One of the mods basically asked me if I was interested in becoming one, and the rest is history. I think they’re still looking to onboard more mods, you can ask one of the Community Mods"
1279981544483852309,Reply,1279980547556249692,2024-09-02T01:49:41.112+00:00,gabbywpa85,Gabrielle Weiss (PA),1268364888670208133,assets\9aba90e71ef985acd9142b3316cfaab0-2D0BF.png,Yep got a DM from someone asking me about it. I’ll talk with her tomorrow
1279981603350646855,Default,,2024-09-02T01:49:55.147+00:00,kimmai,Kimmai • Mod,381286854059884545,assets\2b7bae57ddbd0d84b7da8969f39cb4e7-1F88B.png,Sweet!
1280265263329050797,Default,,2024-09-02T20:37:04.956+00:00,martarichenburg_59797,Marta Richenburg,1260983976483356767,assets\a57efb34b9ef35ed7f644aca5ab803aa-F2CBD.png,<@&1245910841832902766> IMPORTANT: There is new PA specific content in your Reach Gallery! Make sure to check it out for content like this!
1280274329971589143,Default,,2024-09-02T21:13:06.612+00:00,kinggabe2024,Gabe,1280245066916696076,assets\4-4551A.png,We'll see 👀
1280274631193792603,Default,,2024-09-02T21:14:18.429+00:00,kinggabe2024,Gabe,1280245066916696076,assets\4-4551A.png,We're working tirelessly behind scene.
1280274686151884821,Default,,2024-09-02T21:14:31.532+00:00,sebostock.writer,Sarah Bostock,1120444413055873074,assets\10e174472da740fa414252eadd4b46fb-1C9F5.png,I’m with the PA Dems and there is a lot of momentum in some areas
1280274929425715242,Default,,2024-09-02T21:15:29.533+00:00,kinggabe2024,Gabe,1280245066916696076,assets\4-4551A.png,We're going to keep the momentum going
1280280716705398795,Reply,1279872675250049137,2024-09-02T21:38:29.328+00:00,fltadmlwolf,Jordan K.,201533180434448385,assets\29da332e3f8721844d4eab7d9c8b42fa-62E9F.png,"Hey Joy. I planned voter registration drives for the next two weeks in Pittsburgh. I got all the info I needed from the Field Team 6 website, which had a “voter registration in a box” program that walks you through every step."
1280296527612608513,Reply,1280280716705398795,2024-09-02T22:41:18.942+00:00,joy0517,Joy,1270181057966116996,assets\34941b26d3e818f841bee19d4dc268bf-81089.png,"Thanks so much, Jordan!!"
1280327882320908340,Default,,2024-09-03T00:45:54.487+00:00,lola_42356_47491,Lola,1280318571926261770,assets\2-ADBB4.png,"Hi <#1268378088069267456> , excited to land here, after my ""how to get involved in the campaign"" training! I live out of state but am considering spending some time with family in Philly so I can canvass for the campaign. It looks like there is an office on Chelton Ave (in Germantown) that would be accessible for me to get to. Does anyone know if there is a phone number for the office that I can call or If I will be able to walk in to find a buddy and start canvassing in the area? (My main concern is I do not have a car when I am visitting but the Chelton Ave location looks accessible.) Any advice / Suggestions?"
1280328345028001864,Default,,2024-09-03T00:47:44.805+00:00,carb.on,Carolyn • Lead Mod,568257600228032512,assets\28a90c77b5793d80eb62484a43c66748-D8837.png,Hi <@1280318571926261770> this event might be a good option for you. https://events.democrats.org/event/672151/
1280328682778398760,Default,,2024-09-03T00:49:05.331+00:00,lola_42356_47491,Lola,1280318571926261770,assets\2-ADBB4.png,<@568257600228032512> thank you for the information! I was just wondering if there is a phone number for the Germantown office that I can call from out of state first or should I just show up at the office and start from there?
1280329599611306034,Default,,2024-09-03T00:52:43.921+00:00,lola_42356_47491,Lola,1280318571926261770,assets\2-ADBB4.png,"<@568257600228032512> to give a bit more background, I haven't booked my flight yet and am not sure exactly when I will go so I thought getting a bit of information first could help me make the right plan"
1280329699381481513,Reply,1280328682778398760,2024-09-03T00:53:07.708+00:00,carb.on,Carolyn • Lead Mod,568257600228032512,assets\28a90c77b5793d80eb62484a43c66748-D8837.png,"They have events during 9a-6p every Sat/Sun. They don't list a phone number. I suggest showing up in and saying ""hello"""
1280329754980909129,Reply,1280328682778398760,2024-09-03T00:53:20.964+00:00,mariebroph2677695,Marie B. | PA/NJ | OE/KC,941196169852366859,assets\4412fd436c9a7d43a1770d5771bbdd0c-8CC79.png,"Lola as a former field volunteer I think I can answer that: If you sign up for that canvassing, you'll get a call from the field organizer in charge who will tell you where to go and what you'll be doing."
1280329800967393301,Default,,2024-09-03T00:53:31.928+00:00,lola_42356_47491,Lola,1280318571926261770,assets\2-ADBB4.png,ok makes sense. thank you!
1280329921553764444,Default,,2024-09-03T00:54:00.678+00:00,lola_42356_47491,Lola,1280318571926261770,assets\2-ADBB4.png,ahhh that is helpful. thanks for the inforation. have a great rest of your day! 8)
1280330286667796610,Reply,1280329800967393301,2024-09-03T00:55:27.728+00:00,mariebroph2677695,Marie B. | PA/NJ | OE/KC,941196169852366859,assets\4412fd436c9a7d43a1770d5771bbdd0c-8CC79.png,"I used to also have to run staging locations in 2022 and I always emailed the volunteers who signed up and gave them my number saying if they had questions, to call or text me. I will tell you that Field Organizers do make it very easy for you to contact them once you sign up for a shift. I still keep in touch with a couple of former ones from '22, to be honest."
1280330447947304962,Default,,2024-09-03T00:56:06.18+00:00,lola_42356_47491,Lola,1280318571926261770,assets\2-ADBB4.png,<@941196169852366859> Got it. Thank you for clarifying! Appreciate it!
1280331212732371026,Reply,1280330447947304962,2024-09-03T00:59:08.519+00:00,mariebroph2677695,Marie B. | PA/NJ | OE/KC,941196169852366859,assets\4412fd436c9a7d43a1770d5771bbdd0c-8CC79.png,No problem. I was a field volunteer from 2016-2022 and I would have been this time around if it weren't for the fact that I messed up my knee so bad that the only surgical option is joint replacement and the doctor said I'm not a good canidate on account of age...I'm too young. It's a good way to get in the door for future work though.
1280333322723262545,Default,,2024-09-03T01:07:31.58+00:00,lola_42356_47491,Lola,1280318571926261770,assets\2-ADBB4.png,<@941196169852366859> sorry you hurt your leg. thank you again for the info and for your work!
1280334315426676756,Reply,1279819136842731610,2024-09-03T01:11:28.259+00:00,lola_42356_47491,Lola,1280318571926261770,assets\2-ADBB4.png,"<@746403830073262152> I truly love your point about listening and asking questions. it is so fascinating to learn from people with different worldviews and find the common ground. I read a book called ""Never Split the Difference"" by Chris Voss, a former hostage negotiator and he talks all about ""tactical empathy"", listening, mirroring, summarizing what the other person is telling you and clarifying that you got their point right"" instead of knee jerk reacting which I hopefully have learned to do less of ! 8)"
1280372112397176882,Default,,2024-09-03T03:41:39.759+00:00,jean9_28218_79932,Jeannine • Lead Mod,1266879741785538682,assets\54ff5e8dfab835d878a961f9f7b7d161-6C0EE.png,"<a:star_wave:1269735420359606369> Hey, Team! We know you want to help make a difference! Did you know though that hosting a debate watch party is an amazing way to get involved and bring people together? <a:rainbow_heart_scribble:1269029739432120465> It’s all about good vibes, great conversations, and getting folks fired up for the election. Your watch party could be the spark that motivates someone to vote! <a:PinkFlames:1252802562659193004>  [Register your watch party](https://events.democrats.org/c/host-a-debate-watch-party/event/create/) to get access to all sorts of resources for throwing a successful debate watch party, including a [Host Information Session](https://events.democrats.org/event/677337/). <a:ThanksRainbow:1278765693579431967>"
1280494161614868490,Default,,2024-09-03T11:46:38.56+00:00,whispersoftly31,Svetlana,1277412404589760583,assets\a92138226389db60e2b25cbfb1f61ee5-F1659.png,"I can’t believe Kamala was in Pittsburgh yesterday!!!! I got to watch it Live streamed and it was amazing to hear her speech! I just wish I got to be there in person! Stay focused y’all! Let’s keep going to get as many people as we can to Vote Blue! Everything we do can affect this election! We’re one of the swing states and might even be the one that decides the election this time around, so let’s keep going with the phone banks and talking to people in person to register to vote!!! 💙💙💙🗽🗽🗽🌊🌊🌊"
1280812147818889247,Default,,2024-09-04T08:50:12.379+00:00,trumansleeps,Michael Pelaez | FL,389839010576465936,assets\3a91c3446fca9803ffb1d856364145a2-A8603.png,https://www.mobilize.us/voteriders/event/564817/?referring_vol=6684605&rname=Michael&share_context=event_details&share_medium=copy_link
1280872840157204511,Default,,2024-09-04T12:51:22.56+00:00,kimmai,Kimmai • Mod,381286854059884545,assets\2b7bae57ddbd0d84b7da8969f39cb4e7-1F88B.png,Found a link to RSVP for Walz’s rally tomorrow in Erie. https://www.mobilize.us/2024pavictory/event/681732/
1280873336540237824,Default,,2024-09-04T12:53:20.907+00:00,fltadmlwolf,Jordan K.,201533180434448385,assets\29da332e3f8721844d4eab7d9c8b42fa-62E9F.png,Does anyone know anything about doing voter registration events at local high schools? I'm doing two more general voter registration events in the next two weeks and would love to help get some events set up at schools.
1280905817679462475,Default,,2024-09-04T15:02:25.014+00:00,jesseliberty,Jesse Liberty,816713323272732704,assets\1d34e7e7c56007731c7c3c62e8224fb4-275E0.png,"Hi... Not sure who to ask: can I get the phone number of the HQ in Stroudsburg? I'm driving there (from MA -- a six hour drive) on Friday the 13th and staying until lunch time on Sunday, to knock on doors. I don't remember who I spoke with but they assured me there would be some training and someone to go out with on Friday afternoon. I'm signed up for two shifts on Saturday already, but would also like to go out Sunday morning if possible. Thanks!"
1280906761569570937,Reply,1280905817679462475,2024-09-04T15:06:10.055+00:00,kimmai,Kimmai • Mod,381286854059884545,assets\2b7bae57ddbd0d84b7da8969f39cb4e7-1F88B.png,"Hi Jesse, this is what came up for me when I Googled. I would try calling this number and see if they could help there."
1280921044525383853,Default,,2024-09-04T16:02:55.377+00:00,rmoore2488_78950,Rmoore2488,1275254363291517042,assets\8569adcbd36c70a7578c017bf5604ea5-A3BC1.png,Anyone know how someone in Philly can attend the debate?!
1280926267058950175,Reply,1280327882320908340,2024-09-04T16:23:40.526+00:00,deveautrain8014,deveautrain,692908285602562110,assets\e2c6942a0cbfd2c11f3b9a7b889ca5ce-DE3C4.png,"Hi Lola, here are a number of events in Germantown. It is best to register through Mobilize. Once you are looped into a field office and attend an event, it is easy to sign up for future events. https://www.mobilize.us/padems/?q=Germantown"
1280926711764226090,Reply,1280905817679462475,2024-09-04T16:25:26.552+00:00,deveautrain8014,deveautrain,692908285602562110,assets\e2c6942a0cbfd2c11f3b9a7b889ca5ce-DE3C4.png,Jesse - this is the site on Mobilize for the canvassing for Stroudsburg. I would recommend signing up and when you get there they will train you. https://www.mobilize.us/padems/event/645465/
1280933260808945675,Reply,1280926711764226090,2024-09-04T16:51:27.966+00:00,jesseliberty,Jesse Liberty,816713323272732704,assets\1d34e7e7c56007731c7c3c62e8224fb4-275E0.png,Thanks!
1280945172712001673,ThreadCreated,,2024-09-04T17:38:47.985+00:00,rootsmusic,rootsmusic,791857656897732648,assets\a30e650576a6d42a3c9ee24648f67c90-2AE37.png,Started a thread.
1281044541025026111,Default,,2024-09-05T00:13:39.237+00:00,newyorkerforharris2024,Kel,1278144299678171250,assets\4-4551A.png,I see a Friendbanking event on the PA list of events. Does anyone know what Friendbanking is? I've never heard of this.
1281064352224382999,Reply,1281044541025026111,2024-09-05T01:32:22.595+00:00,fltadmlwolf,Jordan K.,201533180434448385,assets\29da332e3f8721844d4eab7d9c8b42fa-62E9F.png,"Reaching out to friends & family to ask them if they’re registered to vote, voting blue, etc"
1281091553191923753,Reply,1280896649241170011,2024-09-05T03:20:27.811+00:00,DemCord,DemCord,1242806362195365968,assets\007b625c296385e4ed52038a42c7256d-7649B.png,"**Strict Fundraising Rules (it’s the law):**
We can only fundraise on behalf of: Democratic National Committee, Harris Victory Fund or Harris for President directly. 
We can recruit for ""non-official events"" that are hosted by partner organizations or volunteers in ⁠non-official-events-only. We can recruit into anything that is listed on events.democrats.org or a state democratic party's mobilize.
Rule 3 Note > Relevance: Do not post links to petitions or other calls to action that haven’t been approved by Staff. This forum is not intended for debates. Additionally, do not attempt to raise funds or share fundraising links for any entity besides the Democratic National Committee. Using this server to raise funds for yourself, another candidate, or another organization violates campaign finance law and is strictly prohibited. Anyone who violates the rules is subject to removal or time out.
When in doubt, ask @Community Moderator."
1281091933841920074,Reply,1280896649241170011,2024-09-05T03:21:58.565+00:00,starkittynmom,Jennifer • [Lead Mod],1276944250491113656,assets\a_2aba4b7f19fcab5fe5391fcdb73d735d-D670A.gif,<@791857656897732648> any link to an organizing site that has a donate link not directly connected to the Harris/ Walz campaign cannot be posted in this server. It's campaign finance law. Just letting you know since you are such an active participant in this server and a resource provider for so many.
1281105683252514859,Default,,2024-09-05T04:16:36.68+00:00,agutmann3110,Anna Gutmann (OH),1275940050772951051,assets\6c5996770c985bcd6e5b68131ff2ba04-4DF7B.png,Hey everyone! Tim Walz’s rally tomorrow might be available to RSVP on mobilize. Not sure if you need the direct link shared with you to access; I got my invite via text. Hope this gets to someone who wants to attend! ☺️ have a good night
1281246043433996399,Default,,2024-09-05T13:34:21.155+00:00,tk181818,Teagan (PA) 💙,1277403729519185995,assets\6c5996770c985bcd6e5b68131ff2ba04-171BA.png,"Hi! Anyone know about a debate party in Philly that’s open to the public? Most of what I’m seeing on the Mobilize site  is “and friends” parties which seem to be for specific people to watch in someone’s home. I’m hoping to find a party in a restaurant, bar, etc"
1281250327223472203,Reply,1281246043433996399,2024-09-05T13:51:22.49+00:00,kimmai,Kimmai • Mod,381286854059884545,assets\2b7bae57ddbd0d84b7da8969f39cb4e7-1F88B.png,"Hi Teagan, if you go to Mobilize.us and search “Watch party” with the location set to Philly, you can see some options for a public watch party. Here is one that I found. https://www.mobilize.us/mobilize/event/676486/"
1281257767239155849,Default,,2024-09-05T14:20:56.328+00:00,tk181818,Teagan (PA) 💙,1277403729519185995,assets\6c5996770c985bcd6e5b68131ff2ba04-171BA.png,Thanks! Not sure why some of these weren’t showing up before
1281262350984544299,Reply,1280905817679462475,2024-09-05T14:39:09.178+00:00,skadreamer,skadreamer,1020820313484836925,assets\37131cf27eb7de1ad74a5fe061aa5bc2-BBC63.png,I'm working with Monroe County too. I've got the phone number of the main guy there
1281280704747016243,Reply,1280812147818889247,2024-09-05T15:52:05.056+00:00,vegandoris,Doris Lin,681770394881228801,assets\9df0b742ca9aab10e84f3bbd15986ea3-108E3.png,"Thanks! It says “VoteRiders has staff on the ground including Houston (TX), Columbus (GA), Pittsburgh (PA), Orlando (FL) and Charlotte (NC), Madison (WI), Milwaukee (WI) and Atlanta (GA).”

Does that mean we have to volunteer in person in one of those cities? I would love to volunteer in Pennsylvania, but Pittsburgh is too far west for me."
1281280962365231135,Reply,1281280704747016243,2024-09-05T15:53:06.477+00:00,trumansleeps,Michael Pelaez | FL,389839010576465936,assets\3a91c3446fca9803ffb1d856364145a2-A8603.png,No need to volunteer in person; there are many more in need online 🙂
1281281369137483817,Reply,1281280962365231135,2024-09-05T15:54:43.459+00:00,vegandoris,Doris Lin,681770394881228801,assets\9df0b742ca9aab10e84f3bbd15986ea3-108E3.png,Thanks - I can’t do Sept 10 but definitely want to help with this!
1281283979802050672,Default,,2024-09-05T16:05:05.89+00:00,trumansleeps,Michael Pelaez | FL,389839010576465936,assets\3a91c3446fca9803ffb1d856364145a2-A8603.png,Voteriders.org/orientation  they update the link when another session is offered in the future 🙂
1281342262055403593,Default,,2024-09-05T19:56:41.462+00:00,lisaneuhauser_98639,Lisa Neuhauser,1281332266278326365,assets\5-E9BDB.png,"Hello, are any events planned in the Harrisburg/Hershey/Lancaster area"
1281357957266800713,Reply,1281342262055403593,2024-09-05T20:59:03.492+00:00,kimmai,Kimmai • Mod,381286854059884545,assets\2b7bae57ddbd0d84b7da8969f39cb4e7-1F88B.png,"Hi Lisa, you can go on mobilize.us to check if there are any in-person events happening in your area."
1281358072035676312,Default,,2024-09-05T20:59:30.855+00:00,lisaneuhauser_98639,Lisa Neuhauser,1281332266278326365,assets\5-E9BDB.png,yes
1281358157838553128,Default,,2024-09-05T20:59:51.312+00:00,lisaneuhauser_98639,Lisa Neuhauser,1281332266278326365,assets\5-E9BDB.png,I have not been able to find folks in my immediate area but will try again
1281379084345151489,Default,,2024-09-05T22:23:00.58+00:00,arlenesab,Arlene,1273832931684782158,assets\69fca1b443a76e82d572127d9daf92f3-E1AD1.png,"Hi I was wondering if there anything I can help with in Greene county, pa"
1281380469128040470,Reply,1281379084345151489,2024-09-05T22:28:30.738+00:00,kimmai,Kimmai • Mod,381286854059884545,assets\2b7bae57ddbd0d84b7da8969f39cb4e7-1F88B.png,"Hi Arlene! If you go to mobilize.us and set your location to Greene County PA, you can view a list of in-person volunteering events happening in or near your area."
1281419426222047252,Default,,2024-09-06T01:03:18.833+00:00,rootsmusic,rootsmusic,791857656897732648,assets\a30e650576a6d42a3c9ee24648f67c90-2AE37.png,Join the state's [Slack workspace](https://docs.google.com/forms/d/e/1FAIpQLSeusJoZgoWNVLdxOYNwy0APDTSDbBePDpMgQeTDMqv0aIghAQ/viewform)
1281441437036318720,ChannelPinnedMessage,1281419426222047252,2024-09-06T02:30:46.62+00:00,starkittynmom,Jennifer • [Lead Mod],1276944250491113656,assets\a_2aba4b7f19fcab5fe5391fcdb73d735d-D670A.gif,Pinned a message.
1281451506360651852,Default,,2024-09-06T03:10:47.334+00:00,matt_1989_,Matt Sally,1275554237870247947,assets\2-ADBB4.png,Did door knocking last weekend in Newtown - very interesting and great opportunity to engage with folks. Wish I could do it more often but given I’m from NY I’ll do phone banking instead. Although I do wish we work on registering more people - are there any ways we can help register voters via phone etc
