id,type,ref_to,timestamp,author_name,author_nickname,author_id,author_avatar_url,content
1267841039738212514,21,1267495473942368277,2024-07-30T13:47:39.221+00:00,ch.bosse,Christian Bosse,1256039311367999658,assets\e940fcd0527f7edd98cdee8d31c08cc0-9A6CA.png,
1267841040782594050,Default,,2024-07-30T13:47:39.47+00:00,ch.bosse,Christian Bosse,1256039311367999658,assets\e940fcd0527f7edd98cdee8d31c08cc0-9A6CA.png,"Thanks for highlighting this. This is a tricky one:
We are referring to TrumpsProject2025.com vs. his team using TrumpProject2025.com. See the s before ""Project""."
1267856021502693387,Default,,2024-07-30T14:47:11.152+00:00,ch.bosse,Christian Bosse,1256039311367999658,assets\e940fcd0527f7edd98cdee8d31c08cc0-9A6CA.png,"Laura, I just got feedback from our campaign staffers. They are aware and tracking the page. Ready for the next move there 💪"
1268622294272573510,Default,,2024-08-01T17:32:04.817+00:00,lauratx62,Laura,1266874978834321418,assets\6c5996770c985bcd6e5b68131ff2ba04-F86D1.png,Thank you!
