id,type,ref_to,timestamp,author_name,author_nickname,author_id,author_avatar_url,content
1280163164842889248,Default,,2024-09-02T13:51:22.78+00:00,reachkaty,Katy (WI),1269438067861753876,assets\d059a773f140fe94a846e6a2e387c239-1DF7D.png,"Hey <#1268379288181145642> !

I'm out at a coffee shop, wearing my Kamala Harris 2024 t-shirt, doing some online campaigning!  

What's everyone else in WI doing today?"
1280265355704402005,Default,,2024-09-02T20:37:26.98+00:00,martarichenburg_59797,Marta Richenburg,1260983976483356767,assets\a57efb34b9ef35ed7f644aca5ab803aa-F2CBD.png,<@&1245911026025889853> IMPORTANT: There is new WI specific content in your Reach Gallery! Make sure to check it out for content like this!
1280373019251965982,Default,,2024-09-03T03:45:15.97+00:00,jean9_28218_79932,Jeannine M • Lead Mod,1266879741785538682,assets\54ff5e8dfab835d878a961f9f7b7d161-6C0EE.png,"<a:star_wave:1269735420359606369> Hey, Team! We know you want to help make a difference! Did you know though that hosting a debate watch party is an amazing way to get involved and bring people together? <a:rainbow_heart_scribble:1269029739432120465> It’s all about good vibes, great conversations, and getting folks fired up for the election. Your watch party could be the spark that motivates someone to vote! <a:PinkFlames:1252802562659193004>  [Register your watch party](https://events.democrats.org/c/host-a-debate-watch-party/event/create/) to get access to all sorts of resources for throwing a successful debate watch party, including a [Host Information Session](https://events.democrats.org/event/677337/). <a:ThanksRainbow:1278765693579431967>"
1280573014475280385,Default,,2024-09-03T16:59:58.547+00:00,givemecoffeewineorcheese,Tammy F. (CO),890727112724607027,assets\b96e59aee6730c4266753ecdb386e6cd-B3645.png,"If anyone here who is on Twitter wants to help out Tammy Baldwin, she has a tough race and I have a retweet team you can join. We could use the extra help. Reply to me and I can add you! It takes only 2 minutes a day"
1280598504741273752,Reply,1280573014475280385,2024-09-03T18:41:15.9+00:00,gabrhamlincoln,honkithy,324946981552390144,assets\cc669a42fefd1b1af70edee0ff6c170f-C9C3D.png,yes please!!
1280600154399051857,Reply,1280573014475280385,2024-09-03T18:47:49.209+00:00,rootsmusic,rootsmusic,791857656897732648,assets\a30e650576a6d42a3c9ee24648f67c90-2AE37.png,The state's Reach campaign invites users to [upload content](https://app.reach.vote/home/act/9fc8eade-a9fb-415e-bb0d-ff619e9de0a5?campaign=wisconsin).
1280612482255421472,Default,,2024-09-03T19:36:48.399+00:00,givemecoffeewineorcheese,Tammy F. (CO),890727112724607027,assets\b96e59aee6730c4266753ecdb386e6cd-B3645.png,<@324946981552390144> hi. Follow me @ not_backingdown. What is your twitter name?
1280638829002493953,Reply,1280612482255421472,2024-09-03T21:21:29.953+00:00,gabrhamlincoln,honkithy,324946981552390144,assets\cc669a42fefd1b1af70edee0ff6c170f-C9C3D.png,just followed you! im gabe
1280814369458098270,Default,,2024-09-04T08:59:02.059+00:00,trumansleeps,Michael Pelaez | FL,389839010576465936,assets\3a91c3446fca9803ffb1d856364145a2-A8603.png,https://www.mobilize.us/voteriders/event/564817/?referring_vol=6684605&rname=Michael&share_context=event_details&share_medium=copy_link
1280933871931752573,Default,,2024-09-04T16:53:53.669+00:00,priven.,Rich Holcombe (WI),740977201436164177,assets\63e48c9523aa87666c7f4d2b6d23a691-271FE.png,https://www.mobilize.us/dpw/event/618552/?referring_vol=5037270&rname=Rich&share_context=event_details&share_medium=copy_link
1280934335633035324,Default,,2024-09-04T16:55:44.224+00:00,priven.,Rich Holcombe (WI),740977201436164177,assets\63e48c9523aa87666c7f4d2b6d23a691-271FE.png,https://www.mobilize.us/dpw/event/675012/
1281077049968164975,Default,,2024-09-05T02:22:49.973+00:00,barbdawson,Barb Dawson,1279965779898404884,assets\b7aa528de07e016ea6ae50ed39c5bfdf-3D1E6.png,I will
1281330237489152071,Reply,1281077049968164975,2024-09-05T19:08:54.582+00:00,givemecoffeewineorcheese,Tammy F. (CO),890727112724607027,assets\b96e59aee6730c4266753ecdb386e6cd-B3645.png,"Barb, are you replying to me about the tammy baldwin RT room?"
1282467166595321987,Default,,2024-09-08T22:26:39.604+00:00,cjacobs1010617,cjacobs101,812778714580254741,assets\4-4551A.png,Rock County Wisconsin needs signs. Trump signs everywhere. Long list waiting for Harris signs. PLEASE HELP!
1282641982799220817,Default,,2024-09-09T10:01:19.035+00:00,lapfel2024_81383,apfel4harris (NY/abroad),1274293080794595339,assets\1303b6be213537796f03663d46f2634d-369E3.png,Hi all—new issues page now appears on the campaign website: https://kamalaharris.com/issues/
1283095616062357607,Default,,2024-09-10T16:03:53.633+00:00,reachkaty,Katy (WI),1269438067861753876,assets\d059a773f140fe94a846e6a2e387c239-1DF7D.png,"At the moment, I'm unemployed, so I've been pondering an idea.  

I want to take a tour around Wisconsin, doing campaign stuff.  

Putting post-its everywhere, handing out my ""Who should I vote for?"" worksheets, setting up a ""Ask me why I'm voting Harris-Walz"" table at different places.  

Do you think this is a good idea or dangerous?"
1283211762757402645,Default,,2024-09-10T23:45:25.163+00:00,mopasternak,Mo Pasternak,1282457094578245697,assets\f7f2e9361e8a54ce6e72580ac7b967af-BA741.png,Hello! Is there an organizer dedicated to out of state volunteers? My cousin in Chicago and her friends are looking to make a difference canvassing!
1283414549323579535,Reply,1283095616062357607,2024-09-11T13:11:13.248+00:00,koko4857,Kelly Hewitt (WI),162720466467815424,assets\17a8aff93ff9a4a03f0ab690834ea4a7-D9DFF.png,Potentially dangerous—I would bring a friend.
1283415387916210187,Reply,1283414549323579535,2024-09-11T13:14:33.184+00:00,reachkaty,Katy (WI),1269438067861753876,assets\d059a773f140fe94a846e6a2e387c239-1DF7D.png,I wish I had someone to bring that has free time.
1283416417177178204,Default,,2024-09-11T13:18:38.579+00:00,koko4857,Kelly Hewitt (WI),162720466467815424,assets\17a8aff93ff9a4a03f0ab690834ea4a7-D9DFF.png,Maybe contact local dems offices to see if they could spare someone?
1283777885374648350,Reply,1283415387916210187,2024-09-12T13:14:59.313+00:00,mikemorganillinois,Mike Morgan Illinois,1283210652739043424,assets\f7f2e9361e8a54ce6e72580ac7b967af-D8157.png,There's a group called Seed The Vote that wanted me to go to WI.
1283779624651849789,Reply,1283777885374648350,2024-09-12T13:21:53.989+00:00,reachkaty,Katy (WI),1269438067861753876,assets\d059a773f140fe94a846e6a2e387c239-1DF7D.png,I'll look into them. Thanks
1283854599760908393,Default,,2024-09-12T18:19:49.448+00:00,trumansleeps,Michael Pelaez | FL,389839010576465936,assets\3a91c3446fca9803ffb1d856364145a2-A8603.png,Let's get a volunteer wave going! Repond on a thread with how many events you signed up to! https://events.democrats.org/?country=US&state=WI
1283986463331061771,Reply,1280163164842889248,2024-09-13T03:03:48.173+00:00,sanddie777,Sandy,1276944501398700102,assets\03f987acb297ea83247ba76187b3e20c-E0FA8.png,"I’m trying to ignore what I just realized of being here in a community that is called Discord, which means, “disagreement between people” or “lack of agreement or harmony : conflict. discord between political parties”

My question, why would a platform (APP) be named something that completely contradicts Kamala’s message?  A bit concerning.  Don’t like what the name represents.  Not the best choice!"
1283986786132951167,Default,,2024-09-13T03:05:05.135+00:00,reachkaty,Katy (WI),1269438067861753876,assets\d059a773f140fe94a846e6a2e387c239-1DF7D.png,This isn't an app created by the campaign.  Tons of people use it for collaboration and discussion on a million topics.
1283986923194421340,Default,,2024-09-13T03:05:37.813+00:00,reachkaty,Katy (WI),1269438067861753876,assets\d059a773f140fe94a846e6a2e387c239-1DF7D.png,My niece is in a Discord group about books
1283987222059683904,Reply,1283986786132951167,2024-09-13T03:06:49.068+00:00,sanddie777,Sandy,1276944501398700102,assets\03f987acb297ea83247ba76187b3e20c-E0FA8.png,"But it’s been promoted to those wanting to get involved during the digital training sessions, so I assumed it was an official campaign resource.  Thanks for clarifying.

The name contradicts community and getting along with people.  Don’t like it."
1283987475978784778,Default,,2024-09-13T03:07:49.607+00:00,reachkaty,Katy (WI),1269438067861753876,assets\d059a773f140fe94a846e6a2e387c239-1DF7D.png,"It's being used by the campaign, yes.  But it's been around for a long time now.  No worries.  I'm sure others have wondered the same thing."
1283987674910167070,Default,,2024-09-13T03:08:37.036+00:00,reachkaty,Katy (WI),1269438067861753876,assets\d059a773f140fe94a846e6a2e387c239-1DF7D.png,"I'm not a fan of the app name either, but it's not something the Harris campaign has any control over. 😊"
1283987997494083605,Default,,2024-09-13T03:09:53.946+00:00,reachkaty,Katy (WI),1269438067861753876,assets\d059a773f140fe94a846e6a2e387c239-1DF7D.png,https://en.m.wikipedia.org/wiki/Discord
1284307913829122151,Default,,2024-09-14T00:21:07.944+00:00,koko4857,Kelly Hewitt (WI),162720466467815424,assets\17a8aff93ff9a4a03f0ab690834ea4a7-D9DFF.png,<@1276944501398700102>
1284308011896016917,Default,,2024-09-14T00:21:31.325+00:00,koko4857,Kelly Hewitt (WI),162720466467815424,assets\17a8aff93ff9a4a03f0ab690834ea4a7-D9DFF.png,
1284308222592815135,Default,,2024-09-14T00:22:21.559+00:00,koko4857,Kelly Hewitt (WI),162720466467815424,assets\17a8aff93ff9a4a03f0ab690834ea4a7-D9DFF.png,I just requested my absentee ballot
1284308256168214590,Default,,2024-09-14T00:22:29.564+00:00,koko4857,Kelly Hewitt (WI),162720466467815424,assets\17a8aff93ff9a4a03f0ab690834ea4a7-D9DFF.png,It was so easy!
1284308260899262538,Default,,2024-09-14T00:22:30.692+00:00,koko4857,Kelly Hewitt (WI),162720466467815424,assets\17a8aff93ff9a4a03f0ab690834ea4a7-D9DFF.png,https://myvote.wi.gov/en-us/Vote-Absentee-By-Mail
1284519834696028230,Default,,2024-09-14T14:23:13.816+00:00,lapfel2024_81383,apfel4harris (NY/abroad),1274293080794595339,assets\1303b6be213537796f03663d46f2634d-369E3.png,"""Supporters in Wisconsin have knocked on more than 500,000 doors and that since last week’s debate with Trump, the campaign has signed up more than 3,000 new volunteers."" 💪 https://apnews.com/article/harris-wisconsin-battleground-trump-walz-8effbe881a537be789a08005a8cea573"
1284530734253740146,Default,,2024-09-14T15:06:32.473+00:00,lapfel2024_81383,apfel4harris (NY/abroad),1274293080794595339,assets\1303b6be213537796f03663d46f2634d-369E3.png,"... and <:WalzSmile:1270424129853456445>  Tim Walz rally later today coming at us live from Superior 4:30PM EST 🎉 . C-SPAN (via their website, which I can't link to due to campaign finance law) seems teed up to broadcast it—check their YouTube channel later on to find a livestream https://www.youtube.com/@CSPAN"
1284557671000834253,Default,,2024-09-14T16:53:34.694+00:00,givemecoffeewineorcheese,Tammy F. (CO),890727112724607027,assets\b96e59aee6730c4266753ecdb386e6cd-B3645.png,does anyone want to join my Wiscconsin Tammy Baldwin retweet team on Twitter?
1284723869634134107,Reply,1284519834696028230,2024-09-15T03:53:59.536+00:00,anniekate76,Andrea C [WI] • Mod,359726068954955776,assets\e3f51d2362ade0d88a04720e3dc4402c-8F686.png,"Was at one of the canvasses this morning, with Tammy and Senator Murray too. Way more volunteers than the previous canvasses I’ve attended!

https://madison.com/tammy-baldwin-patty-murray-host-north-side-canvassing-event/video_fd5637ea-8a1e-5493-96df-a41cd6865fd4.html"
1285056358013599767,Default,,2024-09-16T01:55:10.943+00:00,steveh721_22113,steveh721,1284385091832909868,assets\f58ddd5a2ca6dd172d64be24d7021cfa-A9400.png,"I'm Steve Heitmann@WA, manager of the Stop Project 2025 voter outreach program. Resources: https://www.stop-project-2025.info/ Subscribe for free (subscribing automatically sends new posts to your email), We want to assist battleground states to elect Harris-Walz and Democrats, up and down ballot.

Please go to top menu/dashboard and click on Inform Voters to learm how the site can be used to inform voters. Also, please click on Democracy Activists--check out Card Campaign (and others). 

This has been sent to 406 chairs of county Democrats in 7 battleground states (WI, AZ, MI, PA, NV, NC, GA). The site has organically spread to 20 states."
1285113836176801833,Reply,1284519834696028230,2024-09-16T05:43:34.805+00:00,starkittynmom,Jen Medeiros [CA] • [Lead Mod],1276944250491113656,assets\a_2aba4b7f19fcab5fe5391fcdb73d735d-D670A.gif,"😂  thank you for being conscientious about the fundraising and links. I know it's another layer of effort, but it makes it so much easier on the mods. We hate taking down links to these super cool events and asking y'all to edit posts. But we would hate giving the other side any fodder for accusing us of misconduct in this election even more. 
Appreciate you <@1274293080794595339> - keep up the good work 💪"
1285810381876367402,Default,,2024-09-18T03:51:24.241+00:00,starkittynmom,Jen Medeiros [CA] • [Lead Mod],1276944250491113656,assets\a_2aba4b7f19fcab5fe5391fcdb73d735d-D670A.gif,"<:bluewave3:1270555729836900453> <:bluewave3:1270555729836900453> <:bluewave3:1270555729836900453> <:bluewave3:1270555729836900453> <:bluewave3:1270555729836900453> <:bluewave3:1270555729836900453> <:bluewave3:1270555729836900453> <:bluewave3:1270555729836900453> <:bluewave3:1270555729836900453> <:bluewave3:1270555729836900453> <:bluewave3:1270555729836900453> <:bluewave3:1270555729836900453> 
**COOL STUFF ALERT**

Hey everyone : 
The moderators of www.reddit.com/r/VoteDem and r/Bluemidterm2018 (the FORMER moderators of r/Voteblue) made this amazing spreadsheet:

https://docs.google.com/spreadsheets/d/1jxO8g7q9VO3ZMAABcrvR7PMyX4Yl6dgIYhD3eRTKk1M/edit?usp=sharing
This Google Sheet has links to the sign up pages for HUNDREDS of opportunities to engage from home for campaigns across the country. Check it out and sign up! Let's keep going to build this BLUE WAVE!
<:bluewave3:1270555729836900453> <:bluewave3:1270555729836900453> <:bluewave3:1270555729836900453> <:bluewave3:1270555729836900453> <:bluewave3:1270555729836900453> <:bluewave3:1270555729836900453> <:bluewave3:1270555729836900453> <:bluewave3:1270555729836900453> <:bluewave3:1270555729836900453> <:bluewave3:1270555729836900453> <:bluewave3:1270555729836900453> <:bluewave3:1270555729836900453>"
1286039842244792331,Default,,2024-09-18T19:03:11.856+00:00,rebelbot,rebelbot,561040480553533470,assets\f25b78d54fdf332968e897b99a4762f3-23763.png,Might be too late but I couldn’t go this time: https://www.mobilize.us/wisdems/event/697111/?utm_source=reach-fb-9-17&utm_medium=reach-fb-9-17&utm_id=reach-fb-9-17
1286316046789378069,Default,,2024-09-19T13:20:44.151+00:00,lesley_d,Lesley,1279934149725257844,assets\6c5996770c985bcd6e5b68131ff2ba04-CA309.png,"I live close to the Wisconsin border (Illinois) and I would like to volunteer with post card writing, etc. can someone point me in the right direction?"
1286455088897982465,Default,,2024-09-19T22:33:14.373+00:00,nico98109,Nico98109,1273913215411294208,assets\084623bd66114f59aff75b1b8ded6e6e-C8948.png,"If you signed up for the rally tomorrow in madison, have you heard any updates on tickets?  I signed up a few days ago and haven't yet heard any update."
1286525480245264426,Default,,2024-09-20T03:12:56.978+00:00,tirsa_45200,Tirsa,1272027257644384352,assets\0-EB806.png,Hi:
1286525647187087480,Default,,2024-09-20T03:13:36.78+00:00,tirsa_45200,Tirsa,1272027257644384352,assets\0-EB806.png,I rsvp for tomorrows Rally in Madison. It says confirmed in my mobilize app but haven't received any email yet. Please help! 🙂 <:blueheart:1252803082849488956>
1286526569581645904,Reply,1286455088897982465,2024-09-20T03:17:16.696+00:00,tirsa_45200,Tirsa,1272027257644384352,assets\0-EB806.png,The same is happening to me. Im waiting here.
1286569144342544387,Reply,1286526569581645904,2024-09-20T06:06:27.31+00:00,nico98109,Nico98109,1273913215411294208,assets\084623bd66114f59aff75b1b8ded6e6e-C8948.png,Still nothing here. Keep me posted if you hear anything.
1286669727376080928,Default,,2024-09-20T12:46:08.174+00:00,tirsa_45200,Tirsa,1272027257644384352,assets\0-EB806.png,Got an email at 3 am. Check your email
1286695118551777354,Default,,2024-09-20T14:27:01.902+00:00,nico98109,Nico98109,1273913215411294208,assets\084623bd66114f59aff75b1b8ded6e6e-C8948.png,Thanks. I finally got it as well!
1286702394805194891,Default,,2024-09-20T14:55:56.696+00:00,priven.,Rich Holcombe (WI),740977201436164177,assets\63e48c9523aa87666c7f4d2b6d23a691-271FE.png,Absentee ballots arriving today here
1286712444563230721,Default,,2024-09-20T15:35:52.745+00:00,tirsa_45200,Tirsa,1272027257644384352,assets\0-EB806.png,Do you know if they sell t shirts in the rallies?
1286804385631830118,Default,,2024-09-20T21:41:13.204+00:00,givemecoffeewineorcheese,Tammy F. (CO),890727112724607027,assets\b96e59aee6730c4266753ecdb386e6cd-B3645.png,Please RT: https://x.com/Not_BackingDown/status/1837211417113661675
1286963638342647890,Default,,2024-09-21T08:14:02.009+00:00,lapfel2024_81383,apfel4harris (NY/abroad),1274293080794595339,assets\1303b6be213537796f03663d46f2634d-369E3.png,"Wow, listen to that crowd in WI: https://www.tiktok.com/@kamalaharris/video/7416910152458128671"
1287119483252768889,Default,,2024-09-21T18:33:18.331+00:00,rebelbot,rebelbot,561040480553533470,assets\f25b78d54fdf332968e897b99a4762f3-23763.png,"I gave the details to my friend and she went. She mentioned people were turned away at the door. She said the place was packed and she felt hopeful in a way she had not felt “in many years.” 

It sounded similar to the Milwaukee one in August which was incredible. They gave out the same bracelets and signs. I heard that Tammy Baldwin and a local Union leader spoke."
1287552650019082304,Default,,2024-09-22T23:14:33.336+00:00,meanderingstone6495,Autumn S [AR]🤘• Lead Mod/OE Mod,936622618293968958,assets\af45a372ba919e7bac10686b43e799f1-BDEE3.png,We are calling into Wisconsin right now. Do you have 30 -60 minutes to make some calls? [Sign up for the 6pm phone bank here](https://events.democrats.org/event/664004/?utm_source=Discord&utm_medium=Posts&utm_campaign=Daily%20Engagement) and receive the Zoom link.
1287869687618863214,Default,,2024-09-23T20:14:20.99+00:00,starkittynmom,Jen Medeiros [CA] • [Lead Mod],1276944250491113656,assets\a_2aba4b7f19fcab5fe5391fcdb73d735d-D670A.gif,"@here we're calling Wisconsin again today. No one is better equipped to relate to WI voters than y'all. Can you sign join? You don't need any experience, we will train you .We are trying to finalize our calls rosters for our big final push. 

[GET STARTED MAKING CALLS NOW](https://events.democrats.org/event/664004/?utm_source=Discord&utm_medium=Posts&utm_campaign=Daily%20Engagement)

If you're able to jump in, drop a 🔥  emoji so we can keep this energy moving!"
1288151648002379776,Default,,2024-09-24T14:54:45.584+00:00,lapfel2024_81383,apfel4harris (NY/abroad),1274293080794595339,assets\1303b6be213537796f03663d46f2634d-369E3.png,WI voters on TV say nice things about <:kamala1:1269028302203523114>  https://www.threads.net/@kamalahq/post/DATXT-AvYt9
1288557837672255509,Default,,2024-09-25T17:48:48.748+00:00,jrneldam4thepeople,jrneldam,709172710223380630,assets\0d827b663c6f5b5b09ad800a5ce1c6ae-2DF4C.png,"I'm a CA resident that is interested in moving to WI for the final month of the campaign to help organize. I can pay my own way to get to wherever I will be most helpful to the campaign, but I was hoping there might be another volunteer or member of the campaign that has a spare room that I could stay at while I volunteer. Please let me know (in DMs) if anyone can help connect me with the right person!"
1290181351495958584,Default,,2024-09-30T05:20:04.607+00:00,jayrio76,Jay E  (TX)  OE Mod,782870341445353522,assets\41ef520387924aa4413513eda28784df-34D82.png,Voting Info for Nov 2024: The DNC officially recommends I Will Vote dot com for voting info.  https://iwillvote.com/ is available in both Spanish and English.  Plan Your Vote!  - Edited 10/7.
1290181587001938012,ChannelPinnedMessage,1290181351495958584,2024-09-30T05:21:00.756+00:00,jayrio76,Jay E  (TX)  OE Mod,782870341445353522,assets\41ef520387924aa4413513eda28784df-34D82.png,Pinned a message.
1290315261311844363,Default,,2024-09-30T14:12:11.195+00:00,anniekate76,Andrea C [WI] • Mod,359726068954955776,assets\e3f51d2362ade0d88a04720e3dc4402c-8F686.png,Jay https://myvote.wi.gov is my go to site for WI specific voting info - and https://bringit.wi.gov for info on what forms of ID work at the polls.
1290483226065899521,Default,,2024-10-01T01:19:37.113+00:00,priven.,Rich Holcombe (WI),740977201436164177,assets\63e48c9523aa87666c7f4d2b6d23a691-271FE.png,"Had this in a phone bank thread for calls we were making into Wisconsin but if it’s helpful here also


Wisconsin Voter Info:
Early voting in Wisconsin begins October 22nd,
Deadline to request a mail-in absentee ballot is October 31st
Wisconsin has Election Day voter registration; however, online registration ends October 16th
Ballot drop boxes are again legal in Wisconsin, but not all municipalities are using them - check with their municipal clerk"
1290543416698212455,Default,,2024-10-01T05:18:47.678+00:00,markoooose,markoose,344984313500139520,assets\865cf6878c38e19c6e55fddf130da514-EA3D5.png,"Hi everyone! I'm hoping to make a poster for every city and town in Wisconsin. This is my first attempt, with posters for the 637 cities that have fire departments. If you have any feedback / suggestions, let me know 🙂"
1290543499241848854,Default,,2024-10-01T05:19:07.358+00:00,markoooose,markoose,344984313500139520,assets\865cf6878c38e19c6e55fddf130da514-EA3D5.png,
1290544332247400488,Default,,2024-10-01T05:22:25.962+00:00,markoooose,markoose,344984313500139520,assets\865cf6878c38e19c6e55fddf130da514-EA3D5.png,"This is the zip file with all 637 posters. 

https://drive.google.com/file/d/1BCnEAYhPRYTtC9QXlZNZQ04zIozftoKq/view?usp=sharing"
1290544446240329779,Default,,2024-10-01T05:22:53.14+00:00,markoooose,markoose,344984313500139520,assets\865cf6878c38e19c6e55fddf130da514-EA3D5.png,hitting hay now but i'll check in tomorrow
1290774861714554962,Default,,2024-10-01T20:38:28.47+00:00,anniekate76,Andrea C [WI] • Mod,359726068954955776,assets\e3f51d2362ade0d88a04720e3dc4402c-8F686.png,Spread the word on this everyone!
1290868691050692683,Default,,2024-10-02T02:51:19.127+00:00,i_am_anxious02,Jake Henderson (NJ-2) [MOD],648018187342053395,assets\ee6fcc15dae8462931d1ad1c70c5d780-D008C.png,"This election is now in your hands, Wisconsinites and voters of other swing states! VOTE!"
1290879909677498388,Default,,2024-10-02T03:35:53.856+00:00,anniekate76,Andrea C [WI] • Mod,359726068954955776,assets\e3f51d2362ade0d88a04720e3dc4402c-8F686.png,"We’re gonna, obviously!"
1290903778840547338,Default,,2024-10-02T05:10:44.708+00:00,jayrio76,Jay E  (TX)  OE Mod,782870341445353522,assets\41ef520387924aa4413513eda28784df-34D82.png,"Required disclaimer: DNC officially recommends I Will Vote dot com for all voter info.  Had to remove the dot gov links but the text below comes from a volunteer with local knowledge of on the ground process in WI as a poll worker. 

For registration, you can register anytime up to and including election day at the polls. 
If you choose to register online (the easiest method, provided you have the prerequisites to do it): That ends on October 16, but you can always register at the clerks office or at the polls on election day.

Early in person voting in Wisconsin begins Oct 22. Mail-in absentee ballot request deadline is Oct 31. Ballot drop boxes are again legal in Wisconsin, but not all municipalities are using them - check with their municipal clerk."
1290903931505082370,ChannelPinnedMessage,1290903778840547338,2024-10-02T05:11:21.106+00:00,jayrio76,Jay E  (TX)  OE Mod,782870341445353522,assets\41ef520387924aa4413513eda28784df-34D82.png,Pinned a message.
1291164470017658892,Reply,1290543499241848854,2024-10-02T22:26:38.328+00:00,koko4857,Kelly Hewitt (WI),162720466467815424,assets\17a8aff93ff9a4a03f0ab690834ea4a7-D9DFF.png,This is amazing!
1291164815745880185,Reply,1290774861714554962,2024-10-02T22:28:00.756+00:00,koko4857,Kelly Hewitt (WI),162720466467815424,assets\17a8aff93ff9a4a03f0ab690834ea4a7-D9DFF.png,Had an argument this weekend with a MAGA fan. They claimed that there were a bunch of non-citizens purged from some imaginary voter role.
1291165155803009095,Default,,2024-10-02T22:29:21.832+00:00,koko4857,Kelly Hewitt (WI),162720466467815424,assets\17a8aff93ff9a4a03f0ab690834ea4a7-D9DFF.png,"I was a bit too shocked to reply that a) non-citizens aren't allowed to vote anywhere in WI and b) That The Heritage Foundation’s analysis of legal actions regarding election conduct found only 24 instances of noncitizens voting between 2003 and 2023. A study conducted by the Brennan Center for Justice analyzing 23.5 million votes across 42 jurisdictions in the 2016 general election concluded that there were approximately 30 instances of noncitizens casting votes. Illegal voting, including by noncitizens, is routinely investigated and prosecuted by the appropriate authorities, and there is no evidence that noncitizen voting has ever been significant enough to impact an election’s outcome."
1291244029802971247,Reply,1291165155803009095,2024-10-03T03:42:46.859+00:00,anniekate76,Andrea C [WI] • Mod,359726068954955776,assets\e3f51d2362ade0d88a04720e3dc4402c-8F686.png,"Yes, anyone who actually looks into it finds that’s the case but then they continue to use it to fearmonger!"
