id,type,ref_to,timestamp,author_name,author_nickname,author_id,author_avatar_url,content
1297945259338371192,21,1297942089291796623,2024-10-21T15:31:04.483+00:00,roberta_24935,Roberta Bavin CA KC Greeter/Mod,1269872908759597148,assets\df6d19d97b04a49ffcafbe7be14c7839-D9CE4.png,
1297945262920302613,Default,,2024-10-21T15:31:05.337+00:00,roberta_24935,Roberta Bavin CA KC Greeter/Mod,1269872908759597148,assets\df6d19d97b04a49ffcafbe7be14c7839-D9CE4.png,Hi there! Thanks for reaching out. We don't have any further trainings scheduled. Please check ⁠non-official-events-only channel for other activities. We appreciate you being here! <:thankyou:1252806147396735057>
1297945511625621534,Default,,2024-10-21T15:32:04.633+00:00,ariel817,Linda W (TX),161475441654235136,assets\cf8f2cd8acfb25565f31f96b21cae9df-B19FF.png,"No problem, I've been doing social media engagement, community notes, click approvals, and phone banking"
1297987933730770984,Default,,2024-10-21T18:20:38.851+00:00,andrewjnla,Andrew Martin [CA[ KC Text Admin,932025725777743923,assets\8156a8c1e23069b2fac6bd70259a5ade-A321B.png,Hi <@161475441654235136> We just added one final training later today. Please join us if you can! https://events.democrats.org/event/715820/
1297994388911296624,Default,,2024-10-21T18:46:17.886+00:00,ariel817,Linda W (TX),161475441654235136,assets\cf8f2cd8acfb25565f31f96b21cae9df-B19FF.png,"Great!  Thank you, I will!  I have texted in prior elections, just work and life has been too busy to make a training this time around before now."
1298019759757066314,Reply,1297987933730770984,2024-10-21T20:27:06.767+00:00,current_selection,Natalie Adkins [VA],573588174891122806,assets\7b6cea4dde1c9a7c37f9853aa21b90ae-8E20B.png,If I did the text banking training over the weekend with Swifties for Kamala for Voters of Tomorrow already can I sign up to text bank? Or do I need to attend this training as well since it is for Team Harris-Walz?
1298055677075525664,Default,,2024-10-21T22:49:50.123+00:00,ariel817,Linda W (TX),161475441654235136,assets\cf8f2cd8acfb25565f31f96b21cae9df-B19FF.png,"I have taken the quiz and filled out the texting agreement form. SO glad you did one more training, I was sad not able to help before now!"
