id,type,ref_to,timestamp,author_name,author_nickname,author_id,author_avatar_url,content
1290830481964666974,21,1290827442608410734,2024-10-02T00:19:29.371+00:00,genericusername8797,S [MT/NM],465305140786888705,assets\a187dcd150192cbe1a6b1b9cb0ffe55c-6C116.png,
1290830483529400362,Default,,2024-10-02T00:19:29.744+00:00,genericusername8797,S [MT/NM],465305140786888705,assets\a187dcd150192cbe1a6b1b9cb0ffe55c-6C116.png,Anyone else watching this and wanna chat in a thread about it?
1290832915466551398,Default,,2024-10-02T00:29:09.563+00:00,genericusername8797,S [MT/NM],465305140786888705,assets\a187dcd150192cbe1a6b1b9cb0ffe55c-6C116.png,Yes! Tim Walz understands what it's like to live in rural areas and small towns. fr. It's really nice to feel seen and represented for once on the big stage.
1290833380400693278,Default,,2024-10-02T00:31:00.412+00:00,prhiannon,Rhiannon G (OR),603250367911690260,assets\666615341a46fb30c7187d2c2a53b577-00116.png,"That's cool to hear. I live in a rural town now but not for most of my life, so I don't think I fully get it. Not raised in a small town."
1290833940029898772,Default,,2024-10-02T00:33:13.838+00:00,genericusername8797,S [MT/NM],465305140786888705,assets\a187dcd150192cbe1a6b1b9cb0ffe55c-6C116.png,Welcome to rural town life! It's just nice to not feel overlooked. And I'm sure there's lots of folks in many demographics that hopefully are feeling seen with Harris-Walz. I know I am on many levels.
