id,type,ref_to,timestamp,author_name,author_nickname,author_id,author_avatar_url,content
1299539446231732315,Default,,2024-10-26T01:05:48.257+00:00,js067853,Jamie Scribner [CT],1288669079942463619,assets\2-ADBB4.png,He can't get to the polls easily.
1299539645993844766,Default,,2024-10-26T01:06:35.884+00:00,sdgc_76906,Erica Ramos [CA] [Call Mod],1206655433905930251,assets\d89cc8ea1b8dc7f778a48cfb80348315-7B1A6.png,Are you still on the call with him?
1299539929855950858,Default,,2024-10-26T01:07:43.562+00:00,js067853,Jamie Scribner [CT],1288669079942463619,assets\2-ADBB4.png,no but i have his info still up. he was older and wasn't able to write down mail in ballot info
1299540070864519218,Default,,2024-10-26T01:08:17.181+00:00,sdgc_76906,Erica Ramos [CA] [Call Mod],1206655433905930251,assets\d89cc8ea1b8dc7f778a48cfb80348315-7B1A6.png,We can't reach out to anyone directly. The best thing to do is to give them the WI voter hotline number at 608-336-3232
1299540233041219625,Default,,2024-10-26T01:08:55.847+00:00,js067853,Jamie Scribner [CT],1288669079942463619,assets\2-ADBB4.png,Ah ok.  He wasn't able to take down the number. Hope he's able to vote. I told him to make sure his daughter knew to get him a new ballot if needed.
1299540458703294476,Default,,2024-10-26T01:09:49.649+00:00,sdgc_76906,Erica Ramos [CA] [Call Mod],1206655433905930251,assets\d89cc8ea1b8dc7f778a48cfb80348315-7B1A6.png,That's great! They're publicizing the number and hopefully she can find the WI tracker info too. Great suggestion.
