id,type,ref_to,timestamp,author_name,author_nickname,author_id,author_avatar_url,content
1279305273437196379,21,1279303503722057770,2024-08-31T05:02:25.53+00:00,nmorris237,Nicole Morris - Text Admin,935762347753103382,assets\27b1e286b65ae02b3378793b5f098411-A7B20.png,
1279305282694025246,Default,,2024-08-31T05:02:27.737+00:00,nmorris237,Nicole Morris - Text Admin,935762347753103382,assets\27b1e286b65ae02b3378793b5f098411-A7B20.png,"Hi <@1262407313503813764> Thanks! Yes - I sent you a Direct Message here a day ago on Discord. Please let me know if you don’t see it — top left corner, may be hidden under “Message Requests”"
1279587173334777930,Default,,2024-08-31T23:42:35.703+00:00,angelb_00479,Angel Braveboy MD,1262407313503813764,assets\3-FB033.png,I did the training during the week.
1279588008651128835,Default,,2024-08-31T23:45:54.858+00:00,angelb_00479,Angel Braveboy MD,1262407313503813764,assets\3-FB033.png,"Hi Nicole, where is the ""message request"" is located? I see the speech bubble where you DM about setting up profile on Discord."
1279595952394604607,Default,,2024-09-01T00:17:28.794+00:00,nmorris237,Nicole Morris - Text Admin,935762347753103382,assets\27b1e286b65ae02b3378793b5f098411-A7B20.png,Thanks! That was the DM (message request) I was referring to. But looks like you’re all set and added!
