id,type,ref_to,timestamp,author_name,author_nickname,author_id,author_avatar_url,content
1268750413981679707,Default,,2024-08-02T02:01:10.936+00:00,joannwaters_06060,JoAnn Waters [PA],1256044140290900008,assets\3-FB033.png,👋
1268756079106588793,Default,,2024-08-02T02:23:41.607+00:00,gabbywpa85,Gabrielle Weiss (PA),1268364888670208133,assets\9aba90e71ef985acd9142b3316cfaab0-2D0BF.png,👋🏻
1268943044946694265,Default,,2024-08-02T14:46:37.737+00:00,fleuroses,Kate [PA],862785247061213225,assets\addc34374f20e24c94d370fc01293d11-A6259.png,Hello!
1268985912335798374,Default,,2024-08-02T17:36:58.119+00:00,katbird11,Kathleen K. (PA) CALL MOD,1266903223365668995,assets\4bb7ee9894467720a15dc7fc1963859c-3C37C.png,Hello from the Lehigh Valley!!
1268993253886394378,Default,,2024-08-02T18:06:08.481+00:00,gabbywpa85,Gabrielle Weiss (PA),1268364888670208133,assets\9aba90e71ef985acd9142b3316cfaab0-2D0BF.png,Hi from Delco!
1269018186066694215,Default,,2024-08-02T19:45:12.776+00:00,fleuroses,Kate [PA],862785247061213225,assets\addc34374f20e24c94d370fc01293d11-A6259.png,"I'm in SWPA, which unfortunately doesn't have a ton of support for Harris at the moment, so it's nice to see other Pennsylvanians here. I know there are many of us! 🫶🏻"
1269034713167958081,Default,,2024-08-02T20:50:53.144+00:00,king_echo,Max O. (PA),345034937981992961,assets\bb2150e4103ea2b0af2accc77bfc0b43-814E0.png,"Hi everyone! Very excited to see so much support for VP Harris, and I've been very encouraged with how well PA Dems is rolling everything out so far"
1269035036313649152,Default,,2024-08-02T20:52:10.188+00:00,king_echo,Max O. (PA),345034937981992961,assets\bb2150e4103ea2b0af2accc77bfc0b43-814E0.png,"I know we have other channels, but this event has been more PA-specific. I'd like to plug this event as being one of the most informative (and sobering) of any event so far:"
1269035043637166121,Default,,2024-08-02T20:52:11.934+00:00,king_echo,Max O. (PA),345034937981992961,assets\bb2150e4103ea2b0af2accc77bfc0b43-814E0.png,https://www.mobilize.us/2024pavictory/event/650542/
1269073294557188238,Default,,2024-08-02T23:24:11.664+00:00,itsnickk5525,Nick from NY,260982275506700288,assets\33bc28b94ceba3872bed7864e06e3045-6FEAB.png,"Hello everyone. I am a New Yorker in a safe blue area who is determined to help ensure Pennsylvania goes for Harris.

I’ve taken off the long weekend  through election day for GOTV efforts and have freed myself up for other trips to canvass, register voters, etc, I am just deciding on where to go and where my efforts can be most impactful.

If you have any advice, I would love to hear it!"
1269080671167578182,Default,,2024-08-02T23:53:30.385+00:00,feisty_36366,Feisty,1256039272729804853,assets\0-EB806.png,I'm Feisty and I am from SWPA - about 30 miles from Pittsburgh - just a blue dot in a red world
1269088814853263381,Default,,2024-08-03T00:25:51.991+00:00,jeanburkespraker1458,Jean Burke Spraker,1043268300836179989,assets\1-B2132.png,Hi. I’m in Philly. You may have heard that Kamala’s  going to be here Tuesday. 😉
1269104861031694356,Default,,2024-08-03T01:29:37.698+00:00,shesepuede,Tai [Mod & Kamala's Captain],957309531308822639,assets\455d163d4abd434dfbbea9e687c97e27-74EF4.png,Hi! From the Lehigh Valley (PA-07) representing! Onwards!
1269106143897321482,Default,,2024-08-03T01:34:43.557+00:00,gabbywpa85,Gabrielle Weiss (PA),1268364888670208133,assets\9aba90e71ef985acd9142b3316cfaab0-2D0BF.png,"According to my GPS, Lehigh Valley is 1 hr and 11 minutes away"
1269106154814832662,Default,,2024-08-03T01:34:46.16+00:00,gabbywpa85,Gabrielle Weiss (PA),1268364888670208133,assets\9aba90e71ef985acd9142b3316cfaab0-2D0BF.png,😂
1269334171633844245,Default,,2024-08-03T16:40:49.606+00:00,phillystef,Deathanie Lau,1204832053615394877,assets\38ec2d78d7272f064e9808171fdd648d-C1C27.png,Hi! I'm Stefanie from Philly! I signed up for the office opening in Germantown on Thursday. Hope to meet you there! Also going to try to get into the rally at Temple on Tuesday evening.
1269490587061588001,Default,,2024-08-04T03:02:21.95+00:00,immuppet,phoenixascend,511551672829476864,assets\1d3048397573b2dc3214e0eedbb151f9-1FD70.png,I'm in Lehigh valley too PA-07
1269490875516583946,Default,,2024-08-04T03:03:30.723+00:00,immuppet,phoenixascend,511551672829476864,assets\1d3048397573b2dc3214e0eedbb151f9-1FD70.png,<@957309531308822639> <@1266903223365668995>
1269506149200298245,Default,,2024-08-04T04:04:12.253+00:00,gadgetjack,@JackInacker (PA) #VetsForHarris,448131809876770816,assets\1645df628976873ee8739048891bfd74-B3AA3.png,Evening Everyone! I'm Jack From Philly- I'm the Co-Chair of Veterans + Military Families for Harris in PA. We have an activity every Thursday through e-day. You can check out out at vetsforharris.com as well as on all socials: @vetsforharris
1269644128078266439,Reply,1269034713167958081,2024-08-04T13:12:28.981+00:00,kaye23.,Kaye23,1139160749965586463,assets\6c5996770c985bcd6e5b68131ff2ba04-58AC6.png,There is another one coming up soon as well.
1269644201382117386,Reply,1269506149200298245,2024-08-04T13:12:46.458+00:00,kaye23.,Kaye23,1139160749965586463,assets\6c5996770c985bcd6e5b68131ff2ba04-58AC6.png,The big homie!!!!!
1269743683800928427,Default,,2024-08-04T19:48:04.915+00:00,mariebroph2677695,Marie B. | PA/NJ | OE/KC,941196169852366859,assets\4412fd436c9a7d43a1770d5771bbdd0c-8CC79.png,"Hello, PA people!!!!
I'm orginally from the 856 (South Jersey) but I live in the 267 now (Bucks Couny to be exact). Let's not only get Kamala to the Oval Office but keep Casey in the Senate and for the love of all that is good....flip PA-01 once and for all!"
1269820218859982949,Default,,2024-08-05T00:52:12.295+00:00,feisty_36366,Feisty,1256039272729804853,assets\0-EB806.png,<:thumbup:1252804076849074276>
1270043498145386617,Default,,2024-08-05T15:39:26.225+00:00,reardeml,Mary Rearden PA,1264656332510990441,assets\11d22fd01be9232444b1d465cf8d3856-76718.png,Mary here from Bethlehem Township. Happt to be here with all of you!
1270101028620206090,Default,,2024-08-05T19:28:02.559+00:00,immuppet,phoenixascend,511551672829476864,assets\1d3048397573b2dc3214e0eedbb151f9-1FD70.png,Fellow Bethlehem supporter!
1270132086103347250,Default,,2024-08-05T21:31:27.24+00:00,lane117711,Lane C,1266189619951697932,assets\8569adcbd36c70a7578c017bf5604ea5-8DA09.png,Hello PA People! I'm Lane from Pittsburgh. Happy to be here with all of you. Let's gooooo! 🐈‍⬛
1270132793644421191,Default,,2024-08-05T21:34:15.931+00:00,abrit_91811_87882,Alexandra [NY],1269333062097961060,assets\90c45b24b04bfb4fd56af5f7cf83ed88-C5F75.png,Has anyone heard any information about what time the rally in Philly will be held? Do we need to preregister to attend?
1270164702046978089,Reply,1270132793644421191,2024-08-05T23:41:03.487+00:00,mariebroph2677695,Marie B. | PA/NJ | OE/KC,941196169852366859,assets\4412fd436c9a7d43a1770d5771bbdd0c-8CC79.png,I think you had to.
1270176474241957918,Reply,1270164702046978089,2024-08-06T00:27:50.197+00:00,abrit_91811_87882,Alexandra [NY],1269333062097961060,assets\90c45b24b04bfb4fd56af5f7cf83ed88-C5F75.png,Oh bummer... I didn't see that registration link
1270176889478316074,Default,,2024-08-06T00:29:29.197+00:00,gabbywpa85,Gabrielle Weiss (PA),1268364888670208133,assets\9aba90e71ef985acd9142b3316cfaab0-2D0BF.png,I have to work and I have spine issues so I can’t.
1270181294411747338,Default,,2024-08-06T00:46:59.415+00:00,itsnickk5525,Nick from NY,260982275506700288,assets\33bc28b94ceba3872bed7864e06e3045-6FEAB.png,Anyone going out canvassing or registering voters this coming weekend?
1270183617829801986,Reply,1270181294411747338,2024-08-06T00:56:13.361+00:00,mariebroph2677695,Marie B. | PA/NJ | OE/KC,941196169852366859,assets\4412fd436c9a7d43a1770d5771bbdd0c-8CC79.png,I would but I just can't do canvassing anymore due to a messed up knee that makes it hard to walk for long periods of time. I'll probably do a lot of digital work this week though.
1270184503004106855,Reply,1270183617829801986,2024-08-06T00:59:44.403+00:00,itsnickk5525,Nick from NY,260982275506700288,assets\33bc28b94ceba3872bed7864e06e3045-6FEAB.png,"Yes I totally understand.

I am actually planning to drive down this weekend and canvass, but I’ve had trouble finding out who I should contact for that or where/when I could go"
1270190179864416287,Reply,1270184503004106855,2024-08-06T01:22:17.872+00:00,mariebroph2677695,Marie B. | PA/NJ | OE/KC,941196169852366859,assets\4412fd436c9a7d43a1770d5771bbdd0c-8CC79.png,Try looking on the PA Dems Mobilize. I'll DM you a link.
1270347980548866220,Default,,2024-08-06T11:49:20.487+00:00,joannwaters_06060,JoAnn Waters [PA],1256044140290900008,assets\3-FB033.png,Is there community mapping training being offered fo PA
1270389828558786652,Default,,2024-08-06T14:35:37.83+00:00,arianera_1.0,Arianera (Susanna),531917710565834763,assets\a6bb817edcbb9b5f07322586559544e1-14C7C.png,"Hello PA folks. I'm just over the bridge in Camden County, NJ. I'm also the parent of a PA voter, since as allowed by PA, my son registered to vote at his college address. Looking forward to helping out both in PA & nationally."
1270396955427733576,Default,,2024-08-06T15:03:57.008+00:00,phillystef,Deathanie Lau,1204832053615394877,assets\38ec2d78d7272f064e9808171fdd648d-C1C27.png,I’m so heartbroken that I couldn’t rsvp for today’s rally! I will go to a letter writing party at my coworking space instead. I hope everyone who got in has a great time!!
1270399653678153788,Default,,2024-08-06T15:14:40.321+00:00,ladyofthelake17,ladyofthelake,708052033357479957,assets\84c056aa94e346ede0846b85ebb73dc1-C6172.png,"Hey all! I was born and raised in Chester county and now live in Colorado, but phone banked in PA for Biden in 2020 and plan on doing some remote action in PA this time around as well. Even though I don’t live there anymore I’m very invested in keeping PA blue!! 💙💙💙"
1270455951790702662,Default,,2024-08-06T18:58:22.837+00:00,shesepuede,Tai [Mod & Kamala's Captain],957309531308822639,assets\455d163d4abd434dfbbea9e687c97e27-74EF4.png,Hey Lehigh Valley friends if anyone knows if the Allentown office will need staff -- it opens this Sunday (August 11) at 1PM. Or who I can contact re staffing and hiring. I am planning to go to the grand opening Sunday. Thanks!
1270461234889752667,Reply,1270455951790702662,2024-08-06T19:19:22.426+00:00,shesepuede,Tai [Mod & Kamala's Captain],957309531308822639,assets\455d163d4abd434dfbbea9e687c97e27-74EF4.png,Mmm. Looks like they just canceled the opening.
1270461385335246990,Reply,1270461234889752667,2024-08-06T19:19:58.295+00:00,shesepuede,Tai [Mod & Kamala's Captain],957309531308822639,assets\455d163d4abd434dfbbea9e687c97e27-74EF4.png,Are they still having one? Anyone know what is going on?
1270537114605584444,Default,,2024-08-07T00:20:53.56+00:00,zunny74,Zunny A. (AK),1199911282623664181,assets\b4ef549817e2b5f7cbfce7d56ccac071-EE8C8.png,"Hi, I have a nephew attend college in PA. I very much want this election to go blue. So, let me know if I can assist anywhere with your digital community"
1270542875087732838,Default,,2024-08-07T00:43:46.966+00:00,scouttle,scouttle,1270454988979699742,assets\986fd5357dfd3bfaeccc4c0808eb5322-C4BBE.png,Anyone else trying to attend the training for special projects volunteers?
1270542958202064958,Default,,2024-08-07T00:44:06.782+00:00,scouttle,scouttle,1270454988979699742,assets\986fd5357dfd3bfaeccc4c0808eb5322-C4BBE.png,My kids were late getting to bed and I'm stuck in the waiting room 😞
1270551240216150078,Default,,2024-08-07T01:17:01.368+00:00,scouttle,scouttle,1270454988979699742,assets\986fd5357dfd3bfaeccc4c0808eb5322-C4BBE.png,(I signed up for another one tomorrow)
1270574289271390260,Default,,2024-08-07T02:48:36.691+00:00,immuppet,phoenixascend,511551672829476864,assets\1d3048397573b2dc3214e0eedbb151f9-1FD70.png,What's special projects training for
1270743197978726460,Default,,2024-08-07T13:59:47.665+00:00,emmags,emma,878394683833856041,assets\3386ccdcb220bddc69993e4b5cf372f7-B1AB0.png,just wanted to introduce myself! i’m a registered voter in montgomery county PA but i attend college in pittsburgh so i’m mostly involved in the political organizing out in allegheny county 😁
1270750877044572202,Default,,2024-08-07T14:30:18.497+00:00,shesepuede,Tai [Mod & Kamala's Captain],957309531308822639,assets\455d163d4abd434dfbbea9e687c97e27-74EF4.png,"Just following up to see if anyone here knows what is going on with the planned Grand Opening of the Allentown, PA office this Sunday. Is it happening or not and will there be one in Allentown?"
1270751152765403282,Default,,2024-08-07T14:31:24.234+00:00,shesepuede,Tai [Mod & Kamala's Captain],957309531308822639,assets\455d163d4abd434dfbbea9e687c97e27-74EF4.png,And if anyone knows any jobs in the LV with the campaign or the Dems. Or any remote ones with the campaign or the Dems. Thanks!
1270780780746113176,Default,,2024-08-07T16:29:08.095+00:00,kent.0043,Kent,1269425103117090848,assets\94ece924320ebf6ce70992dec6f0b3e9-481AD.png,"Hi all, I’m also from a safe blue area (Massachusetts), hoping to join the canvassing in NE PA as early as 8/24, and get others to come down too!"
1270815716458762353,Reply,1270750877044572202,2024-08-07T18:47:57.418+00:00,mariebroph2677695,Marie B. | PA/NJ | OE/KC,941196169852366859,assets\4412fd436c9a7d43a1770d5771bbdd0c-8CC79.png,"I don't know when it is but I do know that they're going to be opening soon since I have a friend who is renting a couple of rooms at his house to PA Dems organizers and he lives in the area. Also, to answer your other question, check the websites for the DNC and PA Dems."
1270816030213799938,Reply,1270537114605584444,2024-08-07T18:49:12.223+00:00,mariebroph2677695,Marie B. | PA/NJ | OE/KC,941196169852366859,assets\4412fd436c9a7d43a1770d5771bbdd0c-8CC79.png,"Zunny, have you signed up for our Online Engagement trainings? Look in the events tab in the left sidebar for more info."
1270816382807703632,Reply,1270816030213799938,2024-08-07T18:50:36.288+00:00,zunny74,Zunny A. (AK),1199911282623664181,assets\b4ef549817e2b5f7cbfce7d56ccac071-EE8C8.png,"I have taken 2 online engagements, 2 reach classes, and waiting on a couple more was there one specfic for PA?"
1270816511409258540,Reply,1270816382807703632,2024-08-07T18:51:06.949+00:00,mariebroph2677695,Marie B. | PA/NJ | OE/KC,941196169852366859,assets\4412fd436c9a7d43a1770d5771bbdd0c-8CC79.png,Check the PA Dems Mobilize. https://www.mobilize.us/padems/
1270816939710615552,Reply,1270816511409258540,2024-08-07T18:52:49.064+00:00,zunny74,Zunny A. (AK),1199911282623664181,assets\b4ef549817e2b5f7cbfce7d56ccac071-EE8C8.png,"okay, thank you so much. do I need to find an engagement training here or start with something specific?"
1270817411460763679,Reply,1270816939710615552,2024-08-07T18:54:41.538+00:00,mariebroph2677695,Marie B. | PA/NJ | OE/KC,941196169852366859,assets\4412fd436c9a7d43a1770d5771bbdd0c-8CC79.png,They have all different things so I really can't tell you where to begin. I trained on a few of theirs but I opted to work more on the national end since I already do a lot with the DNC's program as it is.
1270817621616627814,Reply,1270817411460763679,2024-08-07T18:55:31.643+00:00,zunny74,Zunny A. (AK),1199911282623664181,assets\b4ef549817e2b5f7cbfce7d56ccac071-EE8C8.png,"Makes sense, I will see what I can find. Thank you."
1270822983312740453,Reply,1270815716458762353,2024-08-07T19:16:49.971+00:00,shesepuede,Tai [Mod & Kamala's Captain],957309531308822639,assets\455d163d4abd434dfbbea9e687c97e27-74EF4.png,Thanks if you hear anything can you PM me?
1270903923682574346,Default,,2024-08-08T00:38:27.659+00:00,jessebacon_,jessebacon,694521855209373796,assets\a4b3155aa2d79fd3eadf23b0216c6504-1FE0D.png,"Hello, just joined from Philly"
1270941917017935976,Default,,2024-08-08T03:09:25.976+00:00,brendan_00119,brendan p  [NJ/PA],1270895729610723413,assets\09a1b40b3756fdbc10da00dfcc4fe87f-B44A3.png,Hi- just joined from rural NE Pennsylvania- Pike and Wayne County!
1271191094591357009,Default,,2024-08-08T19:39:34.539+00:00,brendan_00119,brendan p  [NJ/PA],1270895729610723413,assets\09a1b40b3756fdbc10da00dfcc4fe87f-B44A3.png,Hi Pennsylvania People! Anyone else in here in the NE Corner? I will be at my home for the last two weeks of the month and am hoping to get some postcards done!!
1271222010382651564,Default,,2024-08-08T21:42:25.438+00:00,rootsmusic,rootsmusic,791857656897732648,assets\a30e650576a6d42a3c9ee24648f67c90-2AE37.png,Join the state's [Slack workspace](https://docs.google.com/forms/d/e/1FAIpQLSeusJoZgoWNVLdxOYNwy0APDTSDbBePDpMgQeTDMqv0aIghAQ/viewform)
1271247319085351044,Reply,1271222010382651564,2024-08-08T23:22:59.503+00:00,brendan_00119,brendan p  [NJ/PA],1270895729610723413,assets\09a1b40b3756fdbc10da00dfcc4fe87f-B44A3.png,Thanks!
1271250719994810399,Default,,2024-08-08T23:36:30.343+00:00,immuppet,phoenixascend,511551672829476864,assets\1d3048397573b2dc3214e0eedbb151f9-1FD70.png,Just got a call about the opening or reopening of the Allentown campaign office on Sunday
1271250813028929546,Default,,2024-08-08T23:36:52.524+00:00,immuppet,phoenixascend,511551672829476864,assets\1d3048397573b2dc3214e0eedbb151f9-1FD70.png,For anyone that's in the area
1271251284183482448,Default,,2024-08-08T23:38:44.856+00:00,brendan_00119,brendan p  [NJ/PA],1270895729610723413,assets\09a1b40b3756fdbc10da00dfcc4fe87f-B44A3.png,"Monroe County has a lot going on, too! I just saw their pages if anyone is near them. Thats Matt Cartwrights District- a pivotal seat where I am !"
1271251719384465518,Default,,2024-08-08T23:40:28.616+00:00,brendan_00119,brendan p  [NJ/PA],1270895729610723413,assets\09a1b40b3756fdbc10da00dfcc4fe87f-B44A3.png,Here's the update listings of democratic events across the commonwealth: https://events.democrats.org/?country=US&state=PA
1271251882576318474,Default,,2024-08-08T23:41:07.524+00:00,immuppet,phoenixascend,511551672829476864,assets\1d3048397573b2dc3214e0eedbb151f9-1FD70.png,So excited about the office opening can't wait to spend a lot of time there 😂
1271479829396459550,Default,,2024-08-09T14:46:54.281+00:00,brendan_00119,brendan p  [NJ/PA],1270895729610723413,assets\09a1b40b3756fdbc10da00dfcc4fe87f-B44A3.png,What county is everyone from?
1271494815372283995,Default,,2024-08-09T15:46:27.216+00:00,emmags,emma,878394683833856041,assets\3386ccdcb220bddc69993e4b5cf372f7-B1AB0.png,montgomery but living in allegheny rn
1271588549514231930,Default,,2024-08-09T21:58:55.177+00:00,katbird11,Kathleen K. (PA) CALL MOD,1266903223365668995,assets\4bb7ee9894467720a15dc7fc1963859c-3C37C.png,My son is trying to find students at Kutztown U I who are interested in starting an on campus group for Harris-Walz if anyone knows anyone who goes there
1271588584402718760,Default,,2024-08-09T21:59:03.495+00:00,katbird11,Kathleen K. (PA) CALL MOD,1266903223365668995,assets\4bb7ee9894467720a15dc7fc1963859c-3C37C.png,Northampton County
1271977624423632956,Default,,2024-08-10T23:44:57.864+00:00,gabbywpa85,Gabrielle Weiss (PA),1268364888670208133,assets\9aba90e71ef985acd9142b3316cfaab0-2D0BF.png,Delco here. Anyone else?
1272294216180957235,Default,,2024-08-11T20:42:59.221+00:00,feisty_36366,Feisty,1256039272729804853,assets\0-EB806.png,I am in Westmoreland County
1272300338145263738,Default,,2024-08-11T21:07:18.811+00:00,brendan_00119,brendan p  [NJ/PA],1270895729610723413,assets\09a1b40b3756fdbc10da00dfcc4fe87f-B44A3.png,"Welcome!  Seems to be a mix. Northampton, Delaware, Pike, Allegheny, Berks"
1272300386635481129,Default,,2024-08-11T21:07:30.372+00:00,brendan_00119,brendan p  [NJ/PA],1270895729610723413,assets\09a1b40b3756fdbc10da00dfcc4fe87f-B44A3.png,And now westmoreland!!
1272304123404095621,Reply,1271977624423632956,2024-08-11T21:22:21.287+00:00,mariebroph2677695,Marie B. | PA/NJ | OE/KC,941196169852366859,assets\4412fd436c9a7d43a1770d5771bbdd0c-8CC79.png,I'm a bit more towards the east of you in Bucks County.
1272327853878284370,Reply,1272304123404095621,2024-08-11T22:56:39.073+00:00,gabbywpa85,Gabrielle Weiss (PA),1268364888670208133,assets\9aba90e71ef985acd9142b3316cfaab0-2D0BF.png,"I know Bucks County. Been to Newtown, New Hope, Warminster, Warrington, Doylestown"
1272334442794324061,Default,,2024-08-11T23:22:49.993+00:00,brendan_00119,brendan p  [NJ/PA],1270895729610723413,assets\09a1b40b3756fdbc10da00dfcc4fe87f-B44A3.png,Bucks is a swing county!!!!
1272344482712391721,Reply,1272334442794324061,2024-08-12T00:02:43.696+00:00,mariebroph2677695,Marie B. | PA/NJ | OE/KC,941196169852366859,assets\4412fd436c9a7d43a1770d5771bbdd0c-8CC79.png,"An extreme swing county. It's so bad that the Ashley Ehaz Campaign is desperately looking for phone bank people. I was doing it but I'm starting to train for the DNC's Vote Team so I don't know how much of a commitment I can do. If anyone wants info on the campaign's phonebanks, DM me."
1272345388300636281,Reply,1272344482712391721,2024-08-12T00:06:19.605+00:00,gabbywpa85,Gabrielle Weiss (PA),1268364888670208133,assets\9aba90e71ef985acd9142b3316cfaab0-2D0BF.png,I’m in Delco but would gladly text bank for them if I can do so from home
1272346099595608124,Default,,2024-08-12T00:09:09.191+00:00,mariebroph2677695,Marie B. | PA/NJ | OE/KC,941196169852366859,assets\4412fd436c9a7d43a1770d5771bbdd0c-8CC79.png,I'll just put it here. They're Monday and Thursday from 5-7 and it's 100% virtual. Bucks is in the 1st US Congressional District in PA which is currently represented by Brian Fitzpatrick who I can tell you right now claims he's progressive but he's MAGA. https://www.mobilize.us/ehaszforcongress/event/649264/
1272346637041274900,Default,,2024-08-12T00:11:17.328+00:00,gabbywpa85,Gabrielle Weiss (PA),1268364888670208133,assets\9aba90e71ef985acd9142b3316cfaab0-2D0BF.png,I don’t do phonebanking unfortunately. Gives me too much anxiety. Definitely dislike Fitzpatrick though
1272347501852233870,Reply,1272346637041274900,2024-08-12T00:14:43.515+00:00,mariebroph2677695,Marie B. | PA/NJ | OE/KC,941196169852366859,assets\4412fd436c9a7d43a1770d5771bbdd0c-8CC79.png,"Don't we all? I live two towns over from where his family grew up and I can tell you he's not a good person. Rarely shows up at events and when he does virtual town halls, if you comment with something that he doesn't agree with, they boot you out. The only reason why this guy got noticed in the first place is his late brother was the Congressman before him and to be honest, I liked his brother more than him because at least his brother showed up at things."
1272352474476314866,Reply,1272347501852233870,2024-08-12T00:34:29.081+00:00,gabbywpa85,Gabrielle Weiss (PA),1268364888670208133,assets\9aba90e71ef985acd9142b3316cfaab0-2D0BF.png,🙄 wow 😳😳
1272354340367110196,Default,,2024-08-12T00:41:53.944+00:00,immuppet,phoenixascend,511551672829476864,assets\1d3048397573b2dc3214e0eedbb151f9-1FD70.png,Awesome turnout at the Allentown campaign office opening today!
1272738621597814785,Default,,2024-08-13T02:08:53.729+00:00,rootsmusic,rootsmusic,791857656897732648,assets\a30e650576a6d42a3c9ee24648f67c90-2AE37.png,"Did you know that Republicans For Harris has a weekly call in PA?  Tomorrow, [Republicans For Harris](http://bit.ly/RepublicansForHarris) will have a call with Mark Hamill (of the New Republic)."
1273381142946648116,Default,,2024-08-14T20:42:02.756+00:00,curethreads,Kate @ForgetAboutStars,746403830073262152,assets\848915b5e1809f025f1bdd3a5b1847f8-8EC4B.png,Does anyone know anything about the rally tomorrow in Delco?
1273419283052892180,Reply,1273381142946648116,2024-08-14T23:13:36.066+00:00,gabbywpa85,Gabrielle Weiss (PA),1268364888670208133,assets\9aba90e71ef985acd9142b3316cfaab0-2D0BF.png,Wait what?
1273419329509261342,Default,,2024-08-14T23:13:47.142+00:00,gabbywpa85,Gabrielle Weiss (PA),1268364888670208133,assets\9aba90e71ef985acd9142b3316cfaab0-2D0BF.png,I’m in Delco!!
1273419386824294474,Default,,2024-08-14T23:14:00.807+00:00,gabbywpa85,Gabrielle Weiss (PA),1268364888670208133,assets\9aba90e71ef985acd9142b3316cfaab0-2D0BF.png,I’ve heard nothing.
1273510063327412236,Reply,1272294216180957235,2024-08-15T05:14:19.77+00:00,rachelunhinged.,TheWanderingPizza,361686684758310913,assets\9f433b525db39ecc861870b8723a89a9-0CF30.png,"I am in Westmoreland, too!"
1273638967157457018,Default,,2024-08-15T13:46:32.838+00:00,phillystef,Deathanie Lau,1204832053615394877,assets\38ec2d78d7272f064e9808171fdd648d-C1C27.png,"Same, couldn’t find anything. Maybe it’s hosted by a org. /with donors or a union, etc. Here’s what I found: https://archive.ph/GY09d though. Small stops in western PA en route to Chicago for the DNC"
1273658054373801995,Default,,2024-08-15T15:02:23.585+00:00,rebecca9037,Rebecca,485289288695545866,assets\2-ADBB4.png,"Hi, all! I live in DC and am looking to drive up to PA with a few friends each Fri-Sun in Sept to volunteer. Most of us have a lot of campaign experience, so we can door knock but also help support/staff events if there’s a need. What’s the best way to get connected to local teams we can support?"
1273660180709511259,Reply,1273658054373801995,2024-08-15T15:10:50.543+00:00,rootsmusic,rootsmusic,791857656897732648,assets\a30e650576a6d42a3c9ee24648f67c90-2AE37.png,"Join the campaign's [Slack workspace](https://docs.google.com/forms/d/e/1FAIpQLSeusJoZgoWNVLdxOYNwy0APDTSDbBePDpMgQeTDMqv0aIghAQ/viewform).  Also some swing House districts: [PA-01](https://secure.ngpvan.com/ykqy_0z7Oka81MyuN_GbxQ2?refcode=web), [PA-07](https://www.mobilize.us/wildforcongress/), [PA-10](https://docs.google.com/forms/d/e/1FAIpQLSdTCt3nlvO1t0tOHyRtslCKqoCGG3KvBKo2Cp5JCqg4FCoIJw/viewform)."
