id,type,ref_to,timestamp,author_name,author_nickname,author_id,author_avatar_url,content
1300305975479238698,21,1300305911058796617,2024-10-28T03:51:43.071+00:00,carb.on,Carolyn B [CA] • Lead Mod,568257600228032512,assets\28a90c77b5793d80eb62484a43c66748-D8837.png,
1300305977492373514,Default,,2024-10-28T03:51:43.551+00:00,carb.on,Carolyn B [CA] • Lead Mod,568257600228032512,assets\28a90c77b5793d80eb62484a43c66748-D8837.png,post successess here.
1300307152631763024,Default,,2024-10-28T03:56:23.726+00:00,ohlol_,opera house tenants union,1185440577022603365,assets\4bb5edf8f411c366cb5bf2bcb1f353b3-5539F.png,Have been lucky getting online network into Reach themselves by circulating this. https://www.instagram.com/s/aGlnaGxpZ2h0OjE4MDA3MzAzMzg4NjUxNDk2?story_media_id=3484719093830430762&igsh=MXR1dHB1NTN3OW1wbA==
1300313316517875742,Default,,2024-10-28T04:20:53.311+00:00,jayrio76,Jay E  (TX)  OE Mod,782870341445353522,assets\41ef520387924aa4413513eda28784df-34D82.png,"<@1251571892201197608> says her phone banking went well today.  Even though that is not online, it will probably prompt some online donations and volunteer sign ups."
1300313660509519933,Default,,2024-10-28T04:22:15.325+00:00,jayrio76,Jay E  (TX)  OE Mod,782870341445353522,assets\41ef520387924aa4413513eda28784df-34D82.png,"<@1277151707217793047> says made 2 hours of bilingual calls to Wisconsin yesterday.  Talked with some Harris voters and some leaning Harris, and helped some with voter registration info.  Also posted some Reach content on Facebook, and news with pro-Harris commentary."
1300314083165339660,Default,,2024-10-28T04:23:56.094+00:00,jayrio76,Jay E  (TX)  OE Mod,782870341445353522,assets\41ef520387924aa4413513eda28784df-34D82.png,<@1252681241778589787> Engaged with several misinformation and dis information posts on X. Ensured all of my family and friends have early voted or have a plan to vote via text and in person.
1300314556249276416,Default,,2024-10-28T04:25:48.886+00:00,jayrio76,Jay E  (TX)  OE Mod,782870341445353522,assets\41ef520387924aa4413513eda28784df-34D82.png,I helped connect someone with Grassroots OE options and to understand that they were still a valued part of the campaign.
1300318373909106730,Default,,2024-10-28T04:40:59.087+00:00,jayrio76,Jay E  (TX)  OE Mod,782870341445353522,assets\41ef520387924aa4413513eda28784df-34D82.png,<@734718412017762345> Content shared on Reddit and YouTube. Lots of positive engagement in comments. Today experienced far fewer MAGA trolls. Maybe they are all at MSG (Madison Sq Garden).
1300321657881235468,Default,,2024-10-28T04:54:02.047+00:00,jayrio76,Jay E  (TX)  OE Mod,782870341445353522,assets\41ef520387924aa4413513eda28784df-34D82.png,<@1202741647096545300> - I had a few post reach over 1M- my most recent 2.8M on various voting topics. I have also tackled much misinformation on X -
1300431130226593825,Default,,2024-10-28T12:09:02.288+00:00,jayrio76,Jay E  (TX)  OE Mod,782870341445353522,assets\41ef520387924aa4413513eda28784df-34D82.png,"<@1277403387238940713>: Voters in NC who needed to feel confident that their votes do matter, and appreciated the calls.  Also greatly appreciated the info we provided re polling places, ride assistance, etc.  Also ensuring Houston rally attendees had all the info they needed."
1300445628165259296,Default,,2024-10-28T13:06:38.866+00:00,lauraandlauer,Laura Andlauer,1297648294108860468,assets\12c91ecaf16222bd44b7545ea233a34c-AB795.png,Posted on X and shared my action cards for Jon Tester - MT and Colin Allred - TX.
1300561609697136690,Default,,2024-10-28T20:47:31.018+00:00,rj_weatherwax,RJ Gilman [CA][OE Lead],1056295974194122842,assets\25735137099d8bdfe5eeda6e2ac928bd-BF1B5.png,"Campaign and Grassroots Results Include:
- Create digital strategy outline, which can be used at scale; identifying wins and where opportunities might be regained
- Continuing to amplify digital messaging of the campaign and among house reps in close races in my state, and a few beyond that
- Continuing to push back on mis/disinformation via CNs, within FB groups, linking to voter resources and primary sources on Twitter, and within/across live podcasts
- Continuing to provide Just-in-Time training and resources in re: Discord, online privacy & safety, generating online engagement, and video editing
- Continuing to connect volunteers to resources, while providing a safer space to explore niches where they can be their best selves"
