id,type,ref_to,timestamp,author_name,author_nickname,author_id,author_avatar_url,content
1295098106144227339,Reply,1295015377021046875,2024-10-13T18:57:30.264+00:00,mikem_13174,Mike Marcinek [PA],1282131375700443280,assets\2-ADBB4.png,"Here are some opportunities. All of these events have times on Nov 5.

Drive canvassers: 
NE Philly: https://events.democrats.org/event/713023/
Main Line: https://events.democrats.org/event/708997/

Ballot cure phonebanking:
https://www.mobilize.us/2024yesshecancampaign/event/676131/

GOTV phonebanking:
https://events.democrats.org/event/712290/
https://events.democrats.org/event/718932/
https://events.democrats.org/event/723274/"
1295098584580100238,Reply,1295098106144227339,2024-10-13T18:59:24.332+00:00,tk181818,Teagan (PA) 💙,1277403729519185995,assets\6c5996770c985bcd6e5b68131ff2ba04-171BA.png,Thank you so much!
1295102257473257515,Default,,2024-10-13T19:14:00.018+00:00,putitthatway6493,Mary Byrne M,960358175113117737,assets\fb467bee2539fc5d07540b3b46cae6b6-050F5.png,"Looking for info. I'm downstate NY, can get more specific in a dm. When I look up carpooling all I see are options to form one, nothing to join one. And all the bus trips I've seen seem to be on Saturdays which doesn't work, or aren't leaving from a  location near me.  Any suggestions? Also what's the closest point in Pa  to downstate NY where volunteers are needed most, in case  I look at whether I can just get there on my own. thanks"
1295121188397514858,Reply,1295102257473257515,2024-10-13T20:29:13.502+00:00,mikem_13174,Mike Marcinek [PA],1282131375700443280,assets\2-ADBB4.png,"There are buses leaving every Sunday (in addition to Saturday) plus Election Day from these places:

Midtown Manhatten: https://events.democrats.org/event/719201/
Upper West Side: https://events.democrats.org/event/702688/
Brooklyn: https://events.democrats.org/event/702683/
Harlem: https://events.democrats.org/event/702662/
Bronx: https://events.democrats.org/event/705124/
This site lists other places they leave from: https://go.kamalaharris.com/resources/battlegroundstateshelp/

Here's a carpool from New Rochelle that happened today. If you click the button to attend, you'll get an email and can reply asking if they'll have other times.
https://www.mobilize.us/peoplefor/event/724480/"
1295182414032666745,Default,,2024-10-14T00:32:30.831+00:00,putitthatway6493,Mary Byrne M,960358175113117737,assets\fb467bee2539fc5d07540b3b46cae6b6-050F5.png,"I appreciate all this. But how did you find the carpool? When I've checked I've only seen options to form one, not any that already existed."
1295182861665833011,Default,,2024-10-14T00:34:17.555+00:00,putitthatway6493,Mary Byrne M,960358175113117737,assets\fb467bee2539fc5d07540b3b46cae6b6-050F5.png,"It's opening outlook, which I don't have set up, so I can't reach the email address"
1295183082059595908,Default,,2024-10-14T00:35:10.101+00:00,putitthatway6493,Mary Byrne M,960358175113117737,assets\fb467bee2539fc5d07540b3b46cae6b6-050F5.png,None of these locations work for me:). thanks for the help though
1295200659380895805,Reply,1295183082059595908,2024-10-14T01:45:00.861+00:00,matt_1989_,Matt Sally,1275554237870247947,assets\2-ADBB4.png,Hey Mary I went to Newtown Pa which is in Bucks county and just across from Trenton NJ. I basically signed up with the PA democrats and found that as closest to me (although it did take me 2 hours or so to get there). I think the above are all the buses that do go - not sure if there are other open routes
1295238066734235672,Default,,2024-10-14T04:13:39.469+00:00,mikem_13174,Mike Marcinek [PA],1282131375700443280,assets\2-ADBB4.png,"If anyone near Montgomery County wants to make a BIG impact, voter registration drives are happening at MontCo Community College this week (including today)!
Please share these links with anyone who might be interested!

https://www.mobilize.us/mobilize/event/685505/
https://www.mobilize.us/mobilize/event/688259/"
1295299525153525772,Default,,2024-10-14T08:17:52.298+00:00,apfee2024_81383,howdyfriends (KY),1274293080794595339,assets\eb95501477beed1d0f8fde71864b6435-9F719.png,"Hey team -- passing along this post, a range of anecdotes about PA vibes https://www.reddit.com/r/Pennsylvania/comments/1g32pqn/if_the_dozens_of_political_ads_emails_texts_and/"
1295313912585126021,Reply,1295183082059595908,2024-10-14T09:15:02.529+00:00,nieta0412,"Nieta G, MA (Call MOD)",1266164208928686110,assets\c82b3fa769ed6e6ffdea579381ed5f5c-A9936.png,I got the email for you: digitalorganizing@dnc.org
1295391761170174043,Reply,1295200659380895805,2024-10-14T14:24:23.078+00:00,putitthatway6493,Mary Byrne M,960358175113117737,assets\fb467bee2539fc5d07540b3b46cae6b6-050F5.png,this is really great info thank you. I just went to Pa democrats and searched and found info for Newton canvassing. Could have done it today (: ....but at least I have more specific info now and might to be able to work this out to get there. thanks so much.
1295392187353141310,Reply,1295313912585126021,2024-10-14T14:26:04.688+00:00,putitthatway6493,Mary Byrne M,960358175113117737,assets\fb467bee2539fc5d07540b3b46cae6b6-050F5.png,thank you for going to the trouble! I really need to figure out outlook. so many sites open that up now rather than directly give you the address.  thanks again
1295426914386968607,Default,,2024-10-14T16:44:04.258+00:00,apfee2024_81383,howdyfriends (KY),1274293080794595339,assets\eb95501477beed1d0f8fde71864b6435-9F719.png,Just posted https://www.reddit.com/r/Pennsylvania/comments/1g3kars/pennsylvania_republican_senate_candidate_suffers/ -- this is really embarrassing. GOP should at least run PA candidates.
1295447553936068708,Reply,1295426914386968607,2024-10-14T18:06:05.11+00:00,gabbywpa85,Gabrielle Weiss (PA),1268364888670208133,assets\9aba90e71ef985acd9142b3316cfaab0-2D0BF.png,how do you not know the Philadelphia Eagles? Oof  🙄 😂
1295454921642217593,Default,,2024-10-14T18:35:21.708+00:00,jimieggman,Eric Bergel,238101642854137856,assets\8aa62bc052e45fea7d8e7efc55ebf3c4-4157A.png,For the first time this election season Harris/Walz signs are dominating the landscape in lower Bucks! 🕺💃🕺💃
1295456364994498611,Reply,1295454921642217593,2024-10-14T18:41:05.83+00:00,jack.246012,Jack (KC),1276396030375624789,assets\1b105b23ea580bad6169b556d3b7ebc4-4403D.png,"Remember: Just because theres more good signs, dosent mean we can take our foot off the gas.  There are alot of voters out there"
1295501564605370488,Default,,2024-10-14T21:40:42.257+00:00,jayrio76,Jay E  (TX)  OE Mod,782870341445353522,assets\309b524d0d26887fbea0dd6705989398-C6690.png,<@1283943183830487139> - Here's the Pennsylvania State Democratic Party Website for Postcard Info: https://www.padems.org/.  Thanks for your question in general support area. 🙂
1295507266023198843,Default,,2024-10-14T22:03:21.581+00:00,mikkyseattle_13016,MikkY Seattle,1283943183830487139,assets\0-EB806.png,"Hi Please see my question below
I’m writing PC’s for PA. 
There’s a suggestion to add one issue from Pennsylvania for the postcard. Could someone suggest what that one issue could be?"
1295510250945908847,Default,,2024-10-14T22:15:13.242+00:00,urielberman1.3,Uriel Berman (FL),1267218248491991095,assets\1-B2132.png,Anyone at the rally? Send pics!!
1295510380419874817,Reply,1295510250945908847,2024-10-14T22:15:44.111+00:00,carb.on,Carolyn • Lead Mod,568257600228032512,assets\28a90c77b5793d80eb62484a43c66748-D8837.png,some photos here https://discord.com/channels/1242249109298221066/1292581735942459413
1295511091312590868,Default,,2024-10-14T22:18:33.601+00:00,urielberman1.3,Uriel Berman (FL),1267218248491991095,assets\1-B2132.png,Ty!
1295518342202921001,Default,,2024-10-14T22:47:22.348+00:00,joecarr_91589,Joe Carr,1277407870010527850,assets\241163116aa2adce2aa3914a6e9b55d2-C395B.png,"Hi! I live in Houston, Texas, but I want to help make calls to Pennsylvania voters after I take the Dials from Dawn 'til Dusk dialer training tomorrow evening. I know that we will be given a script in the dialer and that I will be able to answer questions about Harris-Walz, but shouldn't I also be prepared to answer questions about Bob Casey's campaign for US Senate? If so, are there some suggested talking points for Casey and his challenger Dave McCormick that I can review before I make calls in the next few days after training? Thank you!"
1295530307034026000,Reply,1295518342202921001,2024-10-14T23:34:54.986+00:00,jayrio76,Jay E  (TX)  OE Mod,782870341445353522,assets\309b524d0d26887fbea0dd6705989398-C6690.png,"<@1277407870010527850> -I would definitely ask that during your training. I am sure you thought of this already, but definitely want to check out https://www.padems.org.  We cannot link to any candidate sites here, but you are welcome to Google those sites to study."
1295533722426409110,Reply,1295530307034026000,2024-10-14T23:48:29.279+00:00,joecarr_91589,Joe Carr,1277407870010527850,assets\241163116aa2adce2aa3914a6e9b55d2-C395B.png,"Thank you Jay! Yes, I did check out the padems site after I posted my message here... and I think that site is exactly what I need. Thanks!"
1295539095367454801,Default,,2024-10-15T00:09:50.288+00:00,mikkyseattle_13016,MikkY Seattle,1283943183830487139,assets\0-EB806.png,"Hi Please see my question below
I’m writing PC’s for PA. 
There’s a suggestion to add one issue from Pennsylvania for the postcard. Could someone suggest what that one issue could be?"
1295768855875944499,Default,,2024-10-15T15:22:49.462+00:00,stevetx1,SteveTX1,977406049915134002,assets\19bf1bc141198794cb83e0290acb77af-B6629.png,https://x.com/blockedfreq/status/1846197211647947140?s=46
1295768890516836405,Default,,2024-10-15T15:22:57.721+00:00,stevetx1,SteveTX1,977406049915134002,assets\19bf1bc141198794cb83e0290acb77af-B6629.png,Let’s keep going!
1295771032422055936,Default,,2024-10-15T15:31:28.391+00:00,king_echo,Max O. (PA),345034937981992961,assets\bb2150e4103ea2b0af2accc77bfc0b43-814E0.png,Awesome job PA! Thank you to everyone here who is helping to make it happen
1295781058465235074,Default,,2024-10-15T16:11:18.786+00:00,chase035208,Chase (Email Mod) (PA),1287188453510877276,assets\fd38279b3c3bab9498c3cbe27933100f-D5336.png,Got to meet Gwen Walz today in Harrisburg!! 🙃
1295782264436686911,Default,,2024-10-15T16:16:06.312+00:00,king_echo,Max O. (PA),345034937981992961,assets\bb2150e4103ea2b0af2accc77bfc0b43-814E0.png,"that's awesome, I'm jealous! What was she like?"
1295783153020964938,Default,,2024-10-15T16:19:38.167+00:00,chase035208,Chase (Email Mod) (PA),1287188453510877276,assets\fd38279b3c3bab9498c3cbe27933100f-D5336.png,Amazing! Very motivating to continue our work here!
1295796432330162297,Default,,2024-10-15T17:12:24.201+00:00,christinac_38542,ChristinaC,1295792090831261707,assets\5-E9BDB.png,Hi everyone! I'm visiting from out of town and would like to knock on doors in the Easton/Bethlehem area tomorrow. Could someone connect me with an organizer from that area?
1295796499338231870,Default,,2024-10-15T17:12:40.177+00:00,christinac_38542,ChristinaC,1295792090831261707,assets\5-E9BDB.png,"I have MiniVan, all I would need is lit and a list number 🙂"
1295814451047694337,Default,,2024-10-15T18:24:00.198+00:00,gabriellelynn_4444,Gabrielle Lynn [HFP Staff],1280619651029798924,assets\240de4e960e8591f3136c93fbf92c244-59538.png,"🗳️ 🗳️ 🗳️ 
<@&1245910841832902766> Register to vote by mail, in person, or online by October 21 in Pennsylvania! Can you take a second today to make sure you and your network are all set to vote?
Here’s what you can do:

1. Reach out to everyone in your network with this message, that can also be found in Reach: 

The voter registration deadline in our state is approaching! I’m reaching out to everyone I know to make sure their registration is up to date. This election is too important to miss. Will you check your registration status? Here’s the link: https://IWillVote.com/PA 

2. Share this image on your social media! It can also be found in Reach! ✨ Make sure you’ve joined Reach for campaign updates here: https://app.reach.vote/join/7DRDMN
3. Check your own registration, at IWillVote.com. 
React with ✅when you’ve done it!
🗳️ 🗳️ 🗳️"
1295838233611206860,Default,,2024-10-15T19:58:30.403+00:00,littleduckiie,mandi (PA),1110731451240034318,assets\d883d8c629feafe2cb3042549b512341-2AB93.png,Hi! There’s an event near me tomorrow and they think it’s a Kamala rally but they haven’t said if it’s public or private yet. When do they usually make that announcement?
1295843453741174866,Reply,1295838233611206860,2024-10-15T20:19:14.979+00:00,chase035208,Chase (Email Mod) (PA),1287188453510877276,assets\fd38279b3c3bab9498c3cbe27933100f-D5336.png,Where do you think this is supposed to take place? Just curious for myself lol 🙂
1295843576965627988,Reply,1295843453741174866,2024-10-15T20:19:44.358+00:00,carlcory,Rod Nayfield NJ,370390431516852236,assets\1-B2132.png,Washington Crossing
1295844974713114687,Default,,2024-10-15T20:25:17.607+00:00,apfee2024_81383,howdyfriends (KY),1274293080794595339,assets\eb95501477beed1d0f8fde71864b6435-9F719.png,"<:mega2:1269006580976976076> Calling all **Reddit users**: The <#1288163431911788586> team would love your help! We’re posting and boosting breaking, informative, and positive <:kamala1:1269028302203523114> + <:WalzSmile:1270424129853456445> news, as well as campaign-generated memes and screenshots of @kamalaHQ social media to turn the tide on Reddit from Orange to Blue! We especially need people who can post at r/politics, r/news, r/technology, and other large subreddits. Join here: https://discord.com/channels/1242249109298221066/1260651617867399188/1260728814540165162 and click the icon for Reddit (last option)."
1295855315073634335,Reply,1295539095367454801,2024-10-15T21:06:22.941+00:00,mikkyseattle_13016,MikkY Seattle,1283943183830487139,assets\0-EB806.png,"Here is an example of the text we used for the post cards 

Dear [First Name]
Please vote in the Tuesday Nov 5th. election. 
Keep Medicare drug prices down. 
Republicans want to repeal the act that prevents drug companies from raising their prices.
[your name]"
1295872921549537300,Default,,2024-10-15T22:16:20.652+00:00,purplehumaniod,Purple (Maryland),1072639754765615237,assets\c77904d529d439bb07f5f80ab2d95609-B585A.png,"I'm sorry Pittsburgh you guys only get a break for the election but after November 5th, Steelers rivalry comes back."
1295920834023784562,Reply,1295872921549537300,2024-10-16T01:26:43.876+00:00,mikkyseattle_13016,MikkY Seattle,1283943183830487139,assets\0-EB806.png,😆😆😆
1296062387866042398,Default,,2024-10-16T10:49:12.942+00:00,steven067786,Steven Flaumenbaum - PA,1251898541698453655,assets\5-E9BDB.png,Does anyone know details about how to see Kamala at Washington Crossing in PA today (Wednesday Oct 16)?
1296068566172565534,Reply,1296062387866042398,2024-10-16T11:13:45.965+00:00,nieta0412,"Nieta G, MA (Call MOD)",1266164208928686110,assets\c82b3fa769ed6e6ffdea579381ed5f5c-A9936.png,It is invite only event for Republicans for Harris. I am going to the event.
1296110817137397862,Reply,1296068566172565534,2024-10-16T14:01:39.38+00:00,amyhvotes,AmyHVotes,1296076148312248360,assets\0-EB806.png,Very cool! Headed that way today so will modify my usual driving route for likely road closures. Look forward to seeing photos💙
1296190636348801134,Default,1296115884376461456,2024-10-16T19:18:49.763+00:00,meanderingstone6495,Autumn S [AR]🤘• Lead Mod/OE Mod,936622618293968958,assets\af45a372ba919e7bac10686b43e799f1-BDEE3.png,
1296197205098758244,Default,,2024-10-16T19:44:55.875+00:00,meanderingstone6495,Autumn S [AR]🤘• Lead Mod/OE Mod,936622618293968958,assets\af45a372ba919e7bac10686b43e799f1-BDEE3.png,Want to join me for this event? https://mobilize.us/s/yCrvow
1296202603440636035,Default,,2024-10-16T20:06:22.94+00:00,matt_1989_,Matt Sally,1275554237870247947,assets\2-ADBB4.png,What is all this news cycle today with PA campaign strategy not being in order? Is she going to hold a rally in Philly? I know she’s being focused on outside areas but she probably also needs to focus also Philly to drive turnout?
1296203775928959078,Reply,1296202603440636035,2024-10-16T20:11:02.483+00:00,meanderingstone6495,Autumn S [AR]🤘• Lead Mod/OE Mod,936622618293968958,assets\af45a372ba919e7bac10686b43e799f1-BDEE3.png,"Any events would  be posted
https://events.democrats.org/?q=Philadelphia%20"
1296205751383101510,Default,1296205585251041300,2024-10-16T20:18:53.468+00:00,meanderingstone6495,Autumn S [AR]🤘• Lead Mod/OE Mod,936622618293968958,assets\af45a372ba919e7bac10686b43e799f1-BDEE3.png,
1296213354813067304,Default,,2024-10-16T20:49:06.267+00:00,nieta0412,"Nieta G, MA (Call MOD)",1266164208928686110,assets\c82b3fa769ed6e6ffdea579381ed5f5c-A9936.png,Today's Republicans for Harris campaign event.
1296214044193325139,Reply,1296202603440636035,2024-10-16T20:51:50.628+00:00,purplehumaniod,Purple (Maryland),1072639754765615237,assets\c77904d529d439bb07f5f80ab2d95609-B585A.png,She can't be everywhere at once.
1296214340810051614,Reply,1296214044193325139,2024-10-16T20:53:01.347+00:00,matt_1989_,Matt Sally,1275554237870247947,assets\2-ADBB4.png,Oh ye I totally get that! and it’s annoying because she has to do so much in so little time
1296666879519227915,Default,,2024-10-18T02:51:14.983+00:00,alftt_itp,winterflower,704561585728782347,assets\3-FB033.png,"Hey if I’m in NYC and coming to PA to knock on doors, should I bring my own food and drink?"
1296670980860543018,Reply,1296666879519227915,2024-10-18T03:07:32.819+00:00,chase035208,Chase (Email Mod) (PA),1287188453510877276,assets\fd38279b3c3bab9498c3cbe27933100f-D5336.png,"Hi! If you signed up for a particular canvassing/carpooling event, you should reach out to the event organizer or there should be a contact organization button. You can find more details in your confirmation email if you signed up via Mobilize. That would be the best way to get the best answers about your trip! I'm so glad you are going to be in the fight here with us! 🙂"
1296674122100641794,Reply,1295796432330162297,2024-10-18T03:20:01.749+00:00,nickalbares,Nick Albares,1274581699325591622,assets\f411f7d1b63502b8cb7512b51b25ec43-A815C.png,https://events.democrats.org/event/627054/
1296813373945679933,Default,,2024-10-18T12:33:21.976+00:00,apfee2024_81383,howdyfriends (KY),1274293080794595339,assets\eb95501477beed1d0f8fde71864b6435-9F719.png,"PGH was the top market for KH's Fox appearance, per https://www.youtube.com/watch?v=63ZsqnXrBFs"
1296826748469772350,Default,,2024-10-18T13:26:30.711+00:00,king_echo,Max O. (PA),345034937981992961,assets\bb2150e4103ea2b0af2accc77bfc0b43-814E0.png,Just as we were #1 in watching Kamala's debate! Pittsburgh is very engaged in this election and it's been great to see
1296835322453168158,Default,,2024-10-18T14:00:34.908+00:00,nieta0412,"Nieta G, MA (Call MOD)",1266164208928686110,assets\c82b3fa769ed6e6ffdea579381ed5f5c-A9936.png,So last night at at Swing State Swing by the Bulwark in Philadelphia. The energy was off the chain for VP Harris. They think Harris is going to win PA but we were reminded at the event last night not to take foot off the gas.
1296855751049871391,Default,,2024-10-18T15:21:45.465+00:00,gsew289290,gsew28,887399894799745127,assets\5-E9BDB.png,"i was wondering how to sign up for in person volunteering (poll watching, GOTV assistance etc) on actual election day? i will have access to a car"
1296856597355561092,Reply,1296855751049871391,2024-10-18T15:25:07.24+00:00,kimmai,Kimmai • Mod,381286854059884545,assets\2b7bae57ddbd0d84b7da8969f39cb4e7-1F88B.png,I found this resource if you are interested in becoming a poll worker in PA: https://www.pa.gov/en/services/vote/apply-to-become-an-election-poll-worker.html
1296856864830652456,Reply,1296856597355561092,2024-10-18T15:26:11.011+00:00,gsew289290,gsew28,887399894799745127,assets\5-E9BDB.png,thank you! unfortunately i am not registered to vote in PA so i don't think i can be an official poll worker with the state
1296857529040769105,Reply,1296856864830652456,2024-10-18T15:28:49.371+00:00,chase035208,Chase (Email Mod) (PA),1287188453510877276,assets\fd38279b3c3bab9498c3cbe27933100f-D5336.png,We would love to have you join this fight and be a part of our Voter Protection team as a volunteer here: https://forms.monday.com/forms/19c091ab89714b750b6ecd68e92ba533?r=use1
1296865549476696074,Default,,2024-10-18T16:00:41.592+00:00,apfee2024_81383,howdyfriends (KY),1274293080794595339,assets\eb95501477beed1d0f8fde71864b6435-9F719.png,FYI 😠  https://www.reddit.com/r/Pennsylvania/comments/1g6jnct/wow_trump_pretends_to_be_kamala_in_latest_scam/
1296869249922367529,Default,,2024-10-18T16:15:23.847+00:00,gabriellelynn_4444,Gabrielle Lynn [HFP Staff],1280619651029798924,assets\240de4e960e8591f3136c93fbf92c244-59538.png,New Pennsylvania content just dropped in Reach! Check out [these new graphics on rural investment in the state](<https://app.reach.vote/library/gallery/78e680c8-93f8-4a5d-a974-34774087590d?campaign=democrats>) <:happysun1:1270566006590541896>
1296908232882913334,Default,,2024-10-18T18:50:18.109+00:00,apfee2024_81383,howdyfriends (KY),1274293080794595339,assets\eb95501477beed1d0f8fde71864b6435-9F719.png,https://www.reddit.com/r/Pennsylvania/comments/1g6le3l/a_beautiful_kamala_mural_in_stenton_area_of_philly/
1296915594788081674,Default,,2024-10-18T19:19:33.324+00:00,meanderingstone6495,Autumn S [AR]🤘• Lead Mod/OE Mod,936622618293968958,assets\af45a372ba919e7bac10686b43e799f1-BDEE3.png,"<:eyes:1252803301137842251>  Looking for more ways to get involved and get out the vote? **Join us Monday through Saturday for our GOTV Power Hours**, where you'll learn everything you need to know to reach out to your friends, family, and online communities and make sure they get out the vote! 🗳️ Sign up HERE: https://txt.democrats.org/GOTVHour 

<:retweet:1278893511780864010> Check out our priority content from Reach to share HERE: https://share.kamalaharris.com/toolkit/Discord-2f08"
1297023025388064858,Default,,2024-10-19T02:26:26.775+00:00,emh8025,Erin Harris [NJ],1103001092654112779,assets\0-EB806.png,"Does anyone have information about a campaign event in Pittsburgh on Monday with disabled entrepreneurs? I saw it mentioned in this article, but aside from the single line, I haven't found any info about it anywhere. I'd especially like to know if it's being livestreamed and/or recorded. https://www.nbc4i.com/news/politics/ap-politics/ap-voters-with-disabilities-are-feeling-ignored-by-presidential-candidates/"
1297099855331590154,Reply,1297023025388064858,2024-10-19T07:31:44.461+00:00,nieta0412,"Nieta G, MA (Call MOD)",1266164208928686110,assets\c82b3fa769ed6e6ffdea579381ed5f5c-A9936.png,It happened this past Monday. It wasn't recorded.
1297215781330878496,Default,,2024-10-19T15:12:23.373+00:00,apfee2024_81383,howdyfriends (KY),1274293080794595339,assets\eb95501477beed1d0f8fde71864b6435-9F719.png,for the swifties https://www.reddit.com/r/WhitePeopleTwitter/comments/1g78szf/all_gas_no_brakes/
1297294876710408344,Reply,1297215781330878496,2024-10-19T20:26:41.181+00:00,jack.246012,Jack (KC),1276396030375624789,assets\1b105b23ea580bad6169b556d3b7ebc4-4403D.png,We still need to keep going as if she didn’t endorse us
1297342066476454022,Reply,1296666879519227915,2024-10-19T23:34:12.098+00:00,mairtastic,Almeria Zan (PA),488886375656194050,assets\d4852b676e00618307aff2db50d07d56-6A609.png,"I was doing canvassing training today in PA with a busload of people coming in from NY. We had A TON of food to give to people, but I think that was a fluke. It was from a group that wasn't comfortable canvassing or phone banking so they donated sandwiches and snacks. You could always email the person on the contact form on the confirmation email."
1297342356030226514,Reply,1297342066476454022,2024-10-19T23:35:21.133+00:00,alftt_itp,winterflower,704561585728782347,assets\3-FB033.png,Ha I wonder if we met. Yes I was surprised and grateful for the food!
1297343495136084039,Reply,1297342356030226514,2024-10-19T23:39:52.717+00:00,mairtastic,Almeria Zan (PA),488886375656194050,assets\d4852b676e00618307aff2db50d07d56-6A609.png,"It's a fantastic feeling of community, knowing how many people are coming together from all over the country to make this happen. This is how elections are won!!!<:KamalaPoster:1269134616502206577>"
1297344459465556081,Reply,1297240041483010110,2024-10-19T23:43:42.631+00:00,mairtastic,Almeria Zan (PA),488886375656194050,assets\d4852b676e00618307aff2db50d07d56-6A609.png,"If you go to events.democrats.org you can search for ""carpool"" and ""bus."" I would also just ask as you have here in both PA and NY rooms to see if there are smaller groups driving down that haven't formally made it an event. https://events.democrats.org/?q=carpool    https://events.democrats.org/?q=bus"
1297346107759923292,Default,,2024-10-19T23:50:15.615+00:00,matt_1989_,Matt Sally,1275554237870247947,assets\2-ADBB4.png,Here goes for bus rides tomorrow into PA https://events.democrats.org/event/711959/?utm_source=hfp_w_an_findeventmodule&source=hfp_w_go_20241019&utm_campaign=hfp_w_go_mb_do_vol_vrec_20241019&utm_medium=go_kh_20241019&ref=go_kh_20241019&utm_term=go_kh_20241019_priority
1297346204778106881,Default,,2024-10-19T23:50:38.746+00:00,matt_1989_,Matt Sally,1275554237870247947,assets\2-ADBB4.png,https://events.democrats.org/event/702683/?utm_source=hfp_w_an_findeventmodule&source=hfp_w_go_20241019&utm_campaign=hfp_w_go_mb_do_vol_vrec_20241019&utm_medium=go_kh_20241019&ref=go_kh_20241019&utm_term=go_kh_20241019_pinned
1297346243273556068,Default,,2024-10-19T23:50:47.924+00:00,matt_1989_,Matt Sally,1275554237870247947,assets\2-ADBB4.png,They also have for next weekend
