id,type,ref_to,timestamp,author_name,author_nickname,author_id,author_avatar_url,content
1291166330388484179,Default,,2024-10-02T22:34:01.875+00:00,ksiegel4581,Ksiegel,681830358274146340,assets\2-ADBB4.png,The script includes the PA Senate race but that didn't come up in the training- are we talking to voters about that or no?
1291166769297227867,Default,,2024-10-02T22:35:46.519+00:00,denise.ward,Denise Ward [CO] [Call MOD],1277408157664284795,assets\43ec2b9e8ddf26e3072b9feb4516a5fd-3D55A.png,Are you in the Zoom Phone Bank for PA?  That script does include an ask if they are voting for Bob Casey.
1291166879561551975,Default,,2024-10-02T22:36:12.808+00:00,ksiegel4581,Ksiegel,681830358274146340,assets\2-ADBB4.png,"Yes, the Out for Harris NJ bank"
1291167482559725642,Default,,2024-10-02T22:38:36.574+00:00,denise.ward,Denise Ward [CO] [Call MOD],1277408157664284795,assets\43ec2b9e8ddf26e3072b9feb4516a5fd-3D55A.png,"Ok, yes I see that particular event.  I do not have the script for that but I suspect if you are calling into PA tonight there is an ask about their voting intention for Senate.  This would be consistent with similar language we are using in DNC phone banks for PA."
1291167883916738561,Default,,2024-10-02T22:40:12.265+00:00,lovelightphoto_86652,Alan Z (CA) [Call Mod],1156958211065270323,assets\8ef62717b6ae0c24ebb16d1b0ea4b07e-DDC39.png,And... you can always preview the script to get familiar with the questions/issues we are talking about.
1291168419491614720,Default,,2024-10-02T22:42:19.956+00:00,ksiegel4581,Ksiegel,681830358274146340,assets\2-ADBB4.png,"I forgot the script would run along the dialer with me, lol. Sorry about that. Got one strong Harris/Casey so far."
1291168594549280878,Reply,1291168419491614720,2024-10-02T22:43:01.693+00:00,denise.ward,Denise Ward [CO] [Call MOD],1277408157664284795,assets\43ec2b9e8ddf26e3072b9feb4516a5fd-3D55A.png,YAY that is great.  Sometimes I get talking and forget to move the script along too!
