id,type,ref_to,timestamp,author_name,author_nickname,author_id,author_avatar_url,content
1273271808153620511,Default,,2024-08-14T13:27:35.31+00:00,ginaturone,Gina Turone,779382569534881824,assets\90595ea07dd349adc8ba22cb8d2f8a14-00AFD.png,How does one find about volunteering at upcoming rallies?
1273287065731076106,Default,,2024-08-14T14:28:13+00:00,demtortilla_60949,demtortilla,1242248892804763712,assets\a_c1a2d0423471e6287ce2d2c69bf8abe5-C5FA2.gif,Hi Gina - if you have filled out the volunteer form: https://web.kamalaharris.com/forms/take-action-for-kamala-harris/?source=web_an_takeactionpage_20240726
1273287135633604703,Default,,2024-08-14T14:28:29.666+00:00,demtortilla_60949,demtortilla,1242248892804763712,assets\a_c1a2d0423471e6287ce2d2c69bf8abe5-C5FA2.gif,the team may reach out if they need folks in your area to help with an event.
1273287188100022334,Default,,2024-08-14T14:28:42.175+00:00,demtortilla_60949,demtortilla,1242248892804763712,assets\a_c1a2d0423471e6287ce2d2c69bf8abe5-C5FA2.gif,I unfortunately don't have more info here.
1273451456929726506,Reply,1273287065731076106,2024-08-15T01:21:26.916+00:00,ginaturone,Gina Turone,779382569534881824,assets\90595ea07dd349adc8ba22cb8d2f8a14-00AFD.png,Thank you very much!
