id,type,ref_to,timestamp,author_name,author_nickname,author_id,author_avatar_url,content
1288964922235162675,Reply,1288833209156501585,2024-09-26T20:46:25.271+00:00,girasol.glory,Jess L (SATX) [Mod],936359743457464391,assets\a52faf4ea91846a78ac440fcdc876153-E0FED.png,"Ahh, sorry your sign-ups got jammed like that! Hopefully that's not an issue this time, but in that case, an extra step really is understandable. Best of luck!"
1289001767044120606,Reply,1286380620137889793,2024-09-26T23:12:49.758+00:00,dianne_atl,Dianne,1277375518332813513,assets\8569adcbd36c70a7578c017bf5604ea5-9ECF8.png,"<@1250880260338094331>  My debate watch party just got approved in GA. Will I automatically
get the follow up email with instructions and swag order form, or do I have to make a special request somewhere (like, say, here)?"
1289007012407152660,Reply,1289001767044120606,2024-09-26T23:33:40.35+00:00,jean9_28218_79932,Jeannine M • Lead Mod,1266879741785538682,assets\54ff5e8dfab835d878a961f9f7b7d161-6C0EE.png,"Generally, if your party is approved, you will get an email automatically!"
1289378984861372452,Default,,2024-09-28T00:11:45.494+00:00,dianne_atl,Dianne,1277375518332813513,assets\8569adcbd36c70a7578c017bf5604ea5-9ECF8.png,"Hi all! Now that my party has been approved I want to have a punny menu, but my imagination is limited. So far I have Kamalamari, “Trump is a chicken” fingers, and to drink rum and coach cocktails and Kama-lemonade. Any creative ideas? Even ChatGPT has failed me 🤣"
1289381649116692551,Default,,2024-09-28T00:22:20.702+00:00,meanderingstone6495,Autumn S [AR]🤘• Lead Mod/OE Mod,936622618293968958,assets\af45a372ba919e7bac10686b43e799f1-BDEE3.png,Prosecutor Punch?
1289381850724438120,Default,,2024-09-28T00:23:08.769+00:00,meanderingstone6495,Autumn S [AR]🤘• Lead Mod/OE Mod,936622618293968958,assets\af45a372ba919e7bac10686b43e799f1-BDEE3.png,Or Presidential Punch?
1289382031809318952,Default,,2024-09-28T00:23:51.943+00:00,meanderingstone6495,Autumn S [AR]🤘• Lead Mod/OE Mod,936622618293968958,assets\af45a372ba919e7bac10686b43e799f1-BDEE3.png,I'm speaking spaghetti?
1289393690220957747,Default,,2024-09-28T01:10:11.525+00:00,davidnoble_27817,David Noble,1288627708754001991,assets\0-EB806.png,"Well, I don't know about menu items, but I've got an idea on dinner music: The Blue Danube Walz."
1289401184439894038,Default,,2024-09-28T01:39:58.286+00:00,jean9_28218_79932,Jeannine M • Lead Mod,1266879741785538682,assets\54ff5e8dfab835d878a961f9f7b7d161-6C0EE.png,"Love these party ideas, team! Hope you have a great event, <@1277375518332813513>!"
1289405667559477364,Reply,1289378984861372452,2024-09-28T01:57:47.145+00:00,iknowrebekah,Rebekah,394759023251161088,assets\a2a24481e848fa18ac39b643d2b65724-B9F34.png,Mountain Dew-Something Sodas
1289407736018243635,Default,,2024-09-28T02:06:00.304+00:00,iknowrebekah,Rebekah,394759023251161088,assets\a2a24481e848fa18ac39b643d2b65724-B9F34.png,Corn in the USA
1289408436014026753,Default,,2024-09-28T02:08:47.196+00:00,iknowrebekah,Rebekah,394759023251161088,assets\a2a24481e848fa18ac39b643d2b65724-B9F34.png,There's A Lot At Steak and Eggs
1289423956507492443,Reply,1289405667559477364,2024-09-28T03:10:27.57+00:00,jayrio76,Jay E  (TX)  OE Mod,782870341445353522,assets\41ef520387924aa4413513eda28784df-34D82.png,Love Mountain Dew - Wish it was not associated to JD Vance 😉
1289425738818261053,Reply,1289423956507492443,2024-09-28T03:17:32.506+00:00,iknowrebekah,Rebekah,394759023251161088,assets\a2a24481e848fa18ac39b643d2b65724-B9F34.png,"Oh, I didn't know the relationship."
1289445104603369522,Default,,2024-09-28T04:34:29.669+00:00,dianne_atl,Dianne,1277375518332813513,assets\8569adcbd36c70a7578c017bf5604ea5-9ECF8.png,Haha! I love these. And of course on the Vance side of the table I have to have mini hot DOGS and CATSup!!
1289445458036654125,ThreadCreated,,2024-09-28T04:35:53.934+00:00,jayrio76,Jay E  (TX)  OE Mod,782870341445353522,assets\41ef520387924aa4413513eda28784df-34D82.png,Started a thread.
1289672461494780047,Reply,1289381850724438120,2024-09-28T19:37:55.776+00:00,girasol.glory,Jess L (SATX) [Mod],936359743457464391,assets\a52faf4ea91846a78ac440fcdc876153-E0FED.png,I'm LOVING all these ideas! How creative!! I'm voting Presidential Punch (bc we want Kamala to win by a TKO by election day)!
1290061990404034580,Reply,1286741367850008596,2024-09-29T21:25:46.705+00:00,dharvey83,Dee,1225260626037706915,assets\5-E9BDB.png,Has anyone answered this question?
1290277792327532664,Default,,2024-09-30T11:43:17.893+00:00,maritza02805,Maritza 💙🌊🗳,1278224164985245757,assets\9911452990d03047f20b627a4bb14ec9-93FBD.png,Trump is all lies!!
1290373176345497631,Default,,2024-09-30T18:02:19.215+00:00,tonya0132,Tonya,1154560669690122400,assets\6d78cb9ef3ebce6c490ca314b4f033a2-EF718.png,Any bingo cards for the VP debate?
1290390384492417044,Default,,2024-09-30T19:10:41.957+00:00,sarahjane_19621,Sarah Jane [HQ Staff],1250880260338094331,assets\929edfc72a5aaaff243d98a3630a887d-031C7.png,"Oh my, I have immediately gone and blocked them but also, I have been trying to understand how and why your parties specifically keep getting targeted with this stuff and also a way for you to be able to block them permanently as I can."
1290396179623972866,Reply,1290390384492417044,2024-09-30T19:33:43.624+00:00,sarahjane_19621,Sarah Jane [HQ Staff],1250880260338094331,assets\929edfc72a5aaaff243d98a3630a887d-031C7.png,"<@350058078277992450> I'm actually going to delete that picture that you just posted, but that person has been removed and it's definitly a longer thing I've been looking into extensively"
1290488094231101562,Reply,1290373176345497631,2024-10-01T01:38:57.774+00:00,starkittynmom,Jen Medeiros [CA] • [Lead Mod],1276944250491113656,assets\a_2aba4b7f19fcab5fe5391fcdb73d735d-D670A.gif,<@1154560669690122400> https://store.kamalaharris.com/digital-downloads/
1290629902676000798,Reply,1290396179623972866,2024-10-01T11:02:27.542+00:00,cherylaoife,Cheryl Johnson (CA),350058078277992450,assets\24cedbb77901a5031fe40b2b54e95441-B39C2.png,Thank you for doing that. No worries. I think the targeting comes with the territory - just people who think it's funny or something.
1290650327493640283,Default,,2024-10-01T12:23:37.198+00:00,rachelg.0278,Rachel G.,979151088018128946,assets\1628fc11e7961d85181295493426b775-D0340.png,Good morning any trivia or games for the watch parties tonight?
1290662466489024642,Reply,1290650327493640283,2024-10-01T13:11:51.36+00:00,girasol.glory,Jess L (SATX) [Mod],936359743457464391,assets\a52faf4ea91846a78ac440fcdc876153-E0FED.png,"<@979151088018128946> Here's the official bingo card: https://store.kamalaharris.com/digital-downloads/

Last time NPR and other sites also made their own games, you might check there - or create your own!"
1290662867686916138,Reply,1290662466489024642,2024-10-01T13:13:27.013+00:00,cherylaoife,Cheryl Johnson (CA),350058078277992450,assets\24cedbb77901a5031fe40b2b54e95441-B39C2.png,Here are a couple more from SF Chronicle:
1290675830095220878,Default,,2024-10-01T14:04:57.492+00:00,oller0288,Oller,1257077807574552588,assets\11f5c1e7ec84d45ec933537315510cf6-C7ADC.png,"Hey, anybody that can send me some hashtags for tonight’s VP watch party I don’t have time to look through emails or discord to find them. Can someone post here for me?"
1290704626773131307,Reply,1290675830095220878,2024-10-01T15:59:23.155+00:00,girasol.glory,Jess L (SATX) [Mod],936359743457464391,assets\a52faf4ea91846a78ac440fcdc876153-E0FED.png,"<@1257077807574552588> - As of 12pm ET: Looks like we don't have anything official shared yet here or on Reach, scanning through socials it seems any hashtags are only just gathering steam... (trending seems to be things like President Jimmy Carter's 100th bday, start of spooky season, etc.)

From looking at Twitter/Insta/TikTok/Threads/Bluesky:
It looks like [# vpdebate / vpdebate2024] + related tags like [vp / politics / etc.] are being used."
1290746614620754094,Default,,2024-10-01T18:46:13.838+00:00,sarahjane_19621,Sarah Jane [HQ Staff],1250880260338094331,assets\929edfc72a5aaaff243d98a3630a887d-031C7.png,"Hi @here I hope you all are as excited for tonight as we are here at HQ!! I will be sending out an email shortly with the best place to stream it online and also the bingo cards, though I am very glad to see they have already been circulated here already! Please let me know if you need me to make any last minute changes to your events, and if you've already asked me know that it will be done in the next little bit! My final ask for tonight: PLEASE SEND ME ALL PICTURES!!! Send them to me as they come in at smerritt@2024victory.com"
1290752955988840478,Default,,2024-10-01T19:11:25.738+00:00,ms.nikkymouse,NikkyMouse🐭,1175529330797969488,assets\eeb9da804f377b199be37b0e39058824-58FB7.png,"<@&1266883962727432304>   Hi so we registered for a VP Debate watch party the day I got the email. On 9/24 I got an email that said this..
“Thank you so much for requesting to host a Debate Watch party! It looks like you actually signed up via the national link, but as a Pennsylvanian, it would actually be so very appreciated if you could sign up for our state specific link.
Not to worry: we are coordinating with our national partners at the DNC and there won't be an expectation for you to host 2 parties or duplicate your efforts. 
Please sign up here at your earliest convenience, and don't hesitate to reach out if you have any questions! 
Apologies for any inconvenience. “
 
I replied telling them that even though I live in GA, my co host lives in VT and we are hosting it on TikTok like we did the 4 nights of the DNC & the Pres Debate. I didn’t hear anything until last week when they asked us to fill out the form for hosting (to get the campaign swag) I filled out 2 (1 for each of us) and the next day went to make a post with the link to register and it’s GONE! It’s now the day of the debate and I have no link and still can’t find it. Should we just run it on our own?
Thanks"
1290753716823130284,Default,,2024-10-01T19:14:27.135+00:00,tagnz,alex,804246471293534260,assets\6c06f399fea9fe1e50ca3666cc34fe91-16AF8.png,ok
1290762170799489075,Default,,2024-10-01T19:48:02.72+00:00,hardertobreathe4268,Beeb Ashcroft (OR),855244588092620800,assets\85e5c9d4f68188957ac20c3a71a4de16-02474.png,"Hi all! I shared this resource during the last debate, and I wanted to let everyone know that DPAN.tv will be streaming the Vice Presidential Debate as well, with closed captions and ASL interpretation. This is what I will be streaming for my guests during my virtual watch party tonight. 🙂 Link: https://dpan.tv/"
1290774692466266112,Default,,2024-10-01T20:37:48.118+00:00,iamnomanthony,Micquie A [CA],1270181017558192202,assets\f1c6f06bb7760aef468cbf2bbb8eb66e-29D96.png,"Hello, can a mod please help me close my event to more RSVPs? I know the headcount looks low (attendees are bringing people), but there’s someone who’s gotten ahold of the signup link who I don’t want to be able to RSVP and get my address. Thanks so much! Here’s my event: https://mobilize.us/s/Ah980B"
1290775624289489020,Default,,2024-10-01T20:41:30.282+00:00,franceshaydock_20619,Frances Haydock (HFP HQ!),1257469301435400238,assets\8286d5b1308e7b3d80a3523e4ec50548-C029D.png,<@1266879741785538682> can you help?
1290775945220849664,Reply,1290774692466266112,2024-10-01T20:42:46.798+00:00,sarahjane_19621,Sarah Jane [HQ Staff],1250880260338094331,assets\929edfc72a5aaaff243d98a3630a887d-031C7.png,I’m on it!
1290777002948821124,Reply,1290774692466266112,2024-10-01T20:46:58.98+00:00,sarahjane_19621,Sarah Jane [HQ Staff],1250880260338094331,assets\929edfc72a5aaaff243d98a3630a887d-031C7.png,"Done! Capped it at 3 people, let me know if you need anything else! ☺️"
1290779518683840554,Reply,1290777002948821124,2024-10-01T20:56:58.778+00:00,iamnomanthony,Micquie A [CA],1270181017558192202,assets\f1c6f06bb7760aef468cbf2bbb8eb66e-29D96.png,"Thank you so much!!! P.s. I just got the swag and WOW these banners RULE. I’ve loved all the banners for all my events (I cried when I saw the FREEDOM ones), but I think lots of people will flip over these. I’m going to share with my local Dems chapter!!!! Thank you thank you thank you!! I promise pictures!!!"
1290779835387347000,Default,,2024-10-01T20:58:14.286+00:00,sarahjane_19621,Sarah Jane [HQ Staff],1250880260338094331,assets\929edfc72a5aaaff243d98a3630a887d-031C7.png,Ahhhh please take pictures and send me!! At smerritt@2024victory.com I haven’t seen any of the swag yet from this time around!!
1290787089465610322,Reply,1290775624289489020,2024-10-01T21:27:03.793+00:00,jean9_28218_79932,Jeannine M • Lead Mod,1266879741785538682,assets\54ff5e8dfab835d878a961f9f7b7d161-6C0EE.png,"So sorry. Was actually away from keyboard and out on a run. I see Sarah Jane got it, it sounds like. Or was there something else, <@1257469301435400238>?"
1290788421840666635,Reply,1290787089465610322,2024-10-01T21:32:21.456+00:00,franceshaydock_20619,Frances Haydock (HFP HQ!),1257469301435400238,assets\8286d5b1308e7b3d80a3523e4ec50548-C029D.png,Nope I think we are good
1290808306973016076,Reply,1290779835387347000,2024-10-01T22:51:22.441+00:00,ms.nikkymouse,NikkyMouse🐭,1175529330797969488,assets\eeb9da804f377b199be37b0e39058824-58FB7.png,Was anyone able to find out why ours isn’t showing up anymore?
1290830859817062443,Default,,2024-10-02T00:20:59.458+00:00,adriennemccue,Adrienne McCue [Chicago],1273803067581530246,assets\46fa2cff2d2745fe51d9e74d3ca80089-FE4EA.png,"OMG, 500 folks signed up over 100 RSVP! I'm one person in a sea of folks I'm hoping are Harris/Walz bros! 🤣"
1290834395623587872,Reply,1290808306973016076,2024-10-02T00:35:02.46+00:00,sarahjane_19621,Sarah Jane [HQ Staff],1250880260338094331,assets\929edfc72a5aaaff243d98a3630a887d-031C7.png,"I'm so sorry Nikky, I don't know how that happened once you were handed off to the battleground team."
1290834572560564267,Default,,2024-10-02T00:35:44.645+00:00,sarahjane_19621,Sarah Jane [HQ Staff],1250880260338094331,assets\929edfc72a5aaaff243d98a3630a887d-031C7.png,@here anyone have any pictures to send yet?! I'm so excited to see!!! 😍 😍  please send to smerritt@2024victory.com
1290836251829735465,Default,,2024-10-02T00:42:25.014+00:00,girasol.glory,Jess L (SATX) [Mod],936359743457464391,assets\a52faf4ea91846a78ac440fcdc876153-E0FED.png,Haha <@1250880260338094331> my phone is about maxed out on memory but I'll take some just for you - and make sure Ian & the rest send some your way!
1290836326303797312,Default,,2024-10-02T00:42:42.77+00:00,sarahjane_19621,Sarah Jane [HQ Staff],1250880260338094331,assets\929edfc72a5aaaff243d98a3630a887d-031C7.png,Please please do!!
1290836604843462686,Default,,2024-10-02T00:43:49.179+00:00,girasol.glory,Jess L (SATX) [Mod],936359743457464391,assets\a52faf4ea91846a78ac440fcdc876153-E0FED.png,
1290837990305697893,Default,,2024-10-02T00:49:19.499+00:00,_phineasgage,phineas gage,330179392284262411,assets\bc85d6e0c1b5b9b4634f44ffced90b65-39C2E.png,We're hosting a discord watch party. We have a lot of people today!
1290842002509926503,Default,,2024-10-02T01:05:16.083+00:00,girasol.glory,Jess L (SATX) [Mod],936359743457464391,assets\a52faf4ea91846a78ac440fcdc876153-E0FED.png,We have 65 down in San Antonio <#1268378299428634727> ! Let's get photos and screenshots for our awesome <@1250880260338094331> !! 🎉
1290842622834774036,Default,,2024-10-02T01:07:43.98+00:00,iamnomanthony,Micquie A [CA],1270181017558192202,assets\f1c6f06bb7760aef468cbf2bbb8eb66e-29D96.png,"Not sure if other people figured it out already, but the live link in the email ""The VP Debate is TONIGHT!!"" isn't showing the debate...? I switched to CNN on Youtube"
1290844624956686461,Reply,1290842622834774036,2024-10-02T01:15:41.323+00:00,sarahjane_19621,Sarah Jane [HQ Staff],1250880260338094331,assets\929edfc72a5aaaff243d98a3630a887d-031C7.png,"Here is another livestream for anyone else who is looking for one, so sorry about that https://www.youtube.com/watch?v=-bIjAK_rVcs"
1291000407845244959,Default,,2024-10-02T11:34:42.858+00:00,cherylaoife,Cheryl Johnson (CA),350058078277992450,assets\24cedbb77901a5031fe40b2b54e95441-B39C2.png,"Just reporting in, the morning after. Small turnout for our Zoom Watch Party but great conversations and discussions. It was a great group and we made some new friends! <:blueheart:1252803082849488956>"
1291032693835960350,Reply,1291000407845244959,2024-10-02T13:43:00.438+00:00,jean9_28218_79932,Jeannine M • Lead Mod,1266879741785538682,assets\54ff5e8dfab835d878a961f9f7b7d161-6C0EE.png,"Thank you so much, <@350058078277992450>! Small but meaningful conversations can be great. Thank you for updating and for being a host!"
1292577079061381183,Default,,2024-10-06T19:59:50.569+00:00,ezbwmama,ezbwmama,1125895985688739943,assets\8bb151f6d0ac9508214f6598e0896a7b-14848.png,We watched the VP debate at Education Minnesota along with the Presidents of the 2 National Teacher’s Unions -AFT & NEA. It was so much fun watching it with so many of Governor Walz and First Lady of MN Walz former colleagues in the MN teachers union!!
