id,type,ref_to,timestamp,author_name,author_nickname,author_id,author_avatar_url,content
1282369322370601040,Default,,2024-09-08T15:57:51.723+00:00,catherinedunlay_24985,Catherine Dunlay,1277659349883555973,assets\1-B2132.png,"Just making sure folks have heard about LaRose's latest directive - He is unhappy that he lost a court case and needs to allow more people to return ballots for folks with disability, so he has directed that no one may put another person's ballot in a drop box.  Per this directive, if you are dropping of the ballot of a family member or disable person, you need to go inside the board of elections and sign a form affirming that you are permitted to submit the ballot for them."
1283178895486615623,Reply,1282369322370601040,2024-09-10T21:34:48.995+00:00,ann0314,Ann (OH),352957356042092546,assets\1ae0d8f99d33a3ca6e94411ac49b6e7f-B8A0A.png,Do you have a link for that?
1283239514009112667,Default,,2024-09-11T01:35:41.577+00:00,ann0314,Ann (OH),352957356042092546,assets\1ae0d8f99d33a3ca6e94411ac49b6e7f-B8A0A.png,Because it was mentioned in the debate: https://www.springfieldnewssun.com/news/springfield-police-say-no-reports-of-pets-stolen-after-viral-social-media-post/3WSIZQNHQVE4NP4TS5BVHBB2PY/
1283260947271516179,Default,,2024-09-11T03:00:51.665+00:00,nastalje,nab,1127728276345987152,assets\e9cbc75347b263133541062d57bea672-5816A.png,MSNBC talking heads basically speculated he heard about the sensation headline or social media post that matches his narrative without actually fact-checking it that of course the moderator crushed him on with the fact check receipts.
1283297212759146610,Default,,2024-09-11T05:24:58.031+00:00,ann0314,Ann (OH),352957356042092546,assets\1ae0d8f99d33a3ca6e94411ac49b6e7f-B8A0A.png,https://www.washingtonpost.com/politics/2024/09/10/haitian-immigrants-vance-trump-ohio/37539730-6fd4-11ef-ad92-518728118b4a_story.html Adding this too as it’s definitely making the rounds as a spam shock comment here in Ohio and this covers every single detail.
1283302495678107752,Default,,2024-09-11T05:45:57.577+00:00,nastalje,nab,1127728276345987152,assets\e9cbc75347b263133541062d57bea672-5816A.png,"Yeah, read other comments during the debate I think that mentioned Rubio was making this link without bases. Also, the pets being eaten comments are popped on the daily show and other late night comedy show bits. Plus it’s all over memes and the internet."
1283403411647365151,Default,,2024-09-11T12:26:57.819+00:00,nastalje,nab,1127728276345987152,assets\e9cbc75347b263133541062d57bea672-5816A.png,"More news on the Springfield pets being eaten story https://www.nbc4i.com/news/local-news/columbus/strange-columbus-photos-connection-to-claims-about-haitians-in-springfield 
Also https://www.cantonrep.com/story/news/politics/2024/09/10/canton-woman-accused-of-eating-cat-not-haitian-from-springfield-ohio/75157976007/"
1283432065974534274,Default,,2024-09-11T14:20:49.543+00:00,4asphaltangel,255661,1283289708272680963,assets\1cb2f58fff15f7125bbebf69beb614f4-C7D2F.png,"Hello my beautiful blue friends 💙 Oberlin, Ohio here!!"
1283433689107402894,Default,,2024-09-11T14:27:16.528+00:00,ken023897,Ken,1281938935106506784,assets\6c5996770c985bcd6e5b68131ff2ba04-73DCD.png,"Born and raised in Ohio, live in Nebraska. Do not count out Ohio...  I think it may turn a bluer shade of purple."
1283504022375890976,Default,,2024-09-11T19:06:45.286+00:00,davemahaffey,Dave Mahaffey (NY),1283490930787352683,assets\6c5996770c985bcd6e5b68131ff2ba04-C6DCE.png,Hey everyone.  I’m Dave. From NY.  I’ll be in Columbus next week with my wife visiting our son at Ohio St.  while we’re in Ohio we’d like to volunteer / help.  Any idea who we can talk to about it?
1283517416160100354,Default,,2024-09-11T19:59:58.613+00:00,davemahaffey,Dave Mahaffey (NY),1283490930787352683,assets\6c5996770c985bcd6e5b68131ff2ba04-C6DCE.png,Thanks but I’ll be in Columbus.  Different part of state. Not Hamilton County
1283522953853538434,Default,,2024-09-11T20:21:58.902+00:00,meanderingstone6495,Autumn S [AR]🤘• Lead Mod/OE Mod,936622618293968958,assets\af45a372ba919e7bac10686b43e799f1-BDEE3.png,"Omg.. why did I type Cincinnati 

https://www.fcdp.org/contact-us.html"
1283528569573871637,Default,,2024-09-11T20:44:17.794+00:00,davemahaffey,Dave Mahaffey (NY),1283490930787352683,assets\6c5996770c985bcd6e5b68131ff2ba04-C6DCE.png,This is great.  Thanks !
1283657461492088926,Default,,2024-09-12T05:16:28.022+00:00,carb.on,Carolyn • Lead Mod,568257600228032512,assets\28a90c77b5793d80eb62484a43c66748-D8837.png,"Hi <@936622618293968958> we need to be careful with pages like Hamilton County Dem Party. I has a ""contribute"" section which means it isn't aligned with our requirement to follow campaign finance law. You can describe the Hamilton County Dem Party, just leave off the link. TY"
1283657497965756416,Reply,1283516587927801907,2024-09-12T05:16:36.718+00:00,DemCord,DemCord,1242806362195365968,assets\007b625c296385e4ed52038a42c7256d-7649B.png,"**Strict Fundraising Rules (it’s the law):**
We can only fundraise on behalf of: Democratic National Committee, Harris Victory Fund or Harris for President directly. 
We can recruit for ""non-official events"" that are hosted by partner organizations or volunteers in ⁠non-official-events-only. We can recruit into anything that is listed on events.democrats.org or a state democratic party's mobilize.
Rule 3 Note > Relevance: Do not post links to petitions or other calls to action that haven’t been approved by Staff. This forum is not intended for debates. Additionally, do not attempt to raise funds or share fundraising links for any entity besides the Democratic National Committee. Using this server to raise funds for yourself, another candidate, or another organization violates campaign finance law and is strictly prohibited. Anyone who violates the rules is subject to removal or time out.
When in doubt, ask @Community Moderator."
1283756004906897439,Reply,1283657461492088926,2024-09-12T11:48:02.603+00:00,meanderingstone6495,Autumn S [AR]🤘• Lead Mod/OE Mod,936622618293968958,assets\af45a372ba919e7bac10686b43e799f1-BDEE3.png,"Ahh ok. Thank you!!

Just goes to show you why mods need mods too 😂"
1283847502566658232,Default,,2024-09-12T17:51:37.345+00:00,trumansleeps,Michael Pelaez | FL,389839010576465936,assets\3a91c3446fca9803ffb1d856364145a2-A8603.png,Let's get a volunteer wave going! Repond on a thread with how many events you signed up to! Let's make the goal 5+  https://events.democrats.org/?country=US&state=OH
1284009998606663752,Reply,1283303797963358259,2024-09-13T04:37:19.42+00:00,DemCord,DemCord,1242806362195365968,assets\007b625c296385e4ed52038a42c7256d-7649B.png,"This meme doesn't fit the spirit of the campaign.
It has been removed by Ms Lucy Purr, feline."
1284238387309711462,Default,,2024-09-13T19:44:51.53+00:00,ann0314,Ann (OH),352957356042092546,assets\1ae0d8f99d33a3ca6e94411ac49b6e7f-B8A0A.png,"On the dropbox rules, there is this article: https://www.nbc4i.com/news/your-local-election-hq/ohio-secretary-of-state-changes-ballot-drop-box-rules-calls-for-their-elimination/"
1284238666989961357,Default,,2024-09-13T19:45:58.211+00:00,ann0314,Ann (OH),352957356042092546,assets\1ae0d8f99d33a3ca6e94411ac49b6e7f-B8A0A.png,"In it, it does link the PDF to the new directive (a couple paragraphs down) Please be sure to let everyone know of the potential changes so they don't get their votes invalidated somehow 😦"
1284687842819313676,Reply,1281043031075721358,2024-09-15T01:30:50.074+00:00,vote4pedro3665,Vote4Pedro,558297669190025261,assets\2-ADBB4.png,<@697972782801354804> I knock doors in Summit county. It does have the biggest impact potential.  I'd suggest seeking out your local State rep candidate and helping them knock doors.  I'm in OH-31.
1284688938816110685,Reply,1283847502566658232,2024-09-15T01:35:11.38+00:00,vote4pedro3665,Vote4Pedro,558297669190025261,assets\2-ADBB4.png,"Just volunteered today for...

https://events.democrats.org/event/691521/"
1284963821315690577,Default,,2024-09-15T19:47:28.475+00:00,agutmann3110,Anna Gutmann (OH),1275940050772951051,assets\6c5996770c985bcd6e5b68131ff2ba04-4DF7B.png,"Hello, all. There are rumors going around that Vance and Trump plan on showing up in Springfield now (no timeline mentioned). This may or may not be true, but if you live in that area, please prepare for the chaos they’ll bring there, and make safety a priority."
1285060171063623781,Default,,2024-09-16T02:10:20.045+00:00,rubysunrise24,"Ruby Rose (AZ, she/her)",1283487825383391274,assets\952fd88f102f443cbebad5b7219e17be-3DEB6.png,"I wont post the link (unless a mod says its okay), but the Haitian Community Help and Support Center needs resources (money) to help with all of the threats. I donated yesterday, and if you are so inclined, they could use the help."
1285112118068248598,Default,,2024-09-16T05:36:45.176+00:00,starkittynmom,Jennifer • [Lead Mod],1276944250491113656,assets\a_2aba4b7f19fcab5fe5391fcdb73d735d-D670A.gif,"Thanks for the info <@1283487825383391274> - we can't have links, but I will also go look for the group and support."
1285371559632044102,Default,,2024-09-16T22:47:40.865+00:00,shelb724,Shellie Levine Parker,1170136212279918633,assets\8569adcbd36c70a7578c017bf5604ea5-1FF44.png,Hi this is a sheriff in Portage County who wants people to report signs for Harris.  He has a Facebook page and I have reported him.  I have the Fb post but don’t know if you want me to share
1285371707871203410,Default,,2024-09-16T22:48:16.208+00:00,shelb724,Shellie Levine Parker,1170136212279918633,assets\8569adcbd36c70a7578c017bf5604ea5-1FF44.png,I meant there is a sheriff in Portage county
1285372272068132885,Default,,2024-09-16T22:50:30.723+00:00,shelb724,Shellie Levine Parker,1170136212279918633,assets\8569adcbd36c70a7578c017bf5604ea5-1FF44.png,His name is Sheriff Bruce Zuchowski
1285406514776903710,Reply,1285371559632044102,2024-09-17T01:06:34.821+00:00,agutmann3110,Anna Gutmann (OH),1275940050772951051,assets\6c5996770c985bcd6e5b68131ff2ba04-4DF7B.png,"I saw that too, and filed a complaint with the dept of justice! Thank you for posting here so others can do the same"
1285406809171034184,Default,,2024-09-17T01:07:45.01+00:00,shelb724,Shellie Levine Parker,1170136212279918633,assets\8569adcbd36c70a7578c017bf5604ea5-1FF44.png,There were at least two news stories from Cleveland Tv plus the Akron Beacon Journal.  Department of Justice is a great idea.   Can you post a link?
1285406949126443020,Reply,1285406809171034184,2024-09-17T01:08:18.378+00:00,agutmann3110,Anna Gutmann (OH),1275940050772951051,assets\6c5996770c985bcd6e5b68131ff2ba04-4DF7B.png,"Yes I can, hold on let me pull it up"
1285414419815333970,Reply,1285406879672963113,2024-09-17T01:37:59.529+00:00,carb.on,Carolyn • Lead Mod,568257600228032512,assets\28a90c77b5793d80eb62484a43c66748-D8837.png,"Hi Anna, it would be wonderful to get a lot of signatures, so I encourage you to share a description of this change page instead of the link. The link is a problem because the change.org page asks for financial support which means we would be breaking campaign finance law by sharing it here."
1285414452815990896,Reply,1285407268711563405,2024-09-17T01:38:07.397+00:00,DemCord,DemCord,1242806362195365968,assets\007b625c296385e4ed52038a42c7256d-7649B.png,"**Strict Fundraising Rules (it’s the law):**
We can only fundraise on behalf of: Democratic National Committee, Harris Victory Fund or Harris for President directly. 
We can recruit for ""non-official events"" that are hosted by partner organizations or volunteers in ⁠non-official-events-only. We can recruit into anything that is listed on events.democrats.org or a state democratic party's mobilize.
Rule 3 Note > Relevance: Do not post links to petitions or other calls to action that haven’t been approved by Staff. This forum is not intended for debates. Additionally, do not attempt to raise funds or share fundraising links for any entity besides the Democratic National Committee. Using this server to raise funds for yourself, another candidate, or another organization violates campaign finance law and is strictly prohibited. Anyone who violates the rules is subject to removal or time out.
When in doubt, ask @Community Moderator."
1285415078795149363,Reply,1285414419815333970,2024-09-17T01:40:36.642+00:00,agutmann3110,Anna Gutmann (OH),1275940050772951051,assets\6c5996770c985bcd6e5b68131ff2ba04-4DF7B.png,"Oh shoot I forgot about that, I’m so sorry. Didn’t realize it even asked for money. The petition title on change .org is “Ohio Demands Trump/Vance Be Banned From Visiting Until They Publicly Apologize For Lies.” Hopefully it is searchable!"
1285584442571624508,Default,,2024-09-17T12:53:36.113+00:00,apfee2024_81383,howdyfriends (KY),1274293080794595339,assets\eb95501477beed1d0f8fde71864b6435-9F719.png,"...and an update from the Akron Beacon Journal about the Portage Co. sheriff, who wanted people to report on their neighbors with Harris/Walz signs. The good part: ""Zuchowski’s challenger in November’s election, Jon Barber, said on Facebook that he, too, believes the sheriff’s post was voter intimidation...On Monday, Barber was inundated with requests for interviews <:thumbup:1252804076849074276> and citizens visiting his home in Kent to pick up yard signs supporting him 🎉 ."" : https://eu.beaconjournal.com/story/news/politics/elections/2024/09/17/portage-county-residents-file-voter-intimidation-complaints-against-sheriff-bruce-zuchowski/75249361007/"
1285699255897423993,Default,,2024-09-17T20:29:49.743+00:00,carb.on,Carolyn • Lead Mod,568257600228032512,assets\28a90c77b5793d80eb62484a43c66748-D8837.png,"Hi <@1274293080794595339> and <@217502758343802880> be careful of posting links that go to sites with Donate buttons. We have to be aligned with Campaign Finance Law. I support you to discuss what you're reading and the sources, just leave off the links."
1285699283940671533,Reply,1285556213211463732,2024-09-17T20:29:56.429+00:00,DemCord,DemCord,1242806362195365968,assets\007b625c296385e4ed52038a42c7256d-7649B.png,"**Strict Fundraising Rules (it’s the law):**
We can only fundraise on behalf of: Democratic National Committee, Harris Victory Fund or Harris for President directly. 
We can recruit for ""non-official events"" that are hosted by partner organizations or volunteers in ⁠non-official-events-only. We can recruit into anything that is listed on events.democrats.org or a state democratic party's mobilize.
Rule 3 Note > Relevance: Do not post links to petitions or other calls to action that haven’t been approved by Staff. This forum is not intended for debates. Additionally, do not attempt to raise funds or share fundraising links for any entity besides the Democratic National Committee. Using this server to raise funds for yourself, another candidate, or another organization violates campaign finance law and is strictly prohibited. Anyone who violates the rules is subject to removal or time out.
When in doubt, ask @Community Moderator."
1285700304486137899,Reply,1285699255897423993,2024-09-17T20:33:59.746+00:00,unbridleddepression,Jabotinsky’s Strongest Twink,217502758343802880,assets\3e373c7d40727c1d01c34ee3a55091c4-317DF.png,"Oh, I didn't know this!"
1285706300516466718,Default,,2024-09-17T20:57:49.311+00:00,jack.246012,Jack (KC),1276396030375624789,assets\1b105b23ea580bad6169b556d3b7ebc4-4403D.png,"Ohio friends, MAGA Republicans are trying to confuse voters in an attempt to stop your states ballot measure that if passed, could end gerrymandering in the state.  Please remember the important deadlines coming up.  The deadline to register is October 7th, Early voting begins October 8th, the last day to request a no excuse absentee ballot is October 29th, and the ballot must be delivered before the polls close at 7:30PM on Election Day. https://www.democracydocket.com/news-alerts/ohio-group-garners-over-700000-signatures-for-ballot-initiative-to-end-gerrymandering/ https://www.vote411.org/"
1285706905603412048,Default,,2024-09-17T21:00:13.575+00:00,jack.246012,Jack (KC),1276396030375624789,assets\1b105b23ea580bad6169b556d3b7ebc4-4403D.png,"PS, you can also vote to flip the balance of the court!!"
1285710071501815830,Reply,1285699255897423993,2024-09-17T21:12:48.384+00:00,apfee2024_81383,howdyfriends (KY),1274293080794595339,assets\eb95501477beed1d0f8fde71864b6435-9F719.png,"Oh man, I keep looking for these and somehow missing them at times."
1285726243651846265,Default,,2024-09-17T22:17:04.125+00:00,shelb724,Shellie Levine Parker,1170136212279918633,assets\8569adcbd36c70a7578c017bf5604ea5-1FF44.png,Regarding the Portage County sheriff.  He’s in all kinds of trouble with the ACLU and the Justice Department.
1285735718580256790,Default,,2024-09-17T22:54:43.124+00:00,jack.246012,Jack (KC),1276396030375624789,assets\1b105b23ea580bad6169b556d3b7ebc4-4403D.png,Good
1285809505392791552,Reply,1285406879672963113,2024-09-18T03:47:55.271+00:00,DemCord,DemCord,1242806362195365968,assets\007b625c296385e4ed52038a42c7256d-7649B.png,"**Strict Fundraising Rules (it’s the law):**
We can only fundraise on behalf of: Democratic National Committee, Harris Victory Fund or Harris for President directly. 
We can recruit for ""non-official events"" that are hosted by partner organizations or volunteers in ⁠non-official-events-only. We can recruit into anything that is listed on events.democrats.org or a state democratic party's mobilize.
Rule 3 Note > Relevance: Do not post links to petitions or other calls to action that haven’t been approved by Staff. This forum is not intended for debates. Additionally, do not attempt to raise funds or share fundraising links for any entity besides the Democratic National Committee. Using this server to raise funds for yourself, another candidate, or another organization violates campaign finance law and is strictly prohibited. Anyone who violates the rules is subject to removal or time out.
When in doubt, ask @Community Moderator."
1285810115995504672,Default,,2024-09-18T03:50:20.85+00:00,starkittynmom,Jennifer • [Lead Mod],1276944250491113656,assets\a_2aba4b7f19fcab5fe5391fcdb73d735d-D670A.gif,"<:bluewave3:1270555729836900453> <:bluewave3:1270555729836900453> <:bluewave3:1270555729836900453> <:bluewave3:1270555729836900453> <:bluewave3:1270555729836900453> <:bluewave3:1270555729836900453> <:bluewave3:1270555729836900453> <:bluewave3:1270555729836900453> <:bluewave3:1270555729836900453> <:bluewave3:1270555729836900453> <:bluewave3:1270555729836900453> <:bluewave3:1270555729836900453> 
**COOL STUFF ALERT**

Hey everyone : 
The moderators of www.reddit.com/r/VoteDem and r/Bluemidterm2018 (the FORMER moderators of r/Voteblue) made this amazing spreadsheet:

https://docs.google.com/spreadsheets/d/1jxO8g7q9VO3ZMAABcrvR7PMyX4Yl6dgIYhD3eRTKk1M/edit?usp=sharing
This Google Sheet has links to the sign up pages for HUNDREDS of opportunities to engage from home for campaigns across the country. Check it out and sign up! Let's keep going to build this BLUE WAVE!
<:bluewave3:1270555729836900453> <:bluewave3:1270555729836900453> <:bluewave3:1270555729836900453> <:bluewave3:1270555729836900453> <:bluewave3:1270555729836900453> <:bluewave3:1270555729836900453> <:bluewave3:1270555729836900453> <:bluewave3:1270555729836900453> <:bluewave3:1270555729836900453> <:bluewave3:1270555729836900453> <:bluewave3:1270555729836900453> <:bluewave3:1270555729836900453>"
1286105011809423412,Default,,2024-09-18T23:22:09.491+00:00,mysticalsirenthingy,Cara Hatfield (OH),1227350914482962602,assets\cf0bdbd0328ddf2966d684bbf4ebdb55-F62CF.png,
1286115320456806525,Default,,2024-09-19T00:03:07.264+00:00,agutmann3110,Anna Gutmann (OH),1275940050772951051,assets\6c5996770c985bcd6e5b68131ff2ba04-4DF7B.png,"I am getting spammed with conflicting news articles about the gerrymandering issue coming up this year, and because I don’t know enough about it, I’m lost. Can someone please tell me  which way to vote is preferred by the Democratic Party (yes or no)?"
1286548328619704373,Default,,2024-09-20T04:43:44.455+00:00,carb.on,Carolyn • Lead Mod,568257600228032512,assets\28a90c77b5793d80eb62484a43c66748-D8837.png,Hi <@558297669190025261> I have to remove the link for citizens not politicians because there is a donate button on their page. I encourage you to post again and describe the issue without sharing the link.
1286548347309654046,Reply,1286484254720528455,2024-09-20T04:43:48.911+00:00,DemCord,DemCord,1242806362195365968,assets\007b625c296385e4ed52038a42c7256d-7649B.png,"**Strict Fundraising Rules (it’s the law):**
We can only fundraise on behalf of: Democratic National Committee, Harris Victory Fund or Harris for President directly. 
We can recruit for ""non-official events"" that are hosted by partner organizations or volunteers in ⁠non-official-events-only. We can recruit into anything that is listed on events.democrats.org or a state democratic party's mobilize.
Rule 3 Note > Relevance: Do not post links to petitions or other calls to action that haven’t been approved by Staff. This forum is not intended for debates. Additionally, do not attempt to raise funds or share fundraising links for any entity besides the Democratic National Committee. Using this server to raise funds for yourself, another candidate, or another organization violates campaign finance law and is strictly prohibited. Anyone who violates the rules is subject to removal or time out.
When in doubt, ask @Community Moderator."
1286588685671862273,Reply,1286115320456806525,2024-09-20T07:24:06.326+00:00,ann0314,Ann (OH),352957356042092546,assets\1ae0d8f99d33a3ca6e94411ac49b6e7f-B8A0A.png,https://youtu.be/SpNtDZ9C7ZQ?si=22Pb4bhaXvlqER4s Hope this helps.
1286589840510418964,Default,,2024-09-20T07:28:41.661+00:00,ann0314,Ann (OH),352957356042092546,assets\1ae0d8f99d33a3ca6e94411ac49b6e7f-B8A0A.png,So you would want to vote Yes if you want a group of citizens (evenly distributed across ideological lines) rather than whichever politicians are in power at the time to debate/discuss/take feedback/draw and come to a consensus on redistricting. A No vote would keep things as they are now which is described fairly well here: https://redistricting.lls.edu/state/ohio/?cycle=2020&level=Congress&startdate=2022-03-02
1286590433828540416,Default,,2024-09-20T07:31:03.119+00:00,ann0314,Ann (OH),352957356042092546,assets\1ae0d8f99d33a3ca6e94411ac49b6e7f-B8A0A.png,If you search Citizens Not Politicians on YouTube you can also get info there and googling that will get you to their website to read more details as well.
1286796516262023208,Reply,1286588685671862273,2024-09-20T21:09:57+00:00,agutmann3110,Anna Gutmann (OH),1275940050772951051,assets\6c5996770c985bcd6e5b68131ff2ba04-4DF7B.png,Thank you so much!
1286867357003681844,Reply,1286796516262023208,2024-09-21T01:51:26.749+00:00,ann0314,Ann (OH),352957356042092546,assets\1ae0d8f99d33a3ca6e94411ac49b6e7f-B8A0A.png,No problem at all ❤️ 🙂 Glad I could help! 🙂
1287013178928271452,Default,,2024-09-21T11:30:53.405+00:00,apfee2024_81383,howdyfriends (KY),1274293080794595339,assets\eb95501477beed1d0f8fde71864b6435-9F719.png,"Hi all, Dems Abroad is hosting a Zoom call with Sherrod Brown on Thursday, Sept. 26 at 9AM EST.  It's for folks abroad, but anyone can attend. I'm not sharing the link due to campaign finance laws, but you can find more info under the ""Events"" tab, and then ""Ohio events."""
1287113930149335061,Reply,1286548328619704373,2024-09-21T18:11:14.368+00:00,vote4pedro3665,Vote4Pedro,558297669190025261,assets\2-ADBB4.png,Apologies
1287166032523296768,Default,,2024-09-21T21:38:16.542+00:00,carb.on,Carolyn • Lead Mod,568257600228032512,assets\28a90c77b5793d80eb62484a43c66748-D8837.png,"Hi <@1275940050772951051> I support you to post again and share this information by describing where Ohioans can read it, but leave off the link. Because the link goes to a donate page which unfortunately is a problem with campaign finance laws."
1287166056128839824,Reply,1287162398054285364,2024-09-21T21:38:22.17+00:00,DemCord,DemCord,1242806362195365968,assets\007b625c296385e4ed52038a42c7256d-7649B.png,"**Strict Fundraising Rules (it’s the law):**
We can only fundraise on behalf of: Democratic National Committee, Harris Victory Fund or Harris for President directly. 
We can recruit for ""non-official events"" that are hosted by partner organizations or volunteers in ⁠non-official-events-only. We can recruit into anything that is listed on events.democrats.org or a state democratic party's mobilize.
Rule 3 Note > Relevance: Do not post links to petitions or other calls to action that haven’t been approved by Staff. This forum is not intended for debates. Additionally, do not attempt to raise funds or share fundraising links for any entity besides the Democratic National Committee. Using this server to raise funds for yourself, another candidate, or another organization violates campaign finance law and is strictly prohibited. Anyone who violates the rules is subject to removal or time out.
When in doubt, ask @Community Moderator."
1287166218310258819,Default,,2024-09-21T21:39:00.837+00:00,agutmann3110,Anna Gutmann (OH),1275940050772951051,assets\6c5996770c985bcd6e5b68131ff2ba04-4DF7B.png,Oh that is weird. I checked the page before posting for that problem and didn’t see anything
1287166468311748693,Default,,2024-09-21T21:40:00.442+00:00,agutmann3110,Anna Gutmann (OH),1275940050772951051,assets\6c5996770c985bcd6e5b68131ff2ba04-4DF7B.png,Go to Brennan center . org and search for the article “Ohio Politicians Try to Deceive Voters About Anti-Gerrymandering Ballot Measure” everyone! Very important info every Ohioan should read!
