id,type,ref_to,timestamp,author_name,author_nickname,author_id,author_avatar_url,content
1274413897486434324,21,1274392377829883965,2024-08-17T17:05:50.626+00:00,martarichenburg_59797,Marta Richenburg,1260983976483356767,assets\a57efb34b9ef35ed7f644aca5ab803aa-F2CBD.png,
1274413898690199575,Default,,2024-08-17T17:05:50.913+00:00,martarichenburg_59797,Marta Richenburg,1260983976483356767,assets\a57efb34b9ef35ed7f644aca5ab803aa-F2CBD.png,Hi Charlie! I am looking into this!
1274421930287698003,Default,,2024-08-17T17:37:45.795+00:00,zeltzerzootz,Charlie,1247536644224061553,assets\39b4f71dde4b988001db084a3923c6c9-84EF3.png,thank you. i just checked on it a few minutes ago and it is currently public. I didnt notice it was switched until today and it might have happened on tuesday or wednesday cause i havent touched it much due to the decrease in activity
1274421959639302215,Default,,2024-08-17T17:37:52.793+00:00,zeltzerzootz,Charlie,1247536644224061553,assets\39b4f71dde4b988001db084a3923c6c9-84EF3.png,but thank you again ❤️
1274424443912982619,Reply,1274421930287698003,2024-08-17T17:47:45.09+00:00,rootsmusic,rootsmusic,791857656897732648,assets\a30e650576a6d42a3c9ee24648f67c90-2AE37.png,"I don't know if DNCC is still accepting requests, but they have a [Virtual Creator Correspondent Request Form](https://docs.google.com/forms/d/e/1FAIpQLSdQi17ouG-f7t8akFws99Bya479oVR36vQG6YOsERaUnwX8cw/viewform) <@1266824293480661072>"
1274425962045505548,Default,,2024-08-17T17:53:47.041+00:00,zeltzerzootz,Charlie,1247536644224061553,assets\39b4f71dde4b988001db084a3923c6c9-84EF3.png,"is that for the Content Brigade? i did submit one to them, but i'll try this out too ^-^"
1274429017671467079,Reply,1274425962045505548,2024-08-17T18:05:55.559+00:00,rootsmusic,rootsmusic,791857656897732648,assets\a30e650576a6d42a3c9ee24648f67c90-2AE37.png,"No, it's for the DNC Convention."
1274429168825794601,Default,,2024-08-17T18:06:31.597+00:00,zeltzerzootz,Charlie,1247536644224061553,assets\39b4f71dde4b988001db084a3923c6c9-84EF3.png,❤️ thank you ^-^ just submitted it. I really appreicate it.
