id,type,ref_to,timestamp,author_name,author_nickname,author_id,author_avatar_url,content
1268767390351626261,Default,,2024-08-02T03:08:38.418+00:00,foxpaws109,Terri Kempthorne (OH),1056734399527399434,assets\601dd4069183e4a69a90ff8341382102-4FE39.png,Hello Ohio!!
1268974784184582225,Default,,2024-08-02T16:52:44.961+00:00,laurayohio,Laura Y — Ohio,1266797167331508326,assets\a70ad97d457aa10ed81d676a2f039d08-F852B.png,Hello from Westerville!
1269091911684067350,Default,,2024-08-03T00:38:10.333+00:00,progjulie,Julie Gentile  (OH),302943291517829131,assets\116cf0961fcb8b8ea097e1f7c7f121ce-99050.png,"Hi from Lake County, Ohio"
1269454058264068188,Default,,2024-08-04T00:37:12.806+00:00,theodorerooseveltgaming,ΣTheodore Roosevelt GamingΣ,422528533932277771,assets\69c9223c1cf380025bedeae2c9e9f90a-01B56.png,I'm also from Lake County
1269828247445704768,Default,,2024-08-05T01:24:06.459+00:00,ohseafarer,Lisa S (OH),442680537363120139,assets\728f4a01a8e6283c7962d5cf16b84457-B29D4.png,Hi from Dayton!
1269996014710816944,Default,,2024-08-05T12:30:45.292+00:00,breakingkind,BreakingKind,1256038712580636794,assets\03260aa872e2f69375f1fc6b51206dfa-721A2.png,"Hello from Worthington. I thought I did this a few days ago, but it didn't post."
1270071986466328751,Default,,2024-08-05T17:32:38.37+00:00,mayyjailer_,mayjailer,1257846983742328967,assets\ea812437a6aaee4a27b449f5907f52fd-90D93.png,Hi from Tuscarawas County!
1270083571545014362,Default,,2024-08-05T18:18:40.468+00:00,thejenniwren,Jennifer Canter (OH),1226227901381476372,assets\e8ef0f1fef38ba779f383e0b9f544bd7-97F82.png,Greetings from Mahoning County!
1270186024936669225,Reply,1270085286038339695,2024-08-06T01:05:47.26+00:00,DemCord,DemCord,1242806362195365968,assets\007b625c296385e4ed52038a42c7256d-7649B.png,"Non-official events and links can only be shared in https://discord.com/channels/1242249109298221066/1268426751164551199. 
We moved this for you! We appreciate if you post things like this in non-official events going forward."
1271893370469482506,Default,,2024-08-10T18:10:10.156+00:00,ktmg,KTMG  • Community Mod,447570500030562314,assets\4ab56c60f334133787a2e11eccf36d79-7F4A0.png,"This is just a reminder that you can sign up to phone bank, canvass, get trainings  or take other actions at https://events.democrats.org/ in your state or in one of our battleground states (NC, PA, GA, NH, WI, PA, MI, AZ, NV). Volunteers like you make all the difference! We look forward to seeing you at an event soon."
1272012904161480790,Default,,2024-08-11T02:05:09.209+00:00,awood29.,Awood29🧡,1209321795681783830,assets\4fe8de54f0b566cc95379e096106cd12-885B1.png,Hey everyone!! From Cuyahoga County 🙂
1272168252294037516,Reply,1269828247445704768,2024-08-11T12:22:27.09+00:00,barb_33842,Barb F  OH,1269333164703219742,assets\e684ead291158636107c303205b027a9-EDC2E.png,Hi Lisa I'm from Dayton (Centerville-Kettering area) as well. At least I spent by first 42 years there. I moved to Cleveland (North Olmsted) in 1990.
1272889871379464224,Default,,2024-08-13T12:09:54.487+00:00,arulane,Katil (Ohio),365932607126634506,assets\a248a4fdbb8d1ea4c469e4e2291a290b-FD6C3.png,Hi! From Summit County! Been here about 5-6 years.
1273053196436377610,Default,,2024-08-13T22:58:54.215+00:00,bobtaylor_graceandtruth,BobTaylor,1162790968907546795,assets\e3ca20227b014a5389d6310f05859865-46052.png,Hello from Liberty Township in Southwest Ohio
1273688614168952833,Default,,2024-08-15T17:03:49.608+00:00,emma_votes_in_ohio,Emma Mirles-Jones ~ Ohio,1170237537051213927,assets\27e9aaac325a478520105981426eddaa-EABB8.png,"Greetings from Delaware, Ohio the red county north of Columbus that voted with the progressives the past 2 elections.  We are getting ready to flip this place blue.  This is John Kasich Republicans territory.  I am hoping beyond hope that this is our Blue Wave year."
1273865899576918128,Default,,2024-08-16T04:48:17.743+00:00,meggalipault,MegGali,1227707084179767369,assets\77d5a4e568cad784d224bbece80bc313-1786E.png,"Hello from Mount Vernon in Knox County. Long-time Dem volunteer and former county chair. Just thought I'd mention we won for Obama and we can do it again! Also, it is important to tell college students that voter ID laws have changed in Ohio. They need to be prepared with an Ohio driver's license, an Ohio state ID, or a passport (a couple of other military-related IDs can be used). They can't use a phone or utility bill. We want our out-of-state students who are living here to be able to vote in Ohio!"
1273955265791791196,Default,,2024-08-16T10:43:24.309+00:00,foxpaws109,Terri Kempthorne (OH),1056734399527399434,assets\601dd4069183e4a69a90ff8341382102-4FE39.png,"Used to be Lake County, then Stark County, now Warren County ☺️"
1273986006693052468,Default,,2024-08-16T12:45:33.511+00:00,bobtaylor_graceandtruth,BobTaylor,1162790968907546795,assets\e3ca20227b014a5389d6310f05859865-46052.png,"I thought Ohio was a lost cause, but recent polls hint at a change. I fear putting a Kamala Harris yard sign up in my typical middle-class neighborhood. The hate and anger that comes from the people who have Trump yard signs is tangible. But I am going to do it anyway! It is too essential, and there is too much at stake to let fear of reprisal stop us."
1273986965930508319,Default,,2024-08-16T12:49:22.211+00:00,bobtaylor_graceandtruth,BobTaylor,1162790968907546795,assets\e3ca20227b014a5389d6310f05859865-46052.png,I setup this TikTok account for my efforts to support the campaign. Take a look and follow me if you like the content. Let me know what you think and make comments so I can adjust the content. https://www.tiktok.com/@bobbytaylor1959/video/7403525375470439710?is_from_webapp=1&sender_device=pc&web_id=7402346906799982122
1273987234378285086,Default,,2024-08-16T12:50:26.214+00:00,bobtaylor_graceandtruth,BobTaylor,1162790968907546795,assets\e3ca20227b014a5389d6310f05859865-46052.png,https://www.tiktok.com/@bobbytaylor1959/video/7403498012443413791?is_from_webapp=1&sender_device=pc&web_id=7402346906799982122
1273987300031991900,Default,,2024-08-16T12:50:41.867+00:00,bobtaylor_graceandtruth,BobTaylor,1162790968907546795,assets\e3ca20227b014a5389d6310f05859865-46052.png,https://www.tiktok.com/@bobbytaylor1959/video/7403497867593190687?is_from_webapp=1&sender_device=pc&web_id=7402346906799982122
1274108643738128417,Default,,2024-08-16T20:52:52.461+00:00,thejenniwren,Jennifer Canter (OH),1226227901381476372,assets\e8ef0f1fef38ba779f383e0b9f544bd7-97F82.png,"I’m in red Mahoning County. I haven’t been out much lately, but a friend reported actually seeing Harris Walz signs out! If you know anything about Mahoning, you understand how huge that is. My husband & I just decided to order signs despite our red neighborhood. If they take them, I’ll make my own darn signs and replace them. Maybe we can organize a Zoom or meet ups. We’re Not Going Back!"
1274351000089526393,Default,,2024-08-17T12:55:54.718+00:00,jdlittle86,Jd,1272347058283614242,assets\c82b3fa769ed6e6ffdea579381ed5f5c-B4D94.png,From Middletown Ohio. Let’s do this!
1274517306940198982,Default,,2024-08-17T23:56:45.361+00:00,bobtaylor_graceandtruth,BobTaylor,1162790968907546795,assets\e3ca20227b014a5389d6310f05859865-46052.png,"Hi, I have been creating and posting content for the campaign on TikTok, Instagram, X, and Facebook. I would love your feedback and suggestions. I am new to TikTok and don't use Instagram or X much, but as a content creator, I wanted to help out. Here my TikTok URL https://www.tiktok.com/@bobbytaylor1959, my X URL https://x.com/AllytechAppDev and Instagram URL https://www.instagram.com/bob_taylor_grace_and_truth/"
1274517534896296097,Reply,1274351000089526393,2024-08-17T23:57:39.71+00:00,bobtaylor_graceandtruth,BobTaylor,1162790968907546795,assets\e3ca20227b014a5389d6310f05859865-46052.png,"Where in Middletown, we live in Liberty Township."
1274521949028094023,Reply,1274517306940198982,2024-08-18T00:15:12.121+00:00,carb.on,Carolyn • Lead Mod,568257600228032512,assets\28a90c77b5793d80eb62484a43c66748-D8837.png,"Hi Bob, I'm excited to see you doing this on your own. We have a TT training which can help you out and a TT team that you might want to join. https://events.democrats.org/event/634652/"
1274524779960995890,Reply,1274517534896296097,2024-08-18T00:26:27.068+00:00,jdlittle86,Jd,1272347058283614242,assets\c82b3fa769ed6e6ffdea579381ed5f5c-B4D94.png,Near off grand ave. We should get together and campaign for the great Kamala!
1274527526772801626,Reply,1274521949028094023,2024-08-18T00:37:21.959+00:00,bobtaylor_graceandtruth,BobTaylor,1162790968907546795,assets\e3ca20227b014a5389d6310f05859865-46052.png,"Hi, I attended one this week. Do you have other training?"
1274528159274111061,Reply,1274527526772801626,2024-08-18T00:39:52.759+00:00,carb.on,Carolyn • Lead Mod,568257600228032512,assets\28a90c77b5793d80eb62484a43c66748-D8837.png,"Great, that is *the* training. I just gave you the Tiktoker role so you will see https://discord.com/channels/1242249109298221066/1272343930737791060 in the Amplify Messaging category. Have fun and do great work!"
1274723571700076707,Default,,2024-08-18T13:36:22.712+00:00,deb_b1,Deb,369866739913326592,assets\9195bf63588dd237a4a3426dbf1e572d-1BDF3.png,Hi from Franklin county!
1274890738462752860,Reply,1274723571700076707,2024-08-19T00:40:38.374+00:00,emma_votes_in_ohio,Emma Mirles-Jones ~ Ohio,1170237537051213927,assets\27e9aaac325a478520105981426eddaa-EABB8.png,Hello from Delaware County.
1275086821034033152,Default,,2024-08-19T13:39:48.102+00:00,28tva2406,Tanzie Adams,1266914062575337494,assets\8569adcbd36c70a7578c017bf5604ea5-5C58A.png,Hello from Lake County
1275589921138020473,Default,,2024-08-20T22:58:56.514+00:00,that.in.hypoallerginic,froggy.boi,940435798032007228,assets\ca21ed8edc7c7b9fbee1150205e56ddf-DC1C6.png,hello from Montgomery County
1275819932675870822,Default,,2024-08-21T14:12:55.538+00:00,lunatcarter,Vera Lane,1128174646727036999,assets\8ba6718366642cb445c83d3e701db891-90A7C.png,
1275819994055184535,Default,,2024-08-21T14:13:10.172+00:00,lunatcarter,Vera Lane,1128174646727036999,assets\8ba6718366642cb445c83d3e701db891-90A7C.png,Hello all! From Beachwood!
1275829715256737812,Default,,2024-08-21T14:51:47.887+00:00,jillsmith_41345,Jill Smith,1275828920800776228,assets\2-ADBB4.png,"Hello from Toledo, OH!!"
1275920892270215200,Default,,2024-08-21T20:54:06.181+00:00,vote4pedro3665,Vote4Pedro,558297669190025261,assets\2-ADBB4.png,Hi from Summit county!  Already been door knocking for dem coordinated (Sherrod Brown/Emilia Sykes).  Certainly bring up Harris/Walz if the conversation goes well.
1276157022638706688,Reply,1270083571545014362,2024-08-22T12:32:24.048+00:00,ann0314,Ann (OH),352957356042092546,assets\1ae0d8f99d33a3ca6e94411ac49b6e7f-B8A0A.png,Hello fellow Mahoning County neighbor ❤️ 🙂
1276264598533574716,Default,,2024-08-22T19:39:52.14+00:00,carb.on,Carolyn • Lead Mod,568257600228032512,assets\28a90c77b5793d80eb62484a43c66748-D8837.png,## [Ohio Voter Information](https://www.vote.org/state/ohio/)
1276264616674066433,ChannelPinnedMessage,1276264598533574716,2024-08-22T19:39:56.465+00:00,carb.on,Carolyn • Lead Mod,568257600228032512,assets\28a90c77b5793d80eb62484a43c66748-D8837.png,Pinned a message.
1276279269097476301,Default,,2024-08-22T20:38:09.875+00:00,emilyko8486,emilyko,699818032356261928,assets\76a2934c69037cff09cdd61921c8c119-CF7C5.png,Hi everyone! Does anyone know the last day to request a mail in ballot for Ohio?
1276280810663841913,Default,,2024-08-22T20:44:17.413+00:00,emilyko8486,emilyko,699818032356261928,assets\76a2934c69037cff09cdd61921c8c119-CF7C5.png,"Oops I just realized I missed it on the voter info website! In case anyone else was wondering, the application has to be received 7 days before Election Day!"
1276305219998711859,Default,,2024-08-22T22:21:17.052+00:00,ann0314,Ann (OH),352957356042092546,assets\1ae0d8f99d33a3ca6e94411ac49b6e7f-B8A0A.png,"If you are in Ohio, I would double check your registration as well. They did do some trimming of the rolls. 

Also of note, apparently there is now a new way to add your Ohio State ID to your Apple Wallet. That said, I would not use that as your voter ID on the day of voting if you vote in person. Take your regular Photo ID and advise others to do so as well (I'm more than a bit worried it will be used as a way to reject votes/voters) and going by the video below it seems my fears were right sadly 😦

https://www.youtube.com/watch?v=-rLRqkqok04"
1276305429059735643,Default,,2024-08-22T22:22:06.896+00:00,ann0314,Ann (OH),352957356042092546,assets\1ae0d8f99d33a3ca6e94411ac49b6e7f-B8A0A.png,Be sure to watch for any info on social media saying that you CAN use the Apple Wallet ID for voting....and post the people this link (and maybe post it on your Facebook to any Ohio friends and family so they know as well) Id post it yet again come closer to Nov too.
1276311533323817020,Default,,2024-08-22T22:46:22.266+00:00,joan00845,Joan Dunn [Ohio],1276306363286425625,assets\8569adcbd36c70a7578c017bf5604ea5-4E865.png,Hi from Worthington in Franklin County!
1276322070468493353,Default,,2024-08-22T23:28:14.517+00:00,ann0314,Ann (OH),352957356042092546,assets\1ae0d8f99d33a3ca6e94411ac49b6e7f-B8A0A.png,Hello 🙂
1276931477334130791,Default,,2024-08-24T15:49:48.436+00:00,sheri0355,Sheri,1276926411101180051,assets\8569adcbd36c70a7578c017bf5604ea5-3630F.png,Southwestern Ohio here!
1276966317764640943,Default,,2024-08-24T18:08:15.042+00:00,boochela,Themocrat [DMV],676870546537054239,assets\a9c888a3bfd30c69654cc2f510e388b9-EABEB.png,Does anyone know anyone organizing in WV?
1277012622218100747,Default,,2024-08-24T21:12:14.884+00:00,bharatkrishnan,Bharat Krishnan,576975503613886475,assets\0e851810b62615fac4d92f00437e3992-00BB9.png,canvassing in Dublin tomorrow!
1277037188432920607,Default,,2024-08-24T22:49:51.926+00:00,shelly_pawmom4,Shelly,1232009936167239750,assets\24f179e7794849cf2d5e3bd5f7223ec8-67E22.png,Hi from N Canton
1277040039808995328,Default,,2024-08-24T23:01:11.747+00:00,theamandashow1742,Amanda Irwin [OH],816843832859689010,assets\0-EB806.png,Hi from Warren County!
1277060414856888484,Default,,2024-08-25T00:22:09.537+00:00,shelb724,Shellie Levine Parker,1170136212279918633,assets\8569adcbd36c70a7578c017bf5604ea5-1FF44.png,Hi I’m in Akron Ohio!
1277192994394734642,Default,,2024-08-25T09:08:58.962+00:00,ann0314,Ann (OH),352957356042092546,assets\1ae0d8f99d33a3ca6e94411ac49b6e7f-B8A0A.png,"For anyone who wants a link that shows what Biden - Harris has done for Ohio thus far: https://www.americanprogress.org/article/biden-administration-investment-tracker/?bit-query=1&keyword=&federal=on&private=on&min_amount=0&max_amount=35000000000&bit-state=OH&bit-cd=&city=&law=&company=#bit-tracker 

On the left side of the screen you can also add county if you want it to be more specific."
1277309888518684694,Reply,1277192994394734642,2024-08-25T16:53:28.693+00:00,boochela,Themocrat [DMV],676870546537054239,assets\a9c888a3bfd30c69654cc2f510e388b9-EABEB.png,Amazing!!!!
1277791100345520260,Default,,2024-08-27T00:45:38.533+00:00,mysticalsirenthingy,Cara Hatfield (OH),1227350914482962602,assets\cf0bdbd0328ddf2966d684bbf4ebdb55-F62CF.png,Hello from Georgetown… 😭
1277791202917482597,Default,,2024-08-27T00:46:02.988+00:00,silentlobster69,Zayne (OH),687895920213491718,assets\dcc9701636350512b26677c539976418-93663.png,… it’s near Cincinnati 😂
1277791442663768177,Default,,2024-08-27T00:47:00.148+00:00,silentlobster69,Zayne (OH),687895920213491718,assets\dcc9701636350512b26677c539976418-93663.png,We have a lot of work to do! Ohio has gotten pretty red lately. Hopefully we can make a difference! 💙
1278016161581371455,Default,,2024-08-27T15:39:57.313+00:00,ann0314,Ann (OH),352957356042092546,assets\1ae0d8f99d33a3ca6e94411ac49b6e7f-B8A0A.png,"Everyone keeps saying ""Ohio is red"" but honestly we have always been a pretty purple state that is diverse as far as its electorate. Seeing how the votes on both Abortion and also on Super Majority dictating the Ohio Constitution, I think Ohio has a shot to be turned honestly. Its a no-nonsense state with a lot of really amazing people. I think the issue is that many just don't realize the things being said by DJT. Lots of voters have just always voted Conservative (like regular DeWine Conservative or Kaisch Conservative) forever and belive the ""radical"" heading the left gets. I think that could be changed if we can find a way to point out that what DJT is proposing is actually radical."
1278016945756573768,Default,,2024-08-27T15:43:04.275+00:00,ann0314,Ann (OH),352957356042092546,assets\1ae0d8f99d33a3ca6e94411ac49b6e7f-B8A0A.png,"When people bring up that Democrats are to blame for Ohios problems or for any bad policy that happens inside Ohio, I always point out that Ohio is a Republican Trifecta state (IE ALL the power in this state is in the hands of the GOP - Governor, House Majority, Senate Majority) and that it has been for 26+ years. If we have problems in Ohio or ""want change"" then supporting the Democratic Party/Harris would be that change - not voting for more of the same. I also mention that with 26+ years of complete control, shouldn't Ohio be a Republican utopia?"
1278017438935679059,Default,,2024-08-27T15:45:01.858+00:00,ann0314,Ann (OH),352957356042092546,assets\1ae0d8f99d33a3ca6e94411ac49b6e7f-B8A0A.png,I also post the image from this page: https://ballotpedia.org/Party_control_of_Ohio_state_government (it shows the chart if you scroll down - I screenshot it and put it with my posts on the topic)
1278018264433430548,Default,,2024-08-27T15:48:18.672+00:00,ann0314,Ann (OH),352957356042092546,assets\1ae0d8f99d33a3ca6e94411ac49b6e7f-B8A0A.png,"Also that paragraph at the top of that page says a lot too. There are more Republican Trifectas and Triplexes within the states than there are Dem ones. So again, shouldn't this entire country be a Republican Utopia when they hold so much power and have?"
1278032994472300646,Default,,2024-08-27T16:46:50.587+00:00,truthkeeper,Jess,189592499898155008,assets\c676aa0c7d1b1ccd991c25ea292ee968-06B99.png,Hey Ohioans! 👀
1278042931302895742,Reply,1278016945756573768,2024-08-27T17:26:19.712+00:00,mysticalsirenthingy,Cara Hatfield (OH),1227350914482962602,assets\cf0bdbd0328ddf2966d684bbf4ebdb55-F62CF.png,This is all really useful!! Thank you!!
1278085195119067239,Reply,1278032994472300646,2024-08-27T20:14:16.191+00:00,ann0314,Ann (OH),352957356042092546,assets\1ae0d8f99d33a3ca6e94411ac49b6e7f-B8A0A.png,Hello Jess ❤️ 🙂
1278502408812498966,Default,,2024-08-28T23:52:07.687+00:00,brennemanfamily,BrennemanFamily,1031765593176682507,assets\e8c8d8c560c8bcee265e4d37b57e0b4c-E2AFF.png,"In my county in rural Ohio there are a couple huge farms but also a lot of small ones. I've read 2025 so I know the answers to the other sides policies,  but do we have any idea on our side? Namely corn, soy and other commodity farms. Help I can't canvas until I am informed"
1278715294835150941,Reply,1278502408812498966,2024-08-29T13:58:03.67+00:00,ann0314,Ann (OH),352957356042092546,assets\1ae0d8f99d33a3ca6e94411ac49b6e7f-B8A0A.png,I've not directly heard any policy on farming yet. I have family with a large farm in Ohio as well so I too would like to know where she stands there or what the plans are. I will say that Walz has been strong on Agriculture so hopefully they will take a serious look at the topic and come up with things that are good for farmers.
1278716589218201702,Reply,1278715294835150941,2024-08-29T14:03:12.275+00:00,brennemanfamily,BrennemanFamily,1031765593176682507,assets\e8c8d8c560c8bcee265e4d37b57e0b4c-E2AFF.png,"A recap of 2025 if that helps you in regard to that. Farms will not be allowed to have Federal and Private crop insurance, insurance subsidies lowered to 46% instead of 60% and will ONLY be allowed for farms GROSSING under $500k a year. My daughter married into a farm that does popcorn for the largest companies out there. They have 40k acres. Obviously it's easy for them to see why not to vote Trump but I keep running into the little guys that vote based solely on their hobby farms."
1278799217048944720,Default,,2024-08-29T19:31:32.285+00:00,ann0314,Ann (OH),352957356042092546,assets\1ae0d8f99d33a3ca6e94411ac49b6e7f-B8A0A.png,"For anyone interested, this is a really good page done by the Harris Campaign with Project 2025 information: https://kamalaharris.com/project2025/"
1280372903086391396,Default,,2024-09-03T03:44:48.274+00:00,jean9_28218_79932,Jeannine • Lead Mod,1266879741785538682,assets\54ff5e8dfab835d878a961f9f7b7d161-6C0EE.png,"<a:star_wave:1269735420359606369> Hey, Team! We know you want to help make a difference! Did you know though that hosting a debate watch party is an amazing way to get involved and bring people together? <a:rainbow_heart_scribble:1269029739432120465> It’s all about good vibes, great conversations, and getting folks fired up for the election. Your watch party could be the spark that motivates someone to vote! <a:PinkFlames:1252802562659193004>  [Register your watch party](https://events.democrats.org/c/host-a-debate-watch-party/event/create/) to get access to all sorts of resources for throwing a successful debate watch party, including a [Host Information Session](https://events.democrats.org/event/677337/). <a:ThanksRainbow:1278765693579431967>"
1280428358106218536,Reply,1278016161581371455,2024-09-03T07:25:09.781+00:00,emma_votes_in_ohio,Emma Mirles-Jones ~ Ohio,1170237537051213927,assets\27e9aaac325a478520105981426eddaa-EABB8.png,"Aundrea, I completely agree 100%.  We are a purple state with a lot of people who watch Faux News.  And let's not forget gerrymandering.  But I am in Delaware County.  We have been working hard to flip this county blue.  And that Blue Wave is coming.  It has been building up for at least a decade or more now.  I've been actively involved since 2015, and became an ""insider"" since 2016.  My county beat the statewide average last November for reproductive rights.   We sided with the progressives the past 2 elections.  If we can keep up this same momentum in November, we will totally flip Ohio.  

And there is a quiet optimism in the air right now.  Can you feel it?  Big burly truck dudes holding doors open and showing something resembling manners lately.  Heck, I have some Trumpies chatting with me on the daily now.  Either they are planning my demise, or they are feeling optimistic.  Heck, our neighborhood obnoxious Trumpet Goon that blanketed his whole yard with large obnoxious signs and flags, only has one normal size yardsign at the moment.  🤣😂  I feel like that is totally a sign of doubt."
1280813963084300390,Default,,2024-09-04T08:57:25.172+00:00,trumansleeps,Michael Pelaez | FL,389839010576465936,assets\3a91c3446fca9803ffb1d856364145a2-A8603.png,https://www.mobilize.us/voteriders/event/564817/?referring_vol=6684605&rname=Michael&share_context=event_details&share_medium=copy_link
1281043031075721358,Default,,2024-09-05T00:07:39.237+00:00,smith_word,Smith_Word,697972782801354804,assets\741066a50801b38ce980970853707e77-93F77.png,"I don't know if this is allowed, but none of my friends or family are into politics as much as I am and I am looking for people to canvas with. I'm in NE Ohio. If anyone would be up for going with me that would be great cause I really want to get out there!"
1281106299488178348,Default,,2024-09-05T04:19:03.602+00:00,agutmann3110,Anna Gutmann (OH),1275940050772951051,assets\6c5996770c985bcd6e5b68131ff2ba04-4DF7B.png,"Any NE Ohioans who want to attend a Tim Walz rally, please check Mobilize; RSVP may be available for his rally tomorrow in a neighboring state.  Idk if it’s accessible to all users; I got my invite via text. But wanted to pass the info along just in case!"
1281106650526388225,Reply,1281043031075721358,2024-09-05T04:20:27.296+00:00,agutmann3110,Anna Gutmann (OH),1275940050772951051,assets\6c5996770c985bcd6e5b68131ff2ba04-4DF7B.png,"I wish I could! Not allowed to walk around like that just yet (had surgery recently). Please check back in with me in a couple weeks if you still need someone though,"
1281123313262788670,Reply,1281043031075721358,2024-09-05T05:26:40.002+00:00,carb.on,Carolyn • Lead Mod,568257600228032512,assets\28a90c77b5793d80eb62484a43c66748-D8837.png,"Yes! this is allowed, I hope you can connect with another ohio-an and have a great day out there."
1281327616632291489,Default,,2024-09-05T18:58:29.721+00:00,immaculate_gull_15675,Laura P. (Ohio),1276219586685178037,assets\5-E9BDB.png,"While reading through the messages above  I noticed one referring to being able to put one's Ohio State ID  into your Apple Wallet. Of course this is true. However, voters cannot present their Ohio State ID that would reside in the Apple Wallet as a form of ID when they vote in Ohio. It must be the physical ID.  If this has already been posted I apologize for the duplicate.  Please share with those you know so they are aware. Here is a link to a related article: https://fox8.com/news/ohios-new-mobile-id-isnt-valid-for-voting/"
1282037309428072501,Default,,2024-09-07T17:58:33.669+00:00,bobhyland,Bob H  [OH],1282018701771538527,assets\2b71003123d637b16c0581c8cc49ef63-7F250.png,"What’s up O-H-I-O! Let’s do this. Our state is blue when it votes in big numbers. Anyone in SW Ohio want to collaborate on a debate watch party? Let’s connect on Twitter/X (@Write_4_Justice) too to amplify each others’ voices/REACH posts. In solidarity, Bob."
