id,type,ref_to,timestamp,author_name,author_nickname,author_id,author_avatar_url,content
1293367126198976602,Default,,2024-10-09T00:19:12.485+00:00,michael.rudnick,Michael Rudnick,1286483782639161394,assets\0b3e9ac7891c1dec9167753a95756b9b-7F232.png,"I went thru the Captains training for Data Captain and completed a shadow session. Jay Eilers was working with me to get access to the KC section in Discord. However, I’m still don’t have access to the LC section and can’t sign up for sessions. Eva suggested I post here for help. Thanks."
1293373397312602175,Default,,2024-10-09T00:44:07.635+00:00,franceshaydock_20619,Frances Haydock (HFP HQ!),1257469301435400238,assets\8286d5b1308e7b3d80a3523e4ec50548-C029D.png,Just gave you the role!
1293398453681913887,Default,,2024-10-09T02:23:41.539+00:00,michael.rudnick,Michael Rudnick,1286483782639161394,assets\0b3e9ac7891c1dec9167753a95756b9b-7F232.png,Thanks!
1293580439142797363,Default,,2024-10-09T14:26:50.254+00:00,lodgegirlbridget_38887,Lodgegirl Bridget (Chat Captain),1275527385474666556,assets\ccdb791e829694f50775d16ea8387ae1-50689.png,Hi there <@1257469301435400238> ! I have done a few chat captain sessions and signed up for more over the next 27 days... would like to download the chat captain background - could you please give me access to the KC section in discord? Thank you so much for all you're doing!
1293634923462393856,Default,,2024-10-09T18:03:20.328+00:00,franceshaydock_20619,Frances Haydock (HFP HQ!),1257469301435400238,assets\8286d5b1308e7b3d80a3523e4ec50548-C029D.png,Done!
1293684279733387278,Reply,1293580439142797363,2024-10-09T21:19:27.78+00:00,kyaizen,Jared R [CO] • Lead Mod,112080668296564736,assets\a_de0e3d4a3f9b486ad3ad6df0d72323da-D0252.gif,Linking the backgrounds in case you haven't found them yet: https://discord.com/channels/1242249109298221066/1281408325270900867
