id,type,ref_to,timestamp,author_name,author_nickname,author_id,author_avatar_url,content
1289059704193941524,Default,,2024-09-27T03:03:03.051+00:00,madeline5086,Madeline Hou,415244010928472074,assets\a42b9f91dfa27cf94160a81b14224cfd-A9F52.png,"Hi, I lost wifi briefly with one caller who was interested in volunteering in a future week. I only remember their first name and when I reopened the dialer, they were no longer there. Is it possible for one of the calls teams organizers to give them a call or text back?"
1289060185020829726,Default,,2024-09-27T03:04:57.689+00:00,starkittynmom,Jen Medeiros [CA] • [Lead Mod],1276944250491113656,assets\a_2aba4b7f19fcab5fe5391fcdb73d735d-D670A.gif,"<@415244010928472074> it isn't, unfortunately, but if you didn't close the survey, hopefully it will put her back into the queue"
1289060340067336324,Default,,2024-09-27T03:05:34.655+00:00,madeline5086,Madeline Hou,415244010928472074,assets\a42b9f91dfa27cf94160a81b14224cfd-A9F52.png,"Yep I was unable to complete the survey so it should be okay. I hope they didn't think I was hanging up on them. 😅  This was the only time my wifi went down so if it goes down again, I'll wrap up early"
1289065193531379812,Default,,2024-09-27T03:24:51.811+00:00,starkittynmom,Jen Medeiros [CA] • [Lead Mod],1276944250491113656,assets\a_2aba4b7f19fcab5fe5391fcdb73d735d-D670A.gif,you're still calling! You may be my new favorite human <@415244010928472074> - Def my favorite human for Thursday
1289065733690757202,Default,,2024-09-27T03:27:00.595+00:00,madeline5086,Madeline Hou,415244010928472074,assets\a42b9f91dfa27cf94160a81b14224cfd-A9F52.png,"Thank you so much Jen! I actually just exited the dialer a minute ago and submitted the form, but thank you for your kind words. I had a really positive experience tonight with a lot of people saying they'd vote for her if they couldn't volunteer, and I will definitely join more sessions in the upcoming days!"
