id,type,ref_to,timestamp,author_name,author_nickname,author_id,author_avatar_url,content
1274821486431174746,Default,,2024-08-18T20:05:27.403+00:00,bradb_21554,Brad B,1066233166949523516,assets\3-FB033.png,I signed up for Discord but the downloaded app isn't loading. Just get a blank black screen. However the web app is working. Help?
1274821701737124002,Default,,2024-08-18T20:06:18.736+00:00,franceshaydock_20619,Frances Haydock (HFP HQ!),1257469301435400238,assets\8286d5b1308e7b3d80a3523e4ec50548-C029D.png,Maybe try deleting the app and re-downloading it again?
1274824161331773484,Reply,1274821486431174746,2024-08-18T20:16:05.149+00:00,carb.on,Carolyn B [CA] • Lead Mod,568257600228032512,assets\28a90c77b5793d80eb62484a43c66748-D8837.png,"Hi Brad, I want to help you have a better experience. Let's try to turn your phone off and back on again. If that doesn't fix it, can you share what phone OS you are using?"
1274825499398508597,Default,,2024-08-18T20:21:24.169+00:00,bradb_21554,Brad B,1066233166949523516,assets\3-FB033.png,Sorry this is on my mac laptop. Is the downloadable app only for iPhones?
1274825980938289222,Default,,2024-08-18T20:23:18.977+00:00,carb.on,Carolyn B [CA] • Lead Mod,568257600228032512,assets\28a90c77b5793d80eb62484a43c66748-D8837.png,"Sorry I misunderstood. down load the laptop app from 
https://discord.com/download and make sure you are on macOS 10.15 (Catalina) or higher"
1274830881986449593,Reply,1274825980938289222,2024-08-18T20:42:47.478+00:00,bradb_21554,Brad B,1066233166949523516,assets\3-FB033.png,"Thanks, downloaded for the third time and finally got it to open.  Third time's a charm! Thanks for your help."
