id,type,ref_to,timestamp,author_name,author_nickname,author_id,author_avatar_url,content
1286108763459158168,Default,,2024-09-18T23:37:03.954+00:00,roofpv,Susie (PA),631653524366688256,assets\a96e1c0f3e8422610dd84aff5f158cf5-2B9AB.png,and we ordered steel wire to try to keep our signs from getting stolen
1286125790001365043,Reply,1286108763459158168,2024-09-19T00:44:43.398+00:00,mikem_13174,Mike Marcinek [PA],1282131375700443280,assets\2-ADBB4.png,"That's amazing, great work! Keep it up! About the signs, I've found that taping a small note to the top that says something like ""Stolen sign = $100 donation to Kamala"" really helps."
1286129381844062228,Reply,1286051071017488395,2024-09-19T00:58:59.76+00:00,pammcdonald,Pam McDonald 📱📞 🗣,1277744881858646129,assets\01f620f71c2f65691395400d8d1638eb-850CB.png,"I think if you go to kamalaharris.com and filter volunteer opportunities within a few miles of Allentown, you may find what you're looking for. You can also go to PADEM.org the state Dem Party will also have volunteer opportunities. If you register at both sites, you will receive emails updating you with new info"
1286243890520915999,Default,,2024-09-19T08:34:00.756+00:00,apfee2024_81383,howdyfriends (KY),1274293080794595339,assets\eb95501477beed1d0f8fde71864b6435-9F719.png,"<:WalzSmile:1270424129853456445> <:WalzSmile:1270424129853456445> <:WalzSmile:1270424129853456445>  rally in Lehigh Valley on Sept. 21, focusing on Latino voters. “The Bear” star Liza Colón-Zayas and “In the Heights” star Anthony Ramos will join too: https://variety.com/2024/politics/columns/bear-emmys-liza-colon-zayas-tim-walz-campaign-rally-latino-voters-1236149238/"
1286304946857312337,Default,,2024-09-19T12:36:37.721+00:00,apfee2024_81383,howdyfriends (KY),1274293080794595339,assets\eb95501477beed1d0f8fde71864b6435-9F719.png,No ballot drop boxes in Luzerne Co for Nov 5 https://www.timesleader.com/news/1667546/luzerne-county-wont-have-mail-ballot-drop-boxes-in-nov-5-general-election
1286308914903646219,Default,,2024-09-19T12:52:23.777+00:00,twanathan,Anthony D. [PA],919266668574810122,assets\a83e87e798ebaa7348a3e1045f867690-F0776.png,This seems more about PA’s highly contested and Byzantine voting laws
1286327122369052732,Reply,1286304946857312337,2024-09-19T14:04:44.775+00:00,aglina,Angelina Veneziano (PA),798691543804280882,assets\e74f1901327791fc825282cd373320b5-C8494.png,I kind of want to say Well Yes... as they ruined our mail sorting system the last election to voter suppress us.
1286392219053592666,Default,,2024-09-19T18:23:25.034+00:00,fltadmlwolf,Jordan K.,201533180434448385,assets\29da332e3f8721844d4eab7d9c8b42fa-62E9F.png,"There are stops for MoveOn's ""Scoop the Vote"" events with Ben & Jerry's founders (free ice cream & register voters) in Pittsburgh, Philly, and State College – click on your location and sign up to RSVP and volunteer! https://discord.com/channels/1242249109298221066/1268426751164551199/1286391969173475422"
1286503172797501574,Default,,2024-09-20T01:44:18.468+00:00,katbird11,Kathleen K. (PA) CALL MOD,1266903223365668995,assets\4bb7ee9894467720a15dc7fc1963859c-3C37C.png,<@1277610022247071764> i know the Allentown and Bethlehem office will give out canvassing lists in days other than the canvassing event days. I assume the others do as well.  It takes a little searching to find the location of the offices in a given area
1286520159128916040,Reply,1286063531376250975,2024-09-20T02:51:48.325+00:00,mariebroph2677695,Marie B. | PA/NJ | OE/KC,941196169852366859,assets\4412fd436c9a7d43a1770d5771bbdd0c-8CC79.png,Talk to an organizer. The reason why I'm saying this is because I remember a woman who used to do this. Start with contacting a county party office. They might know of a contact.
1286520180809273394,Default,,2024-09-20T02:51:53.494+00:00,kendle_haught,kendle_haught,1285821940736462858,assets\8569adcbd36c70a7578c017bf5604ea5-9B640.png,Any Pittsburgh folks here?!
1286520570346868800,Reply,1286051071017488395,2024-09-20T02:53:26.367+00:00,mariebroph2677695,Marie B. | PA/NJ | OE/KC,941196169852366859,assets\4412fd436c9a7d43a1770d5771bbdd0c-8CC79.png,"If you can make the drive, I know Bucks County which is about an hour south of Allentown needs a lot of help in their offices with everything from sending canvasssers out to doing the canvassing."
1286520763784101961,Reply,1286036157871820912,2024-09-20T02:54:12.486+00:00,mariebroph2677695,Marie B. | PA/NJ | OE/KC,941196169852366859,assets\4412fd436c9a7d43a1770d5771bbdd0c-8CC79.png,"Check the <#1268426751164551199> channel. Also, check with groups like VoteForward."
1286521517730955265,Reply,1285926650487509012,2024-09-20T02:57:12.241+00:00,mariebroph2677695,Marie B. | PA/NJ | OE/KC,941196169852366859,assets\4412fd436c9a7d43a1770d5771bbdd0c-8CC79.png,"Looks like the nearest one is in Wayne. I searched for events around KOP and found canvassing locations with a launch point of Wayne. I'm not 100% familiar with the area since I'm in Bucks County but I'm sure if you click the link and do a new search, you can find information. https://www.mobilize.us/mobilize/event/664893/"
1286522394529497120,Reply,1286304946857312337,2024-09-20T03:00:41.286+00:00,mariebroph2677695,Marie B. | PA/NJ | OE/KC,941196169852366859,assets\4412fd436c9a7d43a1770d5771bbdd0c-8CC79.png,"I had to look up why and it doesn't shock me. Mostly red county. Sadly, we see that a lot in PA. It's why we're so purple. Also, Anthony is right about the voting laws."
1286522713510383616,Reply,1286327122369052732,2024-09-20T03:01:57.337+00:00,mariebroph2677695,Marie B. | PA/NJ | OE/KC,941196169852366859,assets\4412fd436c9a7d43a1770d5771bbdd0c-8CC79.png,"You had that issue too? My VBM ballot got lost in the mail the last time. Thankfully I'm in more purple Bucks County and was told if I went to the satelite office that the county had a town over from me, they would print me out a new one. They even had a drop box for me to put it in."
1286525868562448404,Reply,1286051071017488395,2024-09-20T03:14:29.56+00:00,kaye23.,Kaye23,1139160749965586463,assets\6c5996770c985bcd6e5b68131ff2ba04-58AC6.png,"Mobilize.us/2024PaVictory 

and put in the city where you will be going. Or zip."
1286528962507571300,Reply,1286522394529497120,2024-09-20T03:26:47.214+00:00,twanathan,Anthony D. [PA],919266668574810122,assets\a83e87e798ebaa7348a3e1045f867690-F0776.png,"In the article that started this, the city manager talks about how she cannot ensure there is video surveillance and round the clock security around the mailboxes which can only come from right wing provisions in the voting laws such that if the manager did allow the voting boxes, the county could be sued and potentially have the mail in ballots thrown out by a PA Supreme Court that is anyone’s guess in terms of how they would rule in a case like that"
1286531091058131046,Reply,1286528962507571300,2024-09-20T03:35:14.7+00:00,mariebroph2677695,Marie B. | PA/NJ | OE/KC,941196169852366859,assets\4412fd436c9a7d43a1770d5771bbdd0c-8CC79.png,Which is weird because where I live the drop boxes are either in a county building or their in a place like a police station. For instance where I live in Bucks County I could go to the satellite office for my County government services or I could take it to a Dropbox that's right in the town hall where the police station for my town is. That's really weird but that's Pennsylvania for you.
1286531139162345513,Reply,1286521517730955265,2024-09-20T03:35:26.169+00:00,gabbywpa85,Gabrielle Weiss (PA),1268364888670208133,assets\9aba90e71ef985acd9142b3316cfaab0-2D0BF.png,"Wayne and KOP are very close to each other, about 10 minutes (more if there’s traffic). I know that area super well!"
1286531421401383016,Reply,1286531139162345513,2024-09-20T03:36:33.46+00:00,mariebroph2677695,Marie B. | PA/NJ | OE/KC,941196169852366859,assets\4412fd436c9a7d43a1770d5771bbdd0c-8CC79.png,Okay thanks for letting me know. Like I said I don't really know that area too well because I'm originally from Southern New Jersey for one and for another while I live near Philadelphia I'm in lower Bucks County so I'm more familiar with that area and Northeast Philly.
1286532393968078869,Reply,1286531091058131046,2024-09-20T03:40:25.338+00:00,twanathan,Anthony D. [PA],919266668574810122,assets\a83e87e798ebaa7348a3e1045f867690-F0776.png,There is likely a 24/7 camera available near town hall and the police station that can tape the drop box.
1286537849998544976,Reply,1286532393968078869,2024-09-20T04:02:06.157+00:00,mariebroph2677695,Marie B. | PA/NJ | OE/KC,941196169852366859,assets\4412fd436c9a7d43a1770d5771bbdd0c-8CC79.png,That's why most municipalities put the dropboxes in the town hall.
1286538060388892705,Reply,1286537849998544976,2024-09-20T04:02:56.318+00:00,twanathan,Anthony D. [PA],919266668574810122,assets\a83e87e798ebaa7348a3e1045f867690-F0776.png,Agreed. For some reason I guess they didn’t? I dunno. It’s crazy we even have to have this discussion lol
1286584506941182032,Reply,1286392219053592666,2024-09-20T07:07:30.039+00:00,joannwaters_06060,JoAnn Waters [PA],1256044140290900008,assets\3-FB033.png,Where are the events listed?
1286643449424121897,Reply,1286584506941182032,2024-09-20T11:01:43.022+00:00,fltadmlwolf,Jordan K.,201533180434448385,assets\29da332e3f8721844d4eab7d9c8b42fa-62E9F.png,The mods deleted the link. Search Google for “scoop the vote”
1286654734186319916,Reply,1286520180809273394,2024-09-20T11:46:33.519+00:00,cybershadowsociologist,Sean Mack [Pennsylvania],481968292718968836,assets\dca21f6a7a29c78df30475e4cd282d40-16AD5.png,Yes!
1286672475492581438,Reply,1286522713510383616,2024-09-20T12:57:03.376+00:00,aglina,Angelina Veneziano (PA),798691543804280882,assets\e74f1901327791fc825282cd373320b5-C8494.png,We still have mail issues because of what they did in 2020 so I'm not surprised.
1286788491132407961,Reply,1286672475492581438,2024-09-20T20:38:03.66+00:00,mariebroph2677695,Marie B. | PA/NJ | OE/KC,941196169852366859,assets\4412fd436c9a7d43a1770d5771bbdd0c-8CC79.png,"To be honest, most of the mail issues are also because of what the postmaster general has done. I found this out from a friend in Georgia who told me that they've experienced the same issues and it was so bad that even mail that was not election related has had issues."
1286796630300950640,Reply,1286788491132407961,2024-09-20T21:10:24.189+00:00,aglina,Angelina Veneziano (PA),798691543804280882,assets\e74f1901327791fc825282cd373320b5-C8494.png,It all stems from that... yes.
1286819457540427808,Default,,2024-09-20T22:41:06.627+00:00,roofpv,Susie (PA),631653524366688256,assets\a96e1c0f3e8422610dd84aff5f158cf5-2B9AB.png,every day there are new Harris signs!
1286858684487565412,Reply,1286796630300950640,2024-09-21T01:16:59.06+00:00,mariebroph2677695,Marie B. | PA/NJ | OE/KC,941196169852366859,assets\4412fd436c9a7d43a1770d5771bbdd0c-8CC79.png,It's really messed up a lot of things from vote by mail to just getting your mail. My dad had a bill that went to collection for that reason. Thankfully the collection people are taking a payment installment.
1286869048969134195,Reply,1286537849998544976,2024-09-21T01:58:10.145+00:00,gabbywpa85,Gabrielle Weiss (PA),1268364888670208133,assets\9aba90e71ef985acd9142b3316cfaab0-2D0BF.png,Ours is next to the township building.
1287019872542261370,Default,,2024-09-21T11:57:29.287+00:00,katbird11,Kathleen K. (PA) CALL MOD,1266903223365668995,assets\4bb7ee9894467720a15dc7fc1963859c-3C37C.png,Waiting on line bright and early for the rally with Walz in Bethlehem
1287055987022495786,Default,,2024-09-21T14:20:59.65+00:00,apfee2024_81383,howdyfriends (KY),1274293080794595339,assets\eb95501477beed1d0f8fde71864b6435-9F719.png,One place where you can watch <:WalzSmile:1270424129853456445>  online => https://www.tiktok.com/live/event/7417085672030208046?enter_from=personal_live_event_card
1287070783994200157,Default,,2024-09-21T15:19:47.523+00:00,kanyewestphalia,Nathan Lange [D.C.],1197224361900388424,assets\7d9c8728c2a07d164d59fc221d8ea724-DAEA3.png,From DC here. Tried signing up for a carpool to Pa. but haven’t heard back. Any help?
1287077903892480022,Default,,2024-09-21T15:48:05.039+00:00,meanderingstone6495,Autumn S [AR]🤘• Lead Mod/OE Mod,936622618293968958,assets\af45a372ba919e7bac10686b43e799f1-BDEE3.png,Is there a contact listed where you originally signed up?
1287080098587217983,Default,,2024-09-21T15:56:48.295+00:00,kanyewestphalia,Nathan Lange [D.C.],1197224361900388424,assets\7d9c8728c2a07d164d59fc221d8ea724-DAEA3.png,https://l.facebook.com/l.php?u=https%3A%2F%2Fmailchi.mp%2Fjoebiden%2Fphillyforharriswalz-social-media-toolkit-philly-rally-with-vp-harris-and-gov-walz-6737599%3Fe%3D80a2274ebc%26fbclid%3DIwZXh0bgNhZW0CMTEAAR3h8DVM8l2jl1ArbAMVBcraM4NeCFA601bhkqtQnhgy0Eis4qrY6eoyR6E_aem_maCTS-3JRDnGEtQSl7Q6cA&h=AT2Wj9hBIxyulSeb2wHHFz0_nJKz2A3oLMzD8eW7XtoSW_Kuwh78OfjRNPW2sGclgikmBkrQy1cjXvzYm9KS9zebBuN6nRGbki3r4_EJbuziGtmp9OHB49HsE3o3FQ6ZE9iGC6HfRA&__tn__=%2CmH-R&c[0]=AT06QZ9dKmLhayh5UP0UAp7V4Jc4-8_AkuQ8Ifor77jZlQXtV4sXH-h6vWqwohfaq365LtCNPNOV9tTzgv79NMQazN-thcSZ4yMbxFNLAyoNtgeoirdMfw9EREHd_uRw4JbRbci1Vg7AdHdMBtO0SQq3nol4IwM7K5uv5bhDy9iC8ejJor_QS2ItjOLj-XAX0GdGqpcfmEaPXeuV0REXVw8RFOmFOqI
1287080221165617184,Default,,2024-09-21T15:57:17.52+00:00,kanyewestphalia,Nathan Lange [D.C.],1197224361900388424,assets\7d9c8728c2a07d164d59fc221d8ea724-DAEA3.png,Out-of-state intake form
1287127355864911994,Reply,1287070783994200157,2024-09-21T19:04:35.308+00:00,kristinbdc,Kristin B DC,1282822962961190924,assets\0-EB806.png,"Hi Nathan, I replied to you privately, but you might have to accept a ""friend request"" for the DM to go through.  (Not sure about that.). We have a carpool going up to Lancaster from DC with (at last count) two seats available."
1287152231514378333,Default,,2024-09-21T20:43:26.125+00:00,kanyewestphalia,Nathan Lange [D.C.],1197224361900388424,assets\7d9c8728c2a07d164d59fc221d8ea724-DAEA3.png,Just emailed you
1287460472798318683,Default,,2024-09-22T17:08:16.574+00:00,232nate,Nate S. __[PA]__,496516979436421120,assets\490738cb55259f8b3069003307cf4e0e-2C5EA.png,I have Trump supporter friend that asked me on FB to name the one policy the Harris Walz has that makes me the most excited. How would you answer that question?
1287468615544868894,Default,,2024-09-22T17:40:37.956+00:00,gabbywpa85,Gabrielle Weiss (PA),1268364888670208133,assets\9aba90e71ef985acd9142b3316cfaab0-2D0BF.png,Just saw a 6 car Trump procession pass me. Had flags and everything. 🤢🤮 But I’ve also seen at least 10 Kamala yard signs!
1287477469460430949,Reply,1287460472798318683,2024-09-22T18:15:48.894+00:00,newyorkerforharris2024,Kel,1278144299678171250,assets\4-4551A.png,This link might be helpful when answering questions about policy https://kamalaharris.com/issues/
1287477629607215187,Default,,2024-09-22T18:16:27.076+00:00,232nate,Nate S. __[PA]__,496516979436421120,assets\490738cb55259f8b3069003307cf4e0e-2C5EA.png,"Thank you, I’ll check it out now"
1287477728781533194,Default,,2024-09-22T18:16:50.721+00:00,newyorkerforharris2024,Kel,1278144299678171250,assets\4-4551A.png,"and here's another link showing what the Biden/Harris administation has actually done while in office. It's great, you can look at each state and some cities https://www.whitehouse.gov/invest/state-fact-sheets/"
1287497529985863763,Reply,1287460472798318683,2024-09-22T19:35:31.696+00:00,apfee2024_81383,howdyfriends (KY),1274293080794595339,assets\eb95501477beed1d0f8fde71864b6435-9F719.png,"I would point to her policies about taxes or prices:
* H/W's /issues page states that no one making more than $400K will pay more taxes. In contrast, the nonpartisan Tax Policy Center (to name one such group opposing Trumponomics 2024) says Trump's plan to make his earlier tax cuts (for rich people) would increase the national debt by more than $4 trillion over the next 10 years, and *increase* taxes for 13% of middle-income Americans. 
* On prices, the H/W agenda calls out ""anti-competitive practices that let big corporations jack up prices and undermine the competition."" This is where the issues lie—corporate greed. In general I have been really excited to hear both H and W talk about shifting some of the power away from corporations and back to workers. Like, they spend a *lot* of time on it. Also: Walz is not rich—he doesn't even own stock—so he likely goes to the supermarket himself sometimes and knows first-hand. 

Personally neither of the above is my #1 reason for backing H/W—my top reasons are ""won't sell out to dictators"" and ""won't become a dictator""—but I thought about what my Western PA dad would complain about."
1287567922197303427,Default,,2024-09-23T00:15:14.507+00:00,shesepuede,Tai [Mod & Kamala's Captain],957309531308822639,assets\455d163d4abd434dfbbea9e687c97e27-74EF4.png,Update on ballots: https://theconversation.com/pennsylvanias-mail-in-ballot-system-has-a-problem-but-its-not-what-trump-is-making-unfounded-claims-about-237839
1287825666779381941,Default,,2024-09-23T17:19:25.604+00:00,gabbywpa85,Gabrielle Weiss (PA),1268364888670208133,assets\9aba90e71ef985acd9142b3316cfaab0-2D0BF.png,Finally grabbed a photo of this
1287825767740346430,Default,,2024-09-23T17:19:49.675+00:00,gabbywpa85,Gabrielle Weiss (PA),1268364888670208133,assets\9aba90e71ef985acd9142b3316cfaab0-2D0BF.png,"Yes I know, I was driving. Don’t start"
1287831438733082877,Default,,2024-09-23T17:42:21.745+00:00,jack.246012,Jack (KC),1276396030375624789,assets\1b105b23ea580bad6169b556d3b7ebc4-4403D.png,"Hi PA friends, I know you guys have a lot on your plate so I'll be as short as I can.  Early voting (varies by county) is currently underway, please click the first link to review all the important deadlines and answers to frequently asked questions.  And please click on the second link to review your counties early voting times and drop off locations.  I just helped a PA voter and she didnt know about early voting in Deleware county.  So dont delay, make a plan to vote today!  https://www.vote411.org/ state=PA https://vote.pa/early/"
1287865192948039723,Default,,2024-09-23T19:56:29.377+00:00,kimmai,Kimmai • Mod,381286854059884545,assets\2b7bae57ddbd0d84b7da8969f39cb4e7-1F88B.png,"Thanks so much for sharing, Jack!"
1287866913803735136,Default,,2024-09-23T20:03:19.661+00:00,jack.246012,Jack (KC),1276396030375624789,assets\1b105b23ea580bad6169b556d3b7ebc4-4403D.png,My pleasure Kimmai!  I'll be doing this for every state.  And please let me know if you have any question!
1287881777393696839,Reply,1287468615544868894,2024-09-23T21:02:23.417+00:00,mariebroph2677695,Marie B. | PA/NJ | OE/KC,941196169852366859,assets\4412fd436c9a7d43a1770d5771bbdd0c-8CC79.png,I know Harris supporters have done that in some places. I'm actually hoping they do that again somewhere in Bucks County since I loved when a bunch of them drove past a canvas launch site in Bensalem in 2020 with Biden signs.
1287882174271455252,Reply,1287881777393696839,2024-09-23T21:03:58.04+00:00,gabbywpa85,Gabrielle Weiss (PA),1268364888670208133,assets\9aba90e71ef985acd9142b3316cfaab0-2D0BF.png,At least they weren’t honking so I guess that’s something
1287882261072711753,Default,,2024-09-23T21:04:18.735+00:00,gabbywpa85,Gabrielle Weiss (PA),1268364888670208133,assets\9aba90e71ef985acd9142b3316cfaab0-2D0BF.png,I’d love a Kamala procession!!
1287882582561652788,Reply,1287831438733082877,2024-09-23T21:05:35.384+00:00,mariebroph2677695,Marie B. | PA/NJ | OE/KC,941196169852366859,assets\4412fd436c9a7d43a1770d5771bbdd0c-8CC79.png,"Just so everyone knows, you can apply for a vote by mail ballot now. Use the links Jack mentioned. The ballots will start hitting mail boxes around October so check with your county. PS. If you live in Bucks County, they start mailing out in mid-October."
1287883100264599623,Default,,2024-09-23T21:07:38.814+00:00,jack.246012,Jack (KC),1276396030375624789,assets\1b105b23ea580bad6169b556d3b7ebc4-4403D.png,"Also!  If your name does not appear on a poll book, if you dont have the correct id, or if an election offical says you cant vote, you have the right to request a provisional ballot!!"
1287883720971522062,Reply,1287883100264599623,2024-09-23T21:10:06.802+00:00,mariebroph2677695,Marie B. | PA/NJ | OE/KC,941196169852366859,assets\4412fd436c9a7d43a1770d5771bbdd0c-8CC79.png,"I know also in PA, the only time you're really asked for ID is when it's your first time voting in any precinct, and it can be as simple as a piece of mail addressed to you, however, Jack is right about the rest of that stuff. Another pro-tip, if you're going to your election office to get an on-demand VBM (vote by mail) ballot, I find showing them ID helps find you quicker when you hand them the paperwork."
1287884341749350512,Default,,2024-09-23T21:12:34.807+00:00,jack.246012,Jack (KC),1276396030375624789,assets\1b105b23ea580bad6169b556d3b7ebc4-4403D.png,You can request a no excuse mail in ballot RIGHT NOW!!!  Please dont delay! https://www.pa.gov/en/agencies/vote/voter-support/mail-in-and-absentee-ballot.html
1287884641193168968,Default,,2024-09-23T21:13:46.2+00:00,jack.246012,Jack (KC),1276396030375624789,assets\1b105b23ea580bad6169b556d3b7ebc4-4403D.png,"There will be long lines on election day, but you have the right to stay in line after the polls close.  But the more people who vote early or by mail, the more convicent it will be on election day"
1287889042914017364,Reply,1287884341749350512,2024-09-23T21:31:15.652+00:00,mariebroph2677695,Marie B. | PA/NJ | OE/KC,941196169852366859,assets\4412fd436c9a7d43a1770d5771bbdd0c-8CC79.png,It's always the ones that work the phone banks who have this information. I also worked as a field volunteer for years before a knee injury forced me to go digital with my work so I know this stuff from that as well. LOL
1287889327845675111,Default,,2024-09-23T21:32:23.585+00:00,jack.246012,Jack (KC),1276396030375624789,assets\1b105b23ea580bad6169b556d3b7ebc4-4403D.png,And another thing!  Your state supreme court said all mail in ballots must have the correct date or they WILL NOT be counted!!
1288047423402545256,Default,,2024-09-24T08:00:36.503+00:00,apfee2024_81383,howdyfriends (KY),1274293080794595339,assets\eb95501477beed1d0f8fde71864b6435-9F719.png,"Just saw this—""Polish Pennsylvanians endorse Kamala Harris over Putin, Ukraine concerns""—but can't find the actual letter and full list of signatures posted anywhere. Maybe one or more signatories posted it to their social media. https://keystonenewsroom.com/2024/09/23/kamala-harris-pa-polish-outreach/"
1288047556101668876,Default,,2024-09-24T08:01:08.141+00:00,apfee2024_81383,howdyfriends (KY),1274293080794595339,assets\eb95501477beed1d0f8fde71864b6435-9F719.png,Learned about it via https://www.threads.net/@kamalahq/post/DAREkNtxrn-
1288151085864718391,Reply,1288149440590385173,2024-09-24T14:52:31.56+00:00,apfee2024_81383,howdyfriends (KY),1274293080794595339,assets\eb95501477beed1d0f8fde71864b6435-9F719.png,That's the same link
1288151221198131200,Default,,2024-09-24T14:53:03.826+00:00,i_am_anxious02,Jake Henderson (NJ-2) [MOD],648018187342053395,assets\ee6fcc15dae8462931d1ad1c70c5d780-D008C.png,Oh
1288151243658756106,Default,,2024-09-24T14:53:09.181+00:00,i_am_anxious02,Jake Henderson (NJ-2) [MOD],648018187342053395,assets\ee6fcc15dae8462931d1ad1c70c5d780-D008C.png,I’m not particularly smart
1288151299178758295,Default,,2024-09-24T14:53:22.418+00:00,i_am_anxious02,Jake Henderson (NJ-2) [MOD],648018187342053395,assets\ee6fcc15dae8462931d1ad1c70c5d780-D008C.png,My fault
1288151407664300122,Reply,1288151243658756106,2024-09-24T14:53:48.283+00:00,apfee2024_81383,howdyfriends (KY),1274293080794595339,assets\eb95501477beed1d0f8fde71864b6435-9F719.png,I disagree 😀
1288185005448630312,Default,,2024-09-24T17:07:18.619+00:00,jrneldam4thepeople,jrneldam,709172710223380630,assets\0d827b663c6f5b5b09ad800a5ce1c6ae-2DF4C.png,"I'm a CA resident that is interested in moving to PA for the final month of the campaign to help organize. I can pay my own way to get to wherever I will be most helpful to the campaign, but I was hoping there might be another volunteer or member of the campaign that has a spare room that I could stay at while I volunteer. Please let me know (in DMs) if anyone can help connect me with the right person!"
1288225012414812211,Default,,2024-09-24T19:46:17.023+00:00,elisha0644,ElishaE0644,1036323578326569000,assets\177d2fe021a4e672400d57899efdf0d5-9D2D9.png,"Hello All!  I'm an OR resident coming to Pittsburgh from 10/3-10/21, to help with the campaign. I am available to volunteer full time, 40+ hours a week for the 3 weeks I am there.  I recently retired from a middle management ""Big 5"" corporate job, so have lots of skills and am ready to be put to work.  I will also have a car.  Who can I reach out to get involved?  <@1260983976483356767> or <@941196169852366859> - I signed up for slack.  Please feel free to PM me.  I am happy to sign up on Mobilize, however, that seems for more 1 off opportunities.  Didn't know if having someone dedicated for 3 weeks straight could be used for other things?  Please let me know.  Thanks!"
1288245223352438837,Default,,2024-09-24T21:06:35.686+00:00,carb.on,Carolyn • Lead Mod,568257600228032512,assets\28a90c77b5793d80eb62484a43c66748-D8837.png,Hi <@709172710223380630> I have QR codes for bus trips every weekend in Oct. from SoCal to canvass in AZ and NV with accommodation included. Please send me a friend request because I can't post QRs here.
1288335650667495446,Default,,2024-09-25T03:05:55.238+00:00,kendle_haught,kendle_haught,1285821940736462858,assets\8569adcbd36c70a7578c017bf5604ea5-9B640.png,Does anyone know any details about time/location of the Pittsburgh event tomorrow? I’m a local and would love to see her!!
