id,type,ref_to,timestamp,author_name,author_nickname,author_id,author_avatar_url,content
1277418624566689894,21,1277254493892776025,2024-08-26T00:05:33.387+00:00,kristinmaschka_63872,Kristin Maschka,1275159059187765289,assets\8ba05dbb30be1312ec42e1f5a03adb0c-5449F.png,
1277418627162833007,Default,,2024-08-26T00:05:34.006+00:00,kristinmaschka_63872,Kristin Maschka,1275159059187765289,assets\8ba05dbb30be1312ec42e1f5a03adb0c-5449F.png,"<@1275513993665974363> So for example, in Pasadena our Democratic clubs rent a physical headquarters in town where you can volunteer. Where are you? I can help you figure out if there is something near you."
1277419198427173014,Default,,2024-08-26T00:07:50.206+00:00,kristinmaschka_63872,Kristin Maschka,1275159059187765289,assets\8ba05dbb30be1312ec42e1f5a03adb0c-5449F.png,Oh I see you are in San Diego like <@599409324715933747>  let me take a look at what's in that area.
1277419533442875535,Default,,2024-08-26T00:09:10.08+00:00,kristinmaschka_63872,Kristin Maschka,1275159059187765289,assets\8ba05dbb30be1312ec42e1f5a03adb0c-5449F.png,Check this link https://www.sddemocrats.org/contact.html
1277419640749822125,Default,,2024-08-26T00:09:35.664+00:00,kristinmaschka_63872,Kristin Maschka,1275159059187765289,assets\8ba05dbb30be1312ec42e1f5a03adb0c-5449F.png,It lists an HQ and a general email you can contact or call to ask  where you can walk in and join.
1277420412850016266,ChannelNameChange,,2024-08-26T00:12:39.747+00:00,kristinmaschka_63872,Kristin Maschka,1275159059187765289,assets\8ba05dbb30be1312ec42e1f5a03adb0c-5449F.png,Changed the channel name: How to Find Local Democratic HQ for in person
