id,type,ref_to,timestamp,author_name,author_nickname,author_id,author_avatar_url,content
1291244239329558589,Default,,2024-10-03T03:43:36.814+00:00,anniekate76,Andrea C [WI] • Mod,359726068954955776,assets\e3f51d2362ade0d88a04720e3dc4402c-8F686.png,"It’s hard enough to get citizens to vote, imagine trying to convince a non citizen to risk prison and deportation just to get Kamala one extra vote."
1291376700558671963,Default,,2024-10-03T12:29:58.032+00:00,lapfel2024_81383,apfel4harris (NY/abroad),1274293080794595339,assets\1303b6be213537796f03663d46f2634d-369E3.png,Liz Cheney's appearing at the rally today in Ripon: https://www.nbcnews.com/politics/2024-election/liz-cheney-hits-trail-kamala-harris-republican-party-wisconsin-rcna173713
1291384719425929216,Default,,2024-10-03T13:01:49.879+00:00,urielberman1.3,Uriel Berman (FL),1267218248491991095,assets\1-B2132.png,What time is the rally??
1291394846556426270,Default,,2024-10-03T13:42:04.375+00:00,emersoninoblivion,Emerson,435804995355672589,assets\34e532d76a31012dd4eb0361b763b11d-F6B2E.png,are there other wisconsin rallys happening? any more southern? (thats a 2+ hour drive from me)
1291395272089272380,Default,,2024-10-03T13:43:45.83+00:00,emersoninoblivion,Emerson,435804995355672589,assets\34e532d76a31012dd4eb0361b763b11d-F6B2E.png,"I'm still figuring out the server, sorry if theres a area for that"
1291420764385579190,Reply,1291395272089272380,2024-10-03T15:25:03.667+00:00,urielberman1.3,Uriel Berman (FL),1267218248491991095,assets\1-B2132.png,Hi <@435804995355672589> I’m not a mod but the best place to ask that I think is <#1242264162948874360>
1291420874632724513,Default,,2024-10-03T15:25:29.952+00:00,urielberman1.3,Uriel Berman (FL),1267218248491991095,assets\1-B2132.png,Mods don’t usually come onto this channel but they are always their
1291439586462924971,Default,,2024-10-03T16:39:51.2+00:00,lapfel2024_81383,apfel4harris (NY/abroad),1274293080794595339,assets\1303b6be213537796f03663d46f2634d-369E3.png,WI business group running ads for Harris https://eu.jsonline.com/story/news/politics/elections/2024/10/01/wisconsin-business-leaders-group-backs-harris-launches-ad-campaign/75455062007/
1291477496520380507,Default,,2024-10-03T19:10:29.662+00:00,lapfel2024_81383,apfel4harris (NY/abroad),1274293080794595339,assets\1303b6be213537796f03663d46f2634d-369E3.png,One place where you can watch tonight's rally from Ripon: https://www.tiktok.com/live/event/7421564632097095722?enter_from=personal_live_event_card
1291492960051134588,Default,,2024-10-03T20:11:56.455+00:00,meanderingstone6495,Autumn S [AR]🤘• Lead Mod/OE Mod,936622618293968958,assets\af45a372ba919e7bac10686b43e799f1-BDEE3.png,Want to join me for this event? https://mobilize.us/s/ncZVaj
1291812494590873723,Default,,2024-10-04T17:21:39.426+00:00,lapfel2024_81383,apfel4harris (NY/abroad),1274293080794595339,assets\1303b6be213537796f03663d46f2634d-369E3.png,"Politico is right-wing crap now, but they've run an article about the Green Party's presence in WI that *might* be worth reading for intel and insights from Dem leaders that you don't already have. Remember that Stein had lunch with Mike Flynn and Putin, got help from Trump-aligned lawyers to stay on the ballot this cycle, and is generally uninformed about even the basics of US govt. Happy to share sources of info if you run into Stein voters and think you can sway them. https://www.politico.com/news/magazine/2024/10/03/wisconsin-green-party-00180283"
1291847194067865713,Default,,2024-10-04T19:39:32.426+00:00,meanderingstone6495,Autumn S [AR]🤘• Lead Mod/OE Mod,936622618293968958,assets\af45a372ba919e7bac10686b43e799f1-BDEE3.png,Want to join me for this event? https://mobilize.us/s/NPgfUm
1292095424760643715,Default,,2024-10-05T12:05:55.235+00:00,lapfel2024_81383,apfel4harris (NY/abroad),1274293080794595339,assets\1303b6be213537796f03663d46f2634d-369E3.png,"<:mega2:1269006580976976076> A reminder that we have a dedicated ⁠<#1288163431911788586> channel where we coordinate our efforts to post campaign content, leave comments, and upvote <:kamala1:1269028302203523114> <:WalzSmile:1270424129853456445> -related posts. Right now even supportive subreddits like r/politics are bombarded with Trump info, and we're trying to change that. Let's help people find information about our candidates and the brighter future they offer! Head on over to our channel and we'll plug you in with opportunities to contribute. Even if you have just one minute to help, you can make a difference."
1292120913235677244,Default,,2024-10-05T13:47:12.161+00:00,revengeofathena,Annika M.,341694351522398235,assets\212b2d543af3733d7ca9c176dd1707bd-F0C3F.png,"Hi! Long shot but I signed up to canvass today at noon <somewhere nearby> (Madison WI)— I signed up over the phone so I’m not totally sure what event though, just canvassing & sounded door to door. If any organizers are here and see this, and you had a late signup on Thursday- hi 👋 that might be me! Let me know where to go if you see this before noon. 

Otherwise I’ll just pick the closest event and hope it’s helping more than it causes chaos 😅"
1292133637323751515,Default,,2024-10-05T14:37:45.82+00:00,trumansleeps,Michael Pelaez | FL,389839010576465936,assets\3a91c3446fca9803ffb1d856364145a2-A8603.png,
1292341250703491175,Reply,1292120913235677244,2024-10-06T04:22:44.707+00:00,jayrio76,Jay E  (TX)  OE Mod,782870341445353522,assets\41ef520387924aa4413513eda28784df-34D82.png,"HI <@341694351522398235> I am not in WI, and I just saw this, but wanted to say I hope you had a good time, and thank you for volunteering. 🙂"
1292343719776751728,Default,,2024-10-06T04:32:33.38+00:00,urielberman1.3,Uriel Berman (FL),1267218248491991095,assets\1-B2132.png,Hey guys. I work for the WI Dems. We text/call voters and we are looking for help. Here is the mobolize link plz join if you can! https://www.mobilize.us/mobilize/event/663415/
1292434185432072222,Default,,2024-10-06T10:32:02.073+00:00,lapfel2024_81383,apfel4harris (NY/abroad),1274293080794595339,assets\1303b6be213537796f03663d46f2634d-369E3.png,"Thanks for all your efforts, WI team https://www.reddit.com/r/democrats/comments/1fx528g/signs_of_hope_deep_in_maga_country_rural_wisconsin/"
1292445979026391113,Default,,2024-10-06T11:18:53.885+00:00,lapfel2024_81383,apfel4harris (NY/abroad),1274293080794595339,assets\1303b6be213537796f03663d46f2634d-369E3.png,Nice: https://www.reddit.com/r/politics/comments/1fxe2id/veep_reunion_fundraiser_brings_in_735k_for/
1292472373567819867,Default,,2024-10-06T13:03:46.834+00:00,meanderingstone6495,Autumn S [AR]🤘• Lead Mod/OE Mod,936622618293968958,assets\af45a372ba919e7bac10686b43e799f1-BDEE3.png,Want to join me for this event? https://mobilize.us/s/PNzBX2
1292493076677525524,Default,,2024-10-06T14:26:02.84+00:00,lapfel2024_81383,apfel4harris (NY/abroad),1274293080794595339,assets\1303b6be213537796f03663d46f2634d-369E3.png,"<:mega2:1269006580976976076>  Heya, WI: Do we have any Reddit users in here? The Reddit Community team needs some help today with posting WI-centric, pro-Harris/Walz info in WI subreddits (state and city-level). We have everything set up for you—all we need are people to make the posts. Interested? Join here: https://discord.com/channels/1242249109298221066/1260651617867399188/1260728814540165162 and click the icon for Reddit (last option)."
1292999090443128934,Default,1292998988978716785,2024-10-07T23:56:45.923+00:00,lapfel2024_81383,apfel4harris (NY/abroad),1274293080794595339,assets\1303b6be213537796f03663d46f2634d-369E3.png,
1293290123232022642,Default,,2024-10-08T19:13:13.547+00:00,meanderingstone6495,Autumn S [AR]🤘• Lead Mod/OE Mod,936622618293968958,assets\af45a372ba919e7bac10686b43e799f1-BDEE3.png,Want to join me for this event? https://mobilize.us/s/6Cs1xV
1293721239679930390,Default,,2024-10-09T23:46:19.718+00:00,gabriellelynn_4444,Gabrielle Lynn [HFP Staff],1280619651029798924,assets\240de4e960e8591f3136c93fbf92c244-59538.png,"🗳️ 🗳️ 🗳️ 
<@&1245911026025889853>  Don’t wait! Register to vote online, by mail, or in-person in Wisconsin! Can you take a second today to make sure you and your network are all set to vote?
Here’s what you can do:

1. Reach out to everyone in your network with this message, that can also be found in Reach: 

Don’t wait! Register to vote online, by mail, or in-person in Wisconsin!  I’m reaching out to everyone I know to make sure their registration is up to date. This election is too important to miss. Will you check your registration status? Here’s the link: https://IWillVote.com/WI

2. Share this image on your social media! It can also be found in Reach! ✨ Make sure you’ve joined Reach for campaign updates here: https://app.reach.vote/join/7DRDMN
3. Check your own registration, at IWillVote.com/WI. 
React with ✅when you’ve done it!
🗳️ 🗳️ 🗳️"
1294274212579770400,Default,,2024-10-11T12:23:38.731+00:00,lapfel2024_81383,apfel4harris (NY/abroad),1274293080794595339,assets\1303b6be213537796f03663d46f2634d-369E3.png,Heads up https://www.reddit.com/r/wisconsin/comments/1g0lonx/is_this_legal/
1294697110674997339,Default,,2024-10-12T16:24:05.494+00:00,anniekate76,Andrea C [WI] • Mod,359726068954955776,assets\e3f51d2362ade0d88a04720e3dc4402c-8F686.png,Thanks! Can you please send this to the voter protection team?
1294697132158091385,Reply,1294274212579770400,2024-10-12T16:24:10.616+00:00,DemCord,DemCord,1242806362195365968,assets\007b625c296385e4ed52038a42c7256d-7649B.png,The Biden Team built a Super Structure in anticipation of this: https://tinyurl.com/bidensuperstructure
1294697546664640534,Reply,1294697110674997339,2024-10-12T16:25:49.442+00:00,lapfel2024_81383,apfel4harris (NY/abroad),1274293080794595339,assets\1303b6be213537796f03663d46f2634d-369E3.png,not sure how
1294697922306248734,Default,,2024-10-12T16:27:19.002+00:00,anniekate76,Andrea C [WI] • Mod,359726068954955776,assets\e3f51d2362ade0d88a04720e3dc4402c-8F686.png,
1294698038069166192,Default,,2024-10-12T16:27:46.602+00:00,anniekate76,Andrea C [WI] • Mod,359726068954955776,assets\e3f51d2362ade0d88a04720e3dc4402c-8F686.png,There should be info on Iwillvote.com
1294871223322415226,Default,,2024-10-13T03:55:57.184+00:00,meanderingstone6495,Autumn S [AR]🤘• Lead Mod/OE Mod,936622618293968958,assets\af45a372ba919e7bac10686b43e799f1-BDEE3.png,Want to join me for this High Hopes for Harris event? https://mobilize.us/s/1nez72
1294895299709370442,Default,,2024-10-13T05:31:37.442+00:00,anniekate76,Andrea C [WI] • Mod,359726068954955776,assets\e3f51d2362ade0d88a04720e3dc4402c-8F686.png,"Interesting article about Wisconsin’s undecideds. It seems like there are still some “double haters” - though way fewer than earlier in the year. We just need to find those folks and assuage whatever concerns they have about Kamala.

https://www.jsonline.com/story/news/politics/elections/2024/10/10/gilbert-what-polling-tells-us-about-wisconsins-undecided-voters/75579173007/"
1294998257856151623,Default,,2024-10-13T12:20:44.577+00:00,lapfel2024_81383,apfel4harris (NY/abroad),1274293080794595339,assets\1303b6be213537796f03663d46f2634d-369E3.png,"I'm not sure what a hodag is, but you all likely do https://www.reddit.com/r/wisconsin/comments/1g25fk5/saw_this_out_driving_today/"
1295845012940132383,Default,,2024-10-15T20:25:26.721+00:00,lapfel2024_81383,apfel4harris (NY/abroad),1274293080794595339,assets\1303b6be213537796f03663d46f2634d-369E3.png,"<:mega2:1269006580976976076> Calling all **Reddit users**: The <#1288163431911788586> team would love your help! We’re posting and boosting breaking, informative, and positive <:kamala1:1269028302203523114> + <:WalzSmile:1270424129853456445> news, as well as campaign-generated memes and screenshots of @kamalaHQ social media to turn the tide on Reddit from Orange to Blue! We especially need people who can post at r/politics, r/news, r/technology, and other large subreddits. Join here: https://discord.com/channels/1242249109298221066/1260651617867399188/1260728814540165162 and click the icon for Reddit (last option)."
1295865645837193217,Default,,2024-10-15T21:47:25.987+00:00,i_am_anxious02,Jake Henderson (NJ-2) [MOD],648018187342053395,assets\ee6fcc15dae8462931d1ad1c70c5d780-D008C.png,"Hey Wisconsinites, how’re things going? What are the vibes like?"
1295897279370231818,Default,,2024-10-15T23:53:08.009+00:00,m3rd,Martin Jarosinski  MN,198064957756145664,assets\d4361f20aefd5234df494fb4a92b0959-5B5C2.png,I think this was off I94 near Hudson
1295971240670003270,Default,,2024-10-16T04:47:01.757+00:00,parislors,stevie (IL),494319321548587038,assets\dbaea89ea57633790e28790373693ed9-EC70C.png,hey! i have a friend who works for wisdems and wants to collaborate with swifities for kamala is there anyone i can get her in touch with?
1296184919327899771,Default,,2024-10-16T18:56:06.719+00:00,urielberman1.3,Uriel Berman (FL),1267218248491991095,assets\1-B2132.png,prob ask a mod. the mods dont always check these channels!!
1296198753320964137,Default,,2024-10-16T19:51:05+00:00,meanderingstone6495,Autumn S [AR]🤘• Lead Mod/OE Mod,936622618293968958,assets\af45a372ba919e7bac10686b43e799f1-BDEE3.png,Want to join me for this event? https://mobilize.us/s/yCrvow
1296199836378337381,Reply,1295971240670003270,2024-10-16T19:55:23.221+00:00,meanderingstone6495,Autumn S [AR]🤘• Lead Mod/OE Mod,936622618293968958,assets\af45a372ba919e7bac10686b43e799f1-BDEE3.png,"You can get them to fill out https://docs.google.com/forms/d/e/1FAIpQLSd9FDXyXwss77IRPsvQgL-dLe53B045b15oSJzK64kFI7Qy2A/viewform

There is also a user on discord that has hosted events with Swifties focus <@1252341090892120162>"
1296204330055106650,Default,,2024-10-16T20:13:14.597+00:00,givemecoffeewineorcheese,Tammy F. (CO),890727112724607027,assets\b96e59aee6730c4266753ecdb386e6cd-B3645.png,"If anyone wants to join my Tammy Baldwin retweet twitter team, let me know. It is a group message and I drop Tammy Baldwin tweets for you to share at your leisure. Takes only a few minutes a day."
1296604671024300044,Default,,2024-10-17T22:44:03.322+00:00,anniekate76,Andrea C [WI] • Mod,359726068954955776,assets\e3f51d2362ade0d88a04720e3dc4402c-8F686.png,"What a gift to live in one of the key battleground states! Who is going to join me knocking doors this weekend? Let’s get out this vote, people! 🧀"
1296870660471132285,Default,,2024-10-18T16:21:00.148+00:00,gabriellelynn_4444,Gabrielle Lynn [HFP Staff],1280619651029798924,assets\240de4e960e8591f3136c93fbf92c244-59538.png,New Wisconsin content just dropped in Reach! Check out [these new graphics on rural investment in the state](<https://app.reach.vote/library/gallery/6580e1f3-0149-44c6-8b68-233ca9be2176?campaign=democrats>) <:happysun1:1270566006590541896>
1296915801298698331,Default,,2024-10-18T19:20:22.56+00:00,meanderingstone6495,Autumn S [AR]🤘• Lead Mod/OE Mod,936622618293968958,assets\af45a372ba919e7bac10686b43e799f1-BDEE3.png,"<:eyes:1252803301137842251>  Looking for more ways to get involved and get out the vote? **Join us Monday through Saturday for our GOTV Power Hours**, where you'll learn everything you need to know to reach out to your friends, family, and online communities and make sure they get out the vote! 🗳️ Sign up HERE: https://txt.democrats.org/GOTVHour 

<:retweet:1278893511780864010> Check out our priority content from Reach to share HERE: https://share.kamalaharris.com/toolkit/Discord-2f08"
1297001549075320833,Default,,2024-10-19T01:01:06.423+00:00,anniekate76,Andrea C [WI] • Mod,359726068954955776,assets\e3f51d2362ade0d88a04720e3dc4402c-8F686.png,"Tammy just killed that debate, 10/10 no notes"
1297001696383205396,Default,,2024-10-19T01:01:41.544+00:00,anniekate76,Andrea C [WI] • Mod,359726068954955776,assets\e3f51d2362ade0d88a04720e3dc4402c-8F686.png,https://www.youtube.com/live/UUrB8XoCLcU?si=x6F-loyIMGKRdSqp
1297011457317277787,Default,,2024-10-19T01:40:28.732+00:00,givemecoffeewineorcheese,Tammy F. (CO),890727112724607027,assets\b96e59aee6730c4266753ecdb386e6cd-B3645.png,yes she did great
1297022200619991050,Default,,2024-10-19T02:23:10.135+00:00,anniekate76,Andrea C [WI] • Mod,359726068954955776,assets\e3f51d2362ade0d88a04720e3dc4402c-8F686.png,"Eric Hovde brought his mail, like we know you moved here 5 minutes ago, dude. No one was claiming you are not currently a legal resident."
1297563044271882240,Default,,2024-10-20T14:12:17.31+00:00,marisak._74585,Marisa K. -(NY) [Mod]/KC TextMod,1268363112956952637,assets\19f0a12ecb0c947e057e402ffc5ebae4-846B0.png,In celebration of Kamala's birthday lets trade candles for calls and gifts for gumption! We're trying to reach over 3 million voters today! Can you help?  Knock out some calls while you are drinking your morning coffee and still be out in time to hit up a pumpkin patch! Join the [5M Dial-a-thon](https://events.democrats.org/event/730026/) and help make history!
1297645763861676232,Default,,2024-10-20T19:40:59.197+00:00,rebelbot,rebelbot,561040480553533470,assets\f25b78d54fdf332968e897b99a4762f3-23763.png,FYI https://www.mobilize.us/wisdems/event/726836/
1297699715177255044,Default,,2024-10-20T23:15:22.193+00:00,dramacrone,Maggie M [MD] • Community Mod,291311960417370112,assets\46b968d19f7a6528fb1e9ae77bf19fd5-B22D6.png,"**Courage is mastery of fear, not absence of fear.** Which [**Phone Bank with Team Harris-Walz**](https://events.democrats.org/event/725393/?utm_source=Discord&utm_medium=Posts&utm_campaign=Daily%20Engagement) are you signing up for right now?"
1297735618868154392,Default,,2024-10-21T01:38:02.3+00:00,sergiog_23,Sergio Godinez [HQ Staff],1284539093941878917,assets\ee799161042b479e8333da3e6691d0e8-CDB84.png,"<@&1245911026025889853> FOLKS, WE LOVE YA, AND YOUR DEDICATION TO THIS CAMPAIGN! WHAT IS OF IMMEDIATE HELP RIGHT NOW IS TO  HOP ON THE DIALER **RIGHT NOW** AND HELP US GET TO 5 MILLION CALLS!!! 

WE ARE LESS THAN 600K AWAY FROM IT, AND WE CAN DO THIS, BUT WE NEED ***ALL OF YOU TO HELP US GET THERE!***

HOP ON THE DIALER RIGHT NOW AND CALL SOME AWESOME WISCONSIN VOTERS: https://democrats.call.scaletowin.com/?t=f80c83d9-aa81-404c-9137-bbd269d6b1c7&ref=discord"
1297741471910330420,Default,,2024-10-21T02:01:17.774+00:00,kyaizen,Jared R [CO] • Lead Mod,112080668296564736,assets\a_de0e3d4a3f9b486ad3ad6df0d72323da-D0252.gif,NOW CALLING NV!! JOIN US! https://democrats.call.scaletowin.com/?t=09bd534e-841d-495f-b590-68e74150764e&ef=discord
1297760037288280134,Default,,2024-10-21T03:15:04.105+00:00,madison7026,Madison S. [NM] • [Mod],285222833640964099,assets\ed92212696edc19bf04c2c04193377dd-D4DA9.png,## We're back! We're getting SO close to our goal of 5 million goals and have one more hour to call west coast voters - [please come join us](https://democrats.call.scaletowin.com/?t=09bd534e-841d-495f-b590-68e74150764e&ef=discord) to call NV voters! Even a few calls helps us reach our goal. 🤩
1297938068850081845,Default,,2024-10-21T15:02:30.137+00:00,remarkable_beetle_72908,Lee Warner (NJ) • Mod,1268363534132183122,assets\993758d16f77a3b44e8daefcbe6f8a4d-997B4.png,"Happy Monday!

 We made almost 5 million calls this weekend to celebrate Kamala's birthday! 

How did get involved?: 

<:phone:1252803032346001479> Phone Bank Powerhouse
<:text_heart1:1270612783796584541> Text Bank Warrior
🚪 Steps-in Canvasser
<:9364_blobpumpkin:1285344377065046047> Something different
<:100:1252803350026653726> Didn't get on this weekend but will today! 


We still need you all on the phones!!! We are on them too!! Join us!  [Phonebank with Team Harris-Walz ](https://events.democrats.org/event/725393/?utm_source=Discord&utm_medium=Posts&utm_campaign=Daily%20Engagement)today!! Will you join us?!  <:100:1252803350026653726>"
