id,type,ref_to,timestamp,author_name,author_nickname,author_id,author_avatar_url,content
1277430777185042515,21,1277399352104718427,2024-08-26T00:53:50.797+00:00,nmorris237,Nicole Morris - Text Admin,935762347753103382,assets\27b1e286b65ae02b3378793b5f098411-A7B20.png,
1277430778640339018,Default,,2024-08-26T00:53:51.144+00:00,nmorris237,Nicole Morris - Text Admin,935762347753103382,assets\27b1e286b65ae02b3378793b5f098411-A7B20.png,"Hi <@589189350848200706> Thanks! Did you take a recent training with us, or are you a texter on our Slack channels?"
1277431273194786836,Default,,2024-08-26T00:55:49.055+00:00,rainedownonme,RaineDownOnMe,589189350848200706,assets\209490c3dc67409ee58f871daa8030d5-08041.png,I've taken the texting class twice because I don't understand why I'm not seeing what I should see and when I tried to ask for the training to be sent to us so I could like rewatch or slow it down because the trainers are clicking through so fast to see what I missed? I don't know
1277431671141957662,Default,,2024-08-26T00:57:23.933+00:00,rainedownonme,RaineDownOnMe,589189350848200706,assets\209490c3dc67409ee58f871daa8030d5-08041.png,
1277442978176041031,Default,,2024-08-26T01:42:19.74+00:00,nmorris237,Nicole Morris - Text Admin,935762347753103382,assets\27b1e286b65ae02b3378793b5f098411-A7B20.png,"Hi Raine - got it, and apologies for the. confusion! I will send you a follow up direct message now on Discord. Please look at the top left for the notificaiton."
1278015967418519563,Default,,2024-08-27T15:39:11.021+00:00,nmorris237,Nicole Morris - Text Admin,935762347753103382,assets\27b1e286b65ae02b3378793b5f098411-A7B20.png,Hi <@589189350848200706> Wanted to check to see if you saw my Direct Message on Discord?
1278030355734990918,Default,,2024-08-27T16:36:21.463+00:00,rainedownonme,RaineDownOnMe,589189350848200706,assets\209490c3dc67409ee58f871daa8030d5-08041.png,I saw it last night and will fill out after Swifties for Harris this evening 💙
1278160809046052917,Default,,2024-08-28T01:14:43.956+00:00,rainedownonme,RaineDownOnMe,589189350848200706,assets\209490c3dc67409ee58f871daa8030d5-08041.png,"Finished both, sorry Swifties ran a little over!"
1278172107544592446,Default,,2024-08-28T01:59:37.728+00:00,nmorris237,Nicole Morris - Text Admin,935762347753103382,assets\27b1e286b65ae02b3378793b5f098411-A7B20.png,No worries (and how fun!)
