id,type,ref_to,timestamp,author_name,author_nickname,author_id,author_avatar_url,content
1278422286919274558,21,1278416462704279694,2024-08-28T18:33:45.139+00:00,jjoannid,Jack Joannides KC text admin,477560366432256000,assets\791c521e62160be1f3df04992f6e5470-36A38.png,
1278422288051736657,Default,,2024-08-28T18:33:45.409+00:00,jjoannid,Jack Joannides KC text admin,477560366432256000,assets\791c521e62160be1f3df04992f6e5470-36A38.png,Have you taken an training yet?
1278422637743443988,Default,,2024-08-28T18:35:08.782+00:00,annmayer_12134,Ann Mayer (OR),1277040602424545342,assets\1-B2132.png,yes! filled out all the forms and quiz
1278422758094798890,Default,,2024-08-28T18:35:37.476+00:00,jjoannid,Jack Joannides KC text admin,477560366432256000,assets\791c521e62160be1f3df04992f6e5470-36A38.png,Great. You'll be added in 24-48 hours. Please stay patient with us.
1278422875094913095,Default,,2024-08-28T18:36:05.371+00:00,annmayer_12134,Ann Mayer (OR),1277040602424545342,assets\1-B2132.png,no worries! thanks for your work
